Titulo,Review,TipoViaje,Calificacion,OrigenAutor,FechaOpinion,FechaEstadia,Ciudad,Atraccion,TituloReview
Una muestra del paraíso,¡Playa Delfines es pura felicidad! Las suaves arenas blancas y las aguas cristalinas son impresionantes. Perfecto para relajarse o coger algunas olas. Una playa de visita obligada en Cancún para saborear el paraíso.,Amigos,5,"Kansas City, MO",2024-05-01,2024-05-01,Cancun,Playa Delfines,Una muestra del paraíso ¡Playa Delfines es pura felicidad! Las suaves arenas blancas y las aguas cristalinas son impresionantes. Perfecto para relajarse o coger algunas olas. Una playa de visita obligada en Cancún para saborear el paraíso.
Un viaje familiar hermoso con esa playa lo disfrutamos muchísimo.,"Hermosa playa, el oleaje estaba un poco fuerte pero aún así disfrutamos mucho los colores de la playa son hermosos, si quieres foto en las letras hay que llegar temprano porque se llena y hacen una fila enorme.",Familia,5,anonimo,2024-04-15,2024-04-01,Cancun,Playa Delfines,"Un viaje familiar hermoso con esa playa lo disfrutamos muchísimo. Hermosa playa, el oleaje estaba un poco fuerte pero aún así disfrutamos mucho los colores de la playa son hermosos, si quieres foto en las letras hay que llegar temprano porque se llena y hacen una fila enorme."
"Playa, Mirador y el letrero de Cancún","En otros viajes la habíamos visto desde la ruta y nos parecía hermosa, pero nunca tuvimos tiempo de disfrutarla. Ahora sí nos quedamos allí y fue la que más nos gustó de las que pudimos visitar.Es muy amplia y al ubicarse frente a mar abierto, tiene oleaje fuerte. Ofrece una extensa franja para estacionar, pero siempre que pasamos la vimos abarrotada y esta vez no fue la excepción.Para acceder a la playa en sí y al mar hay que caminar un tramo bastante empinado de arena, así que, ¡a mover las piernitas!, jajaj. Encontrarán infraestructura para utilizar libremente: muchas palapas, buenos baños, un gran mirador y las coloridas letras de “CANCÚN” para la infaltable foto, (aunque se debe hacer una larga cola esperando el turno).La vista es bella con arena blanca, mar turquesa y las olas bravas… disfrutamos mucho del avistaje de aves, revoloteando sobre el mar y lanzándose en picada para pescar su comida: una postal que nos encantó.Para quienes deseen comer algo ligero en la playa, a menos de 1 km hay una tienda de alimentación y una sandwichería de cadena.",Familia,5,"Córdoba, Argentina",2024-03-30,2023-10-01,Cancun,Playa Delfines,"Playa, Mirador y el letrero de Cancún En otros viajes la habíamos visto desde la ruta y nos parecía hermosa, pero nunca tuvimos tiempo de disfrutarla. Ahora sí nos quedamos allí y fue la que más nos gustó de las que pudimos visitar.Es muy amplia y al ubicarse frente a mar abierto, tiene oleaje fuerte. Ofrece una extensa franja para estacionar, pero siempre que pasamos la vimos abarrotada y esta vez no fue la excepción.Para acceder a la playa en sí y al mar hay que caminar un tramo bastante empinado de arena, así que, ¡a mover las piernitas!, jajaj. Encontrarán infraestructura para utilizar libremente: muchas palapas, buenos baños, un gran mirador y las coloridas letras de “CANCÚN” para la infaltable foto, (aunque se debe hacer una larga cola esperando el turno).La vista es bella con arena blanca, mar turquesa y las olas bravas… disfrutamos mucho del avistaje de aves, revoloteando sobre el mar y lanzándose en picada para pescar su comida: una postal que nos encantó.Para quienes deseen comer algo ligero en la playa, a menos de 1 km hay una tienda de alimentación y una sandwichería de cadena."
La playa con olas mas bonita de Cancun!!,"Dentro de las playas que tienen olas, pq las hay sin olas tambien, me parecio la de mejor infraestructura. Cuenta con sombrillas publicas, baños, mirador excepcional, esta bien conservada y limpia.",Pareja,4,"Buenos Aires, Argentina",2024-03-21,2024-03-01,Cancun,Playa Delfines,"La playa con olas mas bonita de Cancun!! Dentro de las playas que tienen olas, pq las hay sin olas tambien, me parecio la de mejor infraestructura. Cuenta con sombrillas publicas, baños, mirador excepcional, esta bien conservada y limpia."
Excelente playa,"Hermosa playa, súper limpia, con baño gratiuito y a veces agarra el WIFI público. Lo único malo es que no hay ninguna barra para comprar alcohol por lo que recomiendo llevarlo antes de ir.",Amigos,5,"Buenos Aires, Argentina",2024-03-20,2024-03-01,Cancun,Playa Delfines,"Excelente playa Hermosa playa, súper limpia, con baño gratiuito y a veces agarra el WIFI público. Lo único malo es que no hay ninguna barra para comprar alcohol por lo que recomiendo llevarlo antes de ir."
Me encanta,"Me encanta, aunque no es una playa para nadar en familia pues el oleaje es muy fuerte. Sin embargo las palapitas, los baños, las regaderas todo lo hacen especial. La vista es hermosa pues se aprecia el mar con todos sus colores",Familia,5,anonimo,2024-02-24,2024-01-01,Cancun,Playa Delfines,"Me encanta Me encanta, aunque no es una playa para nadar en familia pues el oleaje es muy fuerte. Sin embargo las palapitas, los baños, las regaderas todo lo hacen especial. La vista es hermosa pues se aprecia el mar con todos sus colores"
Muy bonita,"Muy bonita playa!.. hay sombrillas , y hay unos baños donde quitarte la arena ... Sugiero llegar temprano pues se llena de gente",Familia,5,anonimo,2024-02-05,2024-01-01,Cancun,Playa Delfines,"Muy bonita Muy bonita playa!.. hay sombrillas , y hay unos baños donde quitarte la arena ... Sugiero llegar temprano pues se llena de gente"
cancun,hermoso..  muy bello...muy amable la gente y muy buen clima...la playa limpia y sin sargazo...aguas cristalinas impecables,Familia,5,"Buenos Aires, Argentina",2024-02-03,2024-01-01,Cancun,Playa Delfines,cancun hermoso..  muy bello...muy amable la gente y muy buen clima...la playa limpia y sin sargazo...aguas cristalinas impecables
Playa publica hermosa,"Mi esposo y yo tuvimos una sesion de fotos en esta playa y parecia una alberca, estaba tan tranquilo, sin oleaje y sin sargazo! Lastima que alguna gente va a tomar bebidas alcoholicas ahi  y dejan la basura, es una pena, fuera de eso es un gran lugar para ir a caminar admirando el atardecer o el amanecer.",Pareja,5,"Monterrey, México",2024-01-11,2023-11-01,Cancun,Playa Delfines,"Playa publica hermosa Mi esposo y yo tuvimos una sesion de fotos en esta playa y parecia una alberca, estaba tan tranquilo, sin oleaje y sin sargazo! Lastima que alguna gente va a tomar bebidas alcoholicas ahi  y dejan la basura, es una pena, fuera de eso es un gran lugar para ir a caminar admirando el atardecer o el amanecer."
"Hermosa playa, sin tumbonas.",Hermosa playa.Sin tumbonas.Hay duchas y baños. Los baños estaban sucios. Y nada de papel higiénico. A menos que se lo pidas a una persona de afuera.,Familia,4,anonimo,2024-01-09,2023-12-01,Cancun,Playa Delfines,"Hermosa playa, sin tumbonas. Hermosa playa.Sin tumbonas.Hay duchas y baños. Los baños estaban sucios. Y nada de papel higiénico. A menos que se lo pidas a una persona de afuera."
Pintoresco,"Una playa absolutamente preciosa, con aguas cristalinas y olas suaves. Estuvimos allí siete horas. Tienen baños públicos, sombrillas gratuitas para sentarse debajo y algunos vendedores que venden bocadillos y bebidas en la playa más tarde ese mismo día. Si planea conseguir una sombrilla/sombrilla, asegúrese de llegar más temprano en el día (antes de las 11). También es un lugar muy popular para tomar fotografías, vimos dos sesiones de fotos de quinceañeras mientras estuvimos allí. El estacionamiento es una situación complicada, así que camina si puedes o llega antes para poder encontrar un lugar relativamente cerca.",Familia,5,"Costa de Georgia, GA",2024-01-08,2024-01-01,Cancun,Playa Delfines,"Pintoresco Una playa absolutamente preciosa, con aguas cristalinas y olas suaves. Estuvimos allí siete horas. Tienen baños públicos, sombrillas gratuitas para sentarse debajo y algunos vendedores que venden bocadillos y bebidas en la playa más tarde ese mismo día. Si planea conseguir una sombrilla/sombrilla, asegúrese de llegar más temprano en el día (antes de las 11). También es un lugar muy popular para tomar fotografías, vimos dos sesiones de fotos de quinceañeras mientras estuvimos allí. El estacionamiento es una situación complicada, así que camina si puedes o llega antes para poder encontrar un lugar relativamente cerca."
Hermosa playa,¡Hermosa playa! Muchos lugares para permanecer a la sombra o tomar el sol. Las duchas y baños del lugar están bien mantenidos.,Solitario,5,"Minneapolis, MN",2023-12-30,2023-12-01,Cancun,Playa Delfines,Hermosa playa ¡Hermosa playa! Muchos lugares para permanecer a la sombra o tomar el sol. Las duchas y baños del lugar están bien mantenidos.
Playa pública,Playa pública en excelentes condiciones muy mantenida y en este lugar estan las letras de Cancún y el mar es precioso,Familia,5,anonimo,2023-11-27,2023-11-01,Cancun,Playa Delfines,Playa pública Playa pública en excelentes condiciones muy mantenida y en este lugar estan las letras de Cancún y el mar es precioso
"mar hermoso pero con olas muy altas,debes saber nadar,es una playa pública,no se puede fumar ni tomar bebidas alcoholicas,poca s","playa muy bonita hay sombrillas que son gratuitas pero se llena de gente,y quedas al rayo del sol no hay alquiler de camastros",Pareja,4,Oscar fernando L,2023-11-17,2023-10-01,Cancun,Playa Delfines,"mar hermoso pero con olas muy altas,debes saber nadar,es una playa pública,no se puede fumar ni tomar bebidas alcoholicas,poca s playa muy bonita hay sombrillas que son gratuitas pero se llena de gente,y quedas al rayo del sol no hay alquiler de camastros"
Una playa de encanto,"Una playa hermosa, arena atalcada, mar turquesa y varios colores azules, las olas son increíbles, tienen palapas gratis para tener sombra y el ambiente es tranquilo.",Familia,5,"Cali, Colombia",2023-10-25,2023-10-01,Cancun,Playa Delfines,"Una playa de encanto Una playa hermosa, arena atalcada, mar turquesa y varios colores azules, las olas son increíbles, tienen palapas gratis para tener sombra y el ambiente es tranquilo."
Fantistico,En este lugar nos aventuramos a meternos mas alla de la orilla del mar y eso que no sabemos nadar pero fue una experiencia maravillosa desde la vista de la playa el agua azul turquesa. Muy recomendable.,Pareja,5,anonimo,2023-10-20,2023-10-01,Cancun,Playa Delfines,Fantistico En este lugar nos aventuramos a meternos mas alla de la orilla del mar y eso que no sabemos nadar pero fue una experiencia maravillosa desde la vista de la playa el agua azul turquesa. Muy recomendable.
Hermosa playa para fotos🌊🌞🌿,"Playa Pittoresk con agua Azur, el agua está picada. Si hay calma, sería perfecto para tomar el sol y quedarse todo el día. Visitado el 22 de abril.",Pareja,4,Ilovepalms,2023-10-17,2023-04-01,Cancun,Playa Delfines,"Hermosa playa para fotos🌊🌞🌿 Playa Pittoresk con agua Azur, el agua está picada. Si hay calma, sería perfecto para tomar el sol y quedarse todo el día. Visitado el 22 de abril."
sin titulo,Hola a todos. Estoy próxima a viajar a Cancún y tengo una pregunta para los Colombianos que han viajado a Cancún y que debieron llenar su pre- registro migratorio. ¿ la Forma Migratoria Multiple Digital (FMMD) se decarga antes del viaje despues del pre registro o durante el viaje ? Hice mi Pre- registro pero no me genero el FMMD ni lo recibí en mi correo. Gracias por su ayuda.,Amigos,5,"Bogotá, Colombia",2023-10-04,2023-10-01,Cancun,Playa Delfines,Hola a todos. Estoy próxima a viajar a Cancún y tengo una pregunta para los Colombianos que han viajado a Cancún y que debieron llenar su pre- registro migratorio. ¿ la Forma Migratoria Multiple Digital (FMMD) se decarga antes del viaje despues del pre registro o durante el viaje ? Hice mi Pre- registro pero no me genero el FMMD ni lo recibí en mi correo. Gracias por su ayuda.
Genial si no vas a conducir allí.,Precioso lugar para visitar. Paraguas gratis en todas partes si tienes la suerte de conseguir uno. Buenos salvavidas.El único problema es que tienes que pagar a los estafadores por los estacionamientos gratuitos o te quitarán la llave del auto. Le dimos a un chico 20 pesos cuando llegamos y se quejó de que no era suficiente. Le dije que pagaríamos cuando nos fuéramos.¿Lo dejé colgado porque no podía correr tan rápido como yo puedo conducir?,Pareja,4,"Londres, UK",2023-10-01,2023-09-01,Cancun,Playa Delfines,Genial si no vas a conducir allí. Precioso lugar para visitar. Paraguas gratis en todas partes si tienes la suerte de conseguir uno. Buenos salvavidas.El único problema es que tienes que pagar a los estafadores por los estacionamientos gratuitos o te quitarán la llave del auto. Le dimos a un chico 20 pesos cuando llegamos y se quejó de que no era suficiente. Le dije que pagaríamos cuando nos fuéramos.¿Lo dejé colgado porque no podía correr tan rápido como yo puedo conducir?
Linda playa gratuita.,"Es una playa publica, en muy buenas condiciones. Arena blanca y playas cristalinas. Hay agua dulce para bañarse antes y después de nadar en el mar. Hay parqueadero gratuito.  Sombrillas para protegerse del sol. Muy poco sargazo. Tiene el letrero de CANCUN que es una foto obligatoria si visitaste la ciudad.",Familia,4,"Cali, Colombia",2023-08-26,2023-08-01,Cancun,Playa Delfines,"Linda playa gratuita. Es una playa publica, en muy buenas condiciones. Arena blanca y playas cristalinas. Hay agua dulce para bañarse antes y después de nadar en el mar. Hay parqueadero gratuito.  Sombrillas para protegerse del sol. Muy poco sargazo. Tiene el letrero de CANCUN que es una foto obligatoria si visitaste la ciudad."
La mejor playa pública de Cancún.,La mejor y más limpia playa pública de Cancún. La playa cuenta con refugios públicos para tomar el sol pero también se encuentran las olas más grandes de Cancún.Puedes llegar hasta él en los autobuses R 1 o R 2 . Hay ruinas mayas de El Rey al otro lado de la carretera.,desconocido,5,"Cancún, México",2023-08-23,2023-08-01,Cancun,Playa Delfines,La mejor playa pública de Cancún. La mejor y más limpia playa pública de Cancún. La playa cuenta con refugios públicos para tomar el sol pero también se encuentran las olas más grandes de Cancún.Puedes llegar hasta él en los autobuses R 1 o R 2 . Hay ruinas mayas de El Rey al otro lado de la carretera.
"Bonita como una postal, pero olas brutales, olores desagradables.","Bonito pero no merece la pena. Las olas son TAN ásperas que te golpearán, como si te arrancaran un traje de baño y te golpearan con una garra perdida para siempre. La playa es realmente hermosa desde la distancia, pero hay muchas otras zonas más bonitas. Sin sombra y lleno de gente. El estacionamiento es gratuito, pero los asistentes te hacen sentir como si tuvieras que darles propina. El estacionamiento huele a orina. Es difícil subir un descenso empinado y empinado a la playa cuando hace calor y hay arena. Evite entrar al agua en este y vaya directamente a Playa Caracol o Playa Langosta. El agua es mucho más tranquila y clara. P.D. para Playa Caracol, camine hacia el Riu Palace para disfrutar de la zona perfecta de aguas cristalinas, menos concurrida y con buen snorkel en la playa.",desconocido,1,anonimo,2023-08-21,2023-08-01,Cancun,Playa Delfines,"Bonita como una postal, pero olas brutales, olores desagradables. Bonito pero no merece la pena. Las olas son TAN ásperas que te golpearán, como si te arrancaran un traje de baño y te golpearan con una garra perdida para siempre. La playa es realmente hermosa desde la distancia, pero hay muchas otras zonas más bonitas. Sin sombra y lleno de gente. El estacionamiento es gratuito, pero los asistentes te hacen sentir como si tuvieras que darles propina. El estacionamiento huele a orina. Es difícil subir un descenso empinado y empinado a la playa cuando hace calor y hay arena. Evite entrar al agua en este y vaya directamente a Playa Caracol o Playa Langosta. El agua es mucho más tranquila y clara. P.D. para Playa Caracol, camine hacia el Riu Palace para disfrutar de la zona perfecta de aguas cristalinas, menos concurrida y con buen snorkel en la playa."
"Volveria a regresar m7chas veces mas ,se las super recomiendo","Sus aguas Cristallnas y Hermoso Azul Turquesaaa,es un verdadero Paraoso!!PLAYA SUPER LIMPIA,UNA EXPERIENXIA MARAVILLOSA ,",Familia,5,Balafaty78,2023-08-17,2022-12-01,Cancun,Playa Delfines,"Volveria a regresar m7chas veces mas ,se las super recomiendo Sus aguas Cristallnas y Hermoso Azul Turquesaaa,es un verdadero Paraoso!!PLAYA SUPER LIMPIA,UNA EXPERIENXIA MARAVILLOSA ,"
Excelente y super equipada playa pública de mar turquesa.,"Fuimos a esta playa buscando aguas turquesas y arena blanca y fue exactamente lo que encontramos. Si bien había un poco de sargazo, había equipos de limpieza que removian lo que quedaba en la arena y mantenían la playa súper limpia.Está playa dispone de Palapas y unos sillones de madera (nosotros llegamos a las 9:30 am y estaban casi todos libres).Dejamos el carro en el estacionamiento, bajamos a la playa y disfrutamos de un increíble día de playa. Hay regaderas y baños en perfectas condiciones e higiene para utilizar.De a ratos, ya avanzado el mediodía, pasan vendedores ambulantes con comida y bebida. No compramos nada ya que nos habíamos llevado así que no puedo opinar de los precios.Cerca del parador, en la zona de las piedras, uno podía disfrutar de ver a las iguanas.Pudimos disfrutar de un increíble día de playa con amigos y familia.",Amigos,5,"Vicente Lopez, Argentina",2023-08-12,2023-07-01,Cancun,Playa Delfines,"Excelente y super equipada playa pública de mar turquesa. Fuimos a esta playa buscando aguas turquesas y arena blanca y fue exactamente lo que encontramos. Si bien había un poco de sargazo, había equipos de limpieza que removian lo que quedaba en la arena y mantenían la playa súper limpia.Está playa dispone de Palapas y unos sillones de madera (nosotros llegamos a las 9:30 am y estaban casi todos libres).Dejamos el carro en el estacionamiento, bajamos a la playa y disfrutamos de un increíble día de playa. Hay regaderas y baños en perfectas condiciones e higiene para utilizar.De a ratos, ya avanzado el mediodía, pasan vendedores ambulantes con comida y bebida. No compramos nada ya que nos habíamos llevado así que no puedo opinar de los precios.Cerca del parador, en la zona de las piedras, uno podía disfrutar de ver a las iguanas.Pudimos disfrutar de un increíble día de playa con amigos y familia."
Playa Los Delfines So Cute,Muy linda la playa. Para pasar una mañana deliciosa. Hay algunas sillas y paraguas.  Hay baños para cambiarse y se puede llevar hilera con tus tragos y picadas. Visitamos 9 julio 2023 un grupo 15 personas,Amigos,4,"Ciudad de Panamá, Panamá",2023-08-05,2023-07-01,Cancun,Playa Delfines,Playa Los Delfines So Cute Muy linda la playa. Para pasar una mañana deliciosa. Hay algunas sillas y paraguas.  Hay baños para cambiarse y se puede llevar hilera con tus tragos y picadas. Visitamos 9 julio 2023 un grupo 15 personas
"Me gusto mucho lo recomiendo, es un lugar para ver el mar y poder comer súper buena la música. Lo recomiendo","Súper buena la atención y la comida, recomiendo mucho este lugar igual al que nos atendió marco. La música es muy agradable y el ambiente",Amigos,5,anonimo,2025-07-10,2025-07-01,Cancun,Avenida Kukulkan,"Me gusto mucho lo recomiendo, es un lugar para ver el mar y poder comer súper buena la música. Lo recomiendo Súper buena la atención y la comida, recomiendo mucho este lugar igual al que nos atendió marco. La música es muy agradable y el ambiente"
"Me encanto coco bongo, una experiencia diferente","Me pareció sobrevalorado, tiene lugares lindos si, pero no cumplió mis expectativas, en cuanto al servicio del hotel (hard rock Riviera maya) instalaciones muy cómodas, diferentes ambientes de restaurantes y un servicio muy bueno.",Negocios,4,anonimo,2025-03-31,2025-03-01,Cancun,Avenida Kukulkan,"Me encanto coco bongo, una experiencia diferente Me pareció sobrevalorado, tiene lugares lindos si, pero no cumplió mis expectativas, en cuanto al servicio del hotel (hard rock Riviera maya) instalaciones muy cómodas, diferentes ambientes de restaurantes y un servicio muy bueno."
No es lo que fue,"Antes era una avenida muy pintoresca, decorada con columnas que simulaban ser monumentos mayas. Ahora los quitaron, se puede encontrar cada tanto un restaurante, estan todos los hoteles. Lo bueno es que el transporte publico es bueno, rapido y frecuente. Y no es caro, el boleto cuesta 12 MXN. En uno de sus extremos hay 2 malls, y una rueda gigante.",Familia,3,"Montevideo, Uruguay",2024-05-29,2024-05-01,Cancun,Avenida Kukulkan,"No es lo que fue Antes era una avenida muy pintoresca, decorada con columnas que simulaban ser monumentos mayas. Ahora los quitaron, se puede encontrar cada tanto un restaurante, estan todos los hoteles. Lo bueno es que el transporte publico es bueno, rapido y frecuente. Y no es caro, el boleto cuesta 12 MXN. En uno de sus extremos hay 2 malls, y una rueda gigante."
Buena ubicación,"Ubicacion conveniente. Vía principal, fácil acceso a rutas de buses locales, lugares turísticos, centros comerciales, restaurantes, actividades y hoteles.",Familia,5,"Atlanta, GA",2024-05-16,2023-07-01,Cancun,Avenida Kukulkan,"Buena ubicación Ubicacion conveniente. Vía principal, fácil acceso a rutas de buses locales, lugares turísticos, centros comerciales, restaurantes, actividades y hoteles."
Una buena avenida,Esta avenida es una de las más importantes y la realidad es que si tiene mucho que ofrecer. Es una de las que más visito cuando estoy en Cancún.,Amigos,5,anonimo,2024-03-07,2024-02-01,Cancun,Avenida Kukulkan,Una buena avenida Esta avenida es una de las más importantes y la realidad es que si tiene mucho que ofrecer. Es una de las que más visito cuando estoy en Cancún.
Grandes vacaciones de Navidad,"Este complejo es increíble. ¡Nos encantó todo sobre eso! La comida era deliciosa. Las bebidas eran de primera categoría. El servicio en todas partes fue muy bueno, desde la playa hasta el servicio de limpieza.",Pareja,5,anonimo,2024-03-01,2023-12-01,Cancun,Avenida Kukulkan,"Grandes vacaciones de Navidad Este complejo es increíble. ¡Nos encantó todo sobre eso! La comida era deliciosa. Las bebidas eran de primera categoría. El servicio en todas partes fue muy bueno, desde la playa hasta el servicio de limpieza."
Un símbolo de la zona hotelera y de todo Cancún,"La avenida Kukulcán a lo largo de sus 26 kms. une todos los hoteles de la zona hotelera de norte a sur, inicia saliendo de Cancún y termina cerca del acceso al aeropuerto. Las numerosas líneas de ""camiones"" (ómnibus) trasladan a los turistas de los hoteles más distantes a la zona más céntrica y viceversa.",Familia,4,"Nassau, Isla Nueva Providencia",2024-02-22,2023-03-01,Cancun,Avenida Kukulkan,"Un símbolo de la zona hotelera y de todo Cancún La avenida Kukulcán a lo largo de sus 26 kms. une todos los hoteles de la zona hotelera de norte a sur, inicia saliendo de Cancún y termina cerca del acceso al aeropuerto. Las numerosas líneas de ""camiones"" (ómnibus) trasladan a los turistas de los hoteles más distantes a la zona más céntrica y viceversa."
Me quedé aquí,Creo que es un gran lugar para ir a cenar o salir por la noche. Pero estuve aquí mucho tiempo durante mis vacaciones y no creo que haya sido una buena elección para mí.La próxima vez elegiré un lugar más tranquilo.,Pareja,5,"Sarajevo, Bosnia-Herzegovina",2024-01-26,2024-01-01,Cancun,Avenida Kukulkan,Me quedé aquí Creo que es un gran lugar para ir a cenar o salir por la noche. Pero estuve aquí mucho tiempo durante mis vacaciones y no creo que haya sido una buena elección para mí.La próxima vez elegiré un lugar más tranquilo.
Si Las Vegas estuviera en el Caribe,"Un hermoso y largo bulevar bordeado de numerosos centros turísticos y zonas verdes llenas de palmeras. Es agradable pasear por él de día y de noche. Muchos restaurantes, casinos y tiendas.",Amigos,5,Perú,2023-11-15,2023-01-01,Cancun,Avenida Kukulkan,"Si Las Vegas estuviera en el Caribe Un hermoso y largo bulevar bordeado de numerosos centros turísticos y zonas verdes llenas de palmeras. Es agradable pasear por él de día y de noche. Muchos restaurantes, casinos y tiendas."
La mejor elección.,"La avenida Kukulkan es fantástica. Es ideal para correr o caminar, para tomar un bus o andar en bici, tanto de día como de noche. Conecta todo: hoteles, shoppings, restos, bancos y atracciones. Fue fantástico estar cerca de esta avenida, super iluminada, con mucho movimiento a toda hora. La zona hotelera de Cancún es sin dudas la mejor elección cuando se busca alojamiento en este magnífico destino.",desconocido,5,"Los Ángeles, CA",2023-03-07,2023-01-01,Cancun,Avenida Kukulkan,"La mejor elección. La avenida Kukulkan es fantástica. Es ideal para correr o caminar, para tomar un bus o andar en bici, tanto de día como de noche. Conecta todo: hoteles, shoppings, restos, bancos y atracciones. Fue fantástico estar cerca de esta avenida, super iluminada, con mucho movimiento a toda hora. La zona hotelera de Cancún es sin dudas la mejor elección cuando se busca alojamiento en este magnífico destino."
