Titulo,Review,TipoViaje,Calificacion,OrigenAutor,FechaOpinion,FechaEstadia,Ciudad,Atraccion,TituloReview
no te molestes,"Muy decepcionante, no hay muchas tiendas y los precios no son particularmente baratos, además el taxi desde la zona hotelera cuesta bastante. No vale la pena preocuparse.",Pareja,2,"Bozburun, Turquía",2022-03-08,2022-03-01,Cancun,Las Plazas Outlet Cancun,"no te molestes Muy decepcionante, no hay muchas tiendas y los precios no son particularmente baratos, además el taxi desde la zona hotelera cuesta bastante. No vale la pena preocuparse."
Conviene,"Los precios son bastante buenos, igual nunca compararse con EEUU, son más costosos, Vans las zapatillas de temporada USD 40, las casas son todas de marca, para los precios que se manejan en Argentina son menos costosos",Pareja,4,"Provincia de Entre Ríos, Argentina",2022-03-08,2022-03-01,Cancun,Las Plazas Outlet Cancun,"Conviene Los precios son bastante buenos, igual nunca compararse con EEUU, son más costosos, Vans las zapatillas de temporada USD 40, las casas son todas de marca, para los precios que se manejan en Argentina son menos costosos"
Puede ser mejor,No hay tanta variedad en la ropa como esperaba. Por otra parte los precios en la tienda Nike fueron lo más destacado del outlet.,Pareja,3,"Chiclayo, Perú",2022-03-01,2022-02-01,Cancun,Las Plazas Outlet Cancun,Puede ser mejor No hay tanta variedad en la ropa como esperaba. Por otra parte los precios en la tienda Nike fueron lo más destacado del outlet.
Centro Comercial Abierto Marcas Americanas,"Esta es una tienda promedio llena de marcas estadounidenses. Es un lugar para ir de compras, pero tiene interesantes restaurantes y cafés. Abierto y libre si necesitas un descanso",desconocido,3,"Calgary, Canadá",2022-02-16,2021-12-01,Cancun,Las Plazas Outlet Cancun,"Centro Comercial Abierto Marcas Americanas Esta es una tienda promedio llena de marcas estadounidenses. Es un lugar para ir de compras, pero tiene interesantes restaurantes y cafés. Abierto y libre si necesitas un descanso"
Buenas compras,"Plaza comercial con almacenes de grandes marcas, es uno de los más importantes y mejor ubicados, con zona de comidas, parqueaderos y venta de boletos turísticos, es cómodo, tranquilo y seguro.",desconocido,4,"Medellín, Colombia",2022-02-07,2021-11-01,Cancun,Las Plazas Outlet Cancun,"Buenas compras Plaza comercial con almacenes de grandes marcas, es uno de los más importantes y mejor ubicados, con zona de comidas, parqueaderos y venta de boletos turísticos, es cómodo, tranquilo y seguro."
pesima,no puedo creer que permitan que su gerente de plaza luis humille y les falte al respeto a todo el personal ya se han quejado varios empleados de hai y no hacen nada al respeto cuando se encontraban la gerente cristel nada de eso pasaba,Amigos,1,anonimo,2022-02-03,2022-02-01,Cancun,Las Plazas Outlet Cancun,pesima no puedo creer que permitan que su gerente de plaza luis humille y les falte al respeto a todo el personal ya se han quejado varios empleados de hai y no hacen nada al respeto cuando se encontraban la gerente cristel nada de eso pasaba
Mala atención en Deportes Marti de  Plaza Outlet Cancún.,Pésima actitud por parte del  gerente de Marti outlet Jesús Rodríguez al hacer una reclamación en una prenda. Cero empatía con el cliente.,Pareja,1,lucy h,2021-12-18,2021-12-01,Cancun,Las Plazas Outlet Cancun,Mala atención en Deportes Marti de  Plaza Outlet Cancún. Pésima actitud por parte del  gerente de Marti outlet Jesús Rodríguez al hacer una reclamación en una prenda. Cero empatía con el cliente.
Visita agradable de Shopping,"Vale la pena comprar en ADIDAS, SKETCHERS, VANS, tiendas con buenos descuentos, paseo de un par de horas para comprar ropa deportiva, tenis, accesorios y ahí mismo hay para comer zona de fast food y restaurante.",Familia,5,"Ciudad de México, México",2021-12-07,2021-12-01,Cancun,Las Plazas Outlet Cancun,"Visita agradable de Shopping Vale la pena comprar en ADIDAS, SKETCHERS, VANS, tiendas con buenos descuentos, paseo de un par de horas para comprar ropa deportiva, tenis, accesorios y ahí mismo hay para comer zona de fast food y restaurante."
centro comercial outlet de estilo americano,Tenían todas las típicas tiendas de centro comercial estilo estadounidense. El distanciamiento social y el desinfectante de manos estaban en todas partes. El área estaba limpia y segura.,Pareja,4,"Kansas City, MO",2021-09-23,2021-09-01,Cancun,Las Plazas Outlet Cancun,centro comercial outlet de estilo americano Tenían todas las típicas tiendas de centro comercial estilo estadounidense. El distanciamiento social y el desinfectante de manos estaban en todas partes. El área estaba limpia y segura.
Bonito paseo,"Es un centro comercial pequeño, no hay tantas tiendas pero los precios son buenos. Es fácil llegar en auto con gps. Lo bueno es que es un lugar seguro, tranquilo, tiene locales de comida y por lo menos el día que fuimos andaba poca gente.",desconocido,3,"Illapel, Chile",2021-02-05,2021-01-01,Cancun,Las Plazas Outlet Cancun,"Bonito paseo Es un centro comercial pequeño, no hay tantas tiendas pero los precios son buenos. Es fácil llegar en auto con gps. Lo bueno es que es un lugar seguro, tranquilo, tiene locales de comida y por lo menos el día que fuimos andaba poca gente."
No compren en Lacoste pues los engañan,"Mi esposa vino en el día de ayer y me compro unas Chanclas y pregunto a la vendedora si tenían garantía o cambio pues era un regalo para mi y yo no andaba con ella,pues resulta que me quedaron pequeñas y acabo de dirigirme a la tienda a hacer un Cambio y no hay el número mio nisiquiera en ese u otro modelo,es decir no tienen chanclas de mi número,y la señora de la tienda me dice q no puede devolverme el dinero que escoja otra pieza o sea me voy a poner una playera de Chanclas o que espere 30 días haber si entra mi número jaja bueno tendré q andar descalzo..NO COMPREN EN OUTLET NO VALE LA PENA PUES LO BARATO SALE CARO..!!",Pareja,1,"Houston, TX",2020-11-09,2020-11-01,Cancun,Las Plazas Outlet Cancun,"No compren en Lacoste pues los engañan Mi esposa vino en el día de ayer y me compro unas Chanclas y pregunto a la vendedora si tenían garantía o cambio pues era un regalo para mi y yo no andaba con ella,pues resulta que me quedaron pequeñas y acabo de dirigirme a la tienda a hacer un Cambio y no hay el número mio nisiquiera en ese u otro modelo,es decir no tienen chanclas de mi número,y la señora de la tienda me dice q no puede devolverme el dinero que escoja otra pieza o sea me voy a poner una playera de Chanclas o que espere 30 días haber si entra mi número jaja bueno tendré q andar descalzo..NO COMPREN EN OUTLET NO VALE LA PENA PUES LO BARATO SALE CARO..!!"
Buena experiencia,"Es un lindo centro comercial abierto donde hay opciones de restaurantes, cine, cafés, tiendas de ropa y un gimnasio. Vivíamos muy cerca y lo utilizamos mucho, es un lindo paseo pero si estás alojándote en la zona hotelera no vale la pena que vayas hasta ahí",Solitario,3,"Montevideo, Uruguay",2020-03-05,2019-09-01,Cancun,Las Plazas Outlet Cancun,"Buena experiencia Es un lindo centro comercial abierto donde hay opciones de restaurantes, cine, cafés, tiendas de ropa y un gimnasio. Vivíamos muy cerca y lo utilizamos mucho, es un lindo paseo pero si estás alojándote en la zona hotelera no vale la pena que vayas hasta ahí"
No tan outlet!,"El lugar es agradable... un poco alejado de la zona hotelera... varias tiendas internacionales y otras mexicanas, con sitio para comer, cine... sin embargo los precios no son de outlet... si bien es un poco más económico no merece la pena ir hasta allá por ello... no recomiendo!",desconocido,3,"Concepción, Chile",2020-03-03,2020-02-01,Cancun,Las Plazas Outlet Cancun,"No tan outlet! El lugar es agradable... un poco alejado de la zona hotelera... varias tiendas internacionales y otras mexicanas, con sitio para comer, cine... sin embargo los precios no son de outlet... si bien es un poco más económico no merece la pena ir hasta allá por ello... no recomiendo!"
Buenos precios. zona marginal,La zona es muy peligrosa. Llegue en el R2 desde cancun zona hotelera. Entré directamente dado que los alrededores eran bastante duros.,desconocido,3,"Provincia de Buenos Aires, Argentina",2020-02-18,2020-01-01,Cancun,Las Plazas Outlet Cancun,Buenos precios. zona marginal La zona es muy peligrosa. Llegue en el R2 desde cancun zona hotelera. Entré directamente dado que los alrededores eran bastante duros.
Buenos precios en algunas tiendas,"Es un outlet pequeño pero interesante. Encontramos buenos precios en Calvin Klein y Under Amour, las demás tiendas no ofrecian descuentos interesantes. Tiene un Starbucks para merendar y algunas actividades para los más pequeños. Si t rebuscas encuentras buenas ofertas y las tiendas tienen devolución de impuestos.",Familia,3,"Asuncion, Paraguay",2020-02-16,2020-02-01,Cancun,Las Plazas Outlet Cancun,"Buenos precios en algunas tiendas Es un outlet pequeño pero interesante. Encontramos buenos precios en Calvin Klein y Under Amour, las demás tiendas no ofrecian descuentos interesantes. Tiene un Starbucks para merendar y algunas actividades para los más pequeños. Si t rebuscas encuentras buenas ofertas y las tiendas tienen devolución de impuestos."
Nada en especial,No me parecio ni bueno ni malo... ni los precios eran tan especiales. No volveria a ir. Hay locales que solo aceptan pesos mexicanos.,desconocido,3,"Buenos Aires, Argentina",2020-02-06,2020-01-01,Cancun,Las Plazas Outlet Cancun,Nada en especial No me parecio ni bueno ni malo... ni los precios eran tan especiales. No volveria a ir. Hay locales que solo aceptan pesos mexicanos.
Recomendado,"Excelentes Precios en calzado y ropa , Cancún aparte de sus hermosas playas hay que aprovechar de este Outlet y sus excelentes precios. Recomendado!!",Amigos,5,"Alajuela, Costa Rica",2020-01-29,2020-01-01,Cancun,Las Plazas Outlet Cancun,"Recomendado Excelentes Precios en calzado y ropa , Cancún aparte de sus hermosas playas hay que aprovechar de este Outlet y sus excelentes precios. Recomendado!!"
Buenas ofertas,"Es una de las plazas en las que si quieres encontrar calidad, es el lugar correcto,encuentras de todo hay ofertas todo el tiempo y un lugar muy bueno para ir con la familia",desconocido,4,Liliana c,2020-01-28,2020-01-01,Cancun,Las Plazas Outlet Cancun,"Buenas ofertas Es una de las plazas en las que si quieres encontrar calidad, es el lugar correcto,encuentras de todo hay ofertas todo el tiempo y un lugar muy bueno para ir con la familia"
Oulet,"Realmente pensamos que era otra cosa tanto en variedad de tiendas como calidad, no lo recomiendo si queres calidad.",Familia,2,Uruguay,2020-01-25,2020-01-01,Cancun,Las Plazas Outlet Cancun,"Oulet Realmente pensamos que era otra cosa tanto en variedad de tiendas como calidad, no lo recomiendo si queres calidad."
Gran surtido de mercado en esta plaza,"Esta plaza cuenta con muy buena promocion de productos, cine y lugar de alimentos. Un ambiente para toda la familia y para compras de pánico.",Solitario,5,"Cancún, México",2019-12-13,2019-12-01,Cancun,Las Plazas Outlet Cancun,"Gran surtido de mercado en esta plaza Esta plaza cuenta con muy buena promocion de productos, cine y lugar de alimentos. Un ambiente para toda la familia y para compras de pánico."
Vale la pena,"Normalito, hay muchos descuentos. OJO en muchos locales no te aceptan dolares. Y cuando te los aceptan hacen la conversión a pesos mexicanos y no es conveniente. Recomendaión: llevá pesos mexicanos a los shoppings.",desconocido,3,anonimo,2019-12-13,2019-11-01,Cancun,Las Plazas Outlet Cancun,"Vale la pena Normalito, hay muchos descuentos. OJO en muchos locales no te aceptan dolares. Y cuando te los aceptan hacen la conversión a pesos mexicanos y no es conveniente. Recomendaión: llevá pesos mexicanos a los shoppings."
Precios altos,Tienen artesanías de todo tipo bonitas y feas. Los precios nos parecieron muy altos. Compre un bolso de playa muy bonito que fue lo unico que me parecio de muy buena calidad y a buen precio.,Familia,3,"Medellín, Colombia",2019-12-09,2019-12-01,Cancun,Las Plazas Outlet Cancun,Precios altos Tienen artesanías de todo tipo bonitas y feas. Los precios nos parecieron muy altos. Compre un bolso de playa muy bonito que fue lo unico que me parecio de muy buena calidad y a buen precio.
Las plazas,"Pocss ofertas , solamente Nike store tiene algunas ofertas, en general es para un paseo rápido, muy alejado de la zona hotelera",Familia,3,anonimo,2019-12-06,2019-12-01,Cancun,Las Plazas Outlet Cancun,"Las plazas Pocss ofertas , solamente Nike store tiene algunas ofertas, en general es para un paseo rápido, muy alejado de la zona hotelera"
Compras,"Exelente en Nike sobre todo tiene unos precios increíbles en ropa y en calzado! Hay promociones de championes a mitad de precio si llevas 2,4,6 y en ropa lo mismo tienes que tener una cuenta, en mi caso personal no la tenia me la hicieron ahí en el mismo momento y compramos muy barato! Hay otra casa en la punta del oulet muy grande con ropa de Niño mujer y caballero que la ropa polo es muy barata y muy buenos precios!! Los baños limpios y muy buenos, lo único malo que no hay casa de cambio solo a unas 3 cuadras y no aceptan Dolares!",Familia,5,"Juan Lacaze, Uruguay",2019-11-29,2019-11-01,Cancun,Las Plazas Outlet Cancun,"Compras Exelente en Nike sobre todo tiene unos precios increíbles en ropa y en calzado! Hay promociones de championes a mitad de precio si llevas 2,4,6 y en ropa lo mismo tienes que tener una cuenta, en mi caso personal no la tenia me la hicieron ahí en el mismo momento y compramos muy barato! Hay otra casa en la punta del oulet muy grande con ropa de Niño mujer y caballero que la ropa polo es muy barata y muy buenos precios!! Los baños limpios y muy buenos, lo único malo que no hay casa de cambio solo a unas 3 cuadras y no aceptan Dolares!"
Mucha variedad de ropa en oferta y pocos lugares para comer,"Diversas tiendas ofrecen descuentos del 30% al 70% de su precio comercial de venta en Cancún.Esto se traduce en que el precio real ya con descuento sólo alcanza un 40% a un 50% de ahorro.Lo positivo es que la plaza es que 3s un corredor a cielo abierto muy grande donde distintos comercios ofrecen ropa deportiva, casual, de fiesta, formal, tipo hindú, infantil, trajes de baño, ropa interior y calzado en rebaja. También hay tienda de accesorios y chucherías de belleza (de baja calidad).Mucha ropa es de confección china. Las tallas no corresponden a las reales. Por ejemplo una talla que ellos señalan como 10 en realidad es talla 32 mexicana Su talla 6 es en realidad talla 28 mexicana Recomendable llegar en transporte colectivo (rutas 6 y 10) porque cada hora de estacionamiento vale 20 pesos. En promedio la gente pasaba tres horas viendo y probando ropa. Hay un cine que ofrece horarios matutinos, vespertinos y nocturnos. Los precios de los refrescos son exagerados. Por ejemplo una Coca-Cola vale 52 pesos cuando en el supermercado vale 10 pesos mexicanos. Al caer el sol ya no hay vigilancia y en la noche falta iluminación para caminar por dentro de la plaza.Los sanitarios están limpios, aunque les hace falta mantenimiento correctivo a las puertas. Acerca de los lugares para comer está una heladería muy recomendable con precios justos.Hay varias franquicias de cafetería y restaurantes. Solo un restaurante es local que ofrece menú de comida completa (sopa, guisado, agua y postre) por 70 pesos frente a la tienda Promoda.",Solitario,4,anonimo,2019-11-15,2019-11-01,Cancun,Las Plazas Outlet Cancun,"Mucha variedad de ropa en oferta y pocos lugares para comer Diversas tiendas ofrecen descuentos del 30% al 70% de su precio comercial de venta en Cancún.Esto se traduce en que el precio real ya con descuento sólo alcanza un 40% a un 50% de ahorro.Lo positivo es que la plaza es que 3s un corredor a cielo abierto muy grande donde distintos comercios ofrecen ropa deportiva, casual, de fiesta, formal, tipo hindú, infantil, trajes de baño, ropa interior y calzado en rebaja. También hay tienda de accesorios y chucherías de belleza (de baja calidad).Mucha ropa es de confección china. Las tallas no corresponden a las reales. Por ejemplo una talla que ellos señalan como 10 en realidad es talla 32 mexicana Su talla 6 es en realidad talla 28 mexicana Recomendable llegar en transporte colectivo (rutas 6 y 10) porque cada hora de estacionamiento vale 20 pesos. En promedio la gente pasaba tres horas viendo y probando ropa. Hay un cine que ofrece horarios matutinos, vespertinos y nocturnos. Los precios de los refrescos son exagerados. Por ejemplo una Coca-Cola vale 52 pesos cuando en el supermercado vale 10 pesos mexicanos. Al caer el sol ya no hay vigilancia y en la noche falta iluminación para caminar por dentro de la plaza.Los sanitarios están limpios, aunque les hace falta mantenimiento correctivo a las puertas. Acerca de los lugares para comer está una heladería muy recomendable con precios justos.Hay varias franquicias de cafetería y restaurantes. Solo un restaurante es local que ofrece menú de comida completa (sopa, guisado, agua y postre) por 70 pesos frente a la tienda Promoda."
De compras,Algunos precios buenos. Buenas opciones y marcas.Es fácil llegar en taxi desde la terminal de ADO si no estás alojado en Cancún.,Solitario,3,anonimo,2019-10-27,2019-10-01,Cancun,Las Plazas Outlet Cancun,De compras Algunos precios buenos. Buenas opciones y marcas.Es fácil llegar en taxi desde la terminal de ADO si no estás alojado en Cancún.
Plaza al aire libre,"Plaza al aire libre, tiene salas de cine y muchas tiendas, pocas de ellas son outlet’s, pero si de verdad quieres hacer shopping, vale la pena darte una vuelta.",desconocido,4,"Ciudad de México, México",2019-10-15,2019-10-01,Cancun,Las Plazas Outlet Cancun,"Plaza al aire libre Plaza al aire libre, tiene salas de cine y muchas tiendas, pocas de ellas son outlet’s, pero si de verdad quieres hacer shopping, vale la pena darte una vuelta."
NO hay grandes descuentos,"Si bien el cambio no favorece a argentinos, no hay grandes descuentos o promociones; fui por el Nike store, pero el desc era solo del 30% en determinados productos y no había mucho para elegir, sumado a que queda alejado, es preferible ir a Plaza Americas que queda más cerca de la ruta hotelera....",desconocido,3,"Rosario, Argentina",2019-10-15,2019-10-01,Cancun,Las Plazas Outlet Cancun,"NO hay grandes descuentos Si bien el cambio no favorece a argentinos, no hay grandes descuentos o promociones; fui por el Nike store, pero el desc era solo del 30% en determinados productos y no había mucho para elegir, sumado a que queda alejado, es preferible ir a Plaza Americas que queda más cerca de la ruta hotelera...."
es mas centro comercial que Outlet,"en cuanto a la cantidad de locales esta muy bien distribuido, cuenta con muchos locales, pero sus precios no parecen tanto de Outlet, se consiguen pocas ofertas y en realidad no son muchas las ofertas de colecciones pasadas,",desconocido,5,anonimo,2019-10-09,2019-10-01,Cancun,Las Plazas Outlet Cancun,"es mas centro comercial que Outlet en cuanto a la cantidad de locales esta muy bien distribuido, cuenta con muchos locales, pero sus precios no parecen tanto de Outlet, se consiguen pocas ofertas y en realidad no son muchas las ofertas de colecciones pasadas,"
LIndo lugar,"Lindo lugar de compras con algunas opciones buenas de marcas como Nike, Calvin Klein, DG entre otras.",desconocido,4,anonimo,2019-09-26,2019-09-01,Cancun,Las Plazas Outlet Cancun,"LIndo lugar Lindo lugar de compras con algunas opciones buenas de marcas como Nike, Calvin Klein, DG entre otras."
"No es en estricto sentido un outlet, pero encuentras de todo","Es un centro comercial completo. Se encuentra de todo, hay facilidad de parqueo. No es en estricto sentido un outlet, pero puedes encontrar los productos y servicios normalmente requeridos en un viaje",desconocido,5,"Bogotá, Colombia",2019-08-11,2019-08-01,Cancun,Las Plazas Outlet Cancun,"No es en estricto sentido un outlet, pero encuentras de todo Es un centro comercial completo. Se encuentra de todo, hay facilidad de parqueo. No es en estricto sentido un outlet, pero puedes encontrar los productos y servicios normalmente requeridos en un viaje"
Amplio pero no tiene todas las marcas,"El lugar es amplio tiene una zona de comida y varias marcas. Es al aire libre y en julio hace realmente mucho calor, ir temprano o tarde.El estacionamiento es económico o simple de llegar en transporte público.",Pareja,4,"Buenos Aires, Argentina",2019-08-08,2019-08-01,Cancun,Las Plazas Outlet Cancun,"Amplio pero no tiene todas las marcas El lugar es amplio tiene una zona de comida y varias marcas. Es al aire libre y en julio hace realmente mucho calor, ir temprano o tarde.El estacionamiento es económico o simple de llegar en transporte público."
Hermoso!!,"Estuve en mayo 2019, este Outlet es precioso, abierto, luminoso, encontrás todas las marcas y a buenos precios comparados con la Argentina.",desconocido,5,"Distrito Capital Federal, Argentina",2019-07-02,2019-05-01,Cancun,Las Plazas Outlet Cancun,"Hermoso!! Estuve en mayo 2019, este Outlet es precioso, abierto, luminoso, encontrás todas las marcas y a buenos precios comparados con la Argentina."
POCOS BUENOS PRECIOS,"No sentí muchas ofertas atractivas tratándose de un outlet, además el lugar es pequeño en comparación a Ls Américas o La Isla.",Pareja,3,"Lima, Perú",2019-06-12,2019-06-01,Cancun,Las Plazas Outlet Cancun,"POCOS BUENOS PRECIOS No sentí muchas ofertas atractivas tratándose de un outlet, además el lugar es pequeño en comparación a Ls Américas o La Isla."
Buenos precios,"Se  conseguí ropa, calzado y accesorios de marca   a buen precio (hay rebajas del 30, 40 y hasta 50 por ciento)",Familia,5,"Bahia Blanca, Argentina",2019-05-26,2019-05-01,Cancun,Las Plazas Outlet Cancun,"Buenos precios Se  conseguí ropa, calzado y accesorios de marca   a buen precio (hay rebajas del 30, 40 y hasta 50 por ciento)"
Bueno para conocer,Los precios no son de Outlet pero está relajado el lugar y no hay mucha gente por lo que podemos caminar a gusto,Pareja,3,anonimo,2019-05-24,2019-05-01,Cancun,Las Plazas Outlet Cancun,Bueno para conocer Los precios no son de Outlet pero está relajado el lugar y no hay mucha gente por lo que podemos caminar a gusto
Tranquilo pero no hay mucho que ver,"Es buena plaza para ir al cine o al gimnasio, aunque los precios realmente no son bajos como uno lo esperaría de un outlet, aún así está bien para pasear un rato y ver, pero la ropa tampoco es tan bonita, el ambiente es agradable",Familia,4,anonimo,2019-04-30,2019-04-01,Cancun,Las Plazas Outlet Cancun,"Tranquilo pero no hay mucho que ver Es buena plaza para ir al cine o al gimnasio, aunque los precios realmente no son bajos como uno lo esperaría de un outlet, aún así está bien para pasear un rato y ver, pero la ropa tampoco es tan bonita, el ambiente es agradable"
MUY BUEN SHOPPING,"Es realmente un lugar que vale la pena ir , Muchos comercios, muy buenos precios , un  lugar muy agradable para ir a cenar o solo para pasar el rato. Muy bien detallado los planos con la ubicación de los comercios y muy amable la gente que atiende los mismos o que indica cualquier necesidad que el turista tenga. Muy bueno también el servicios de taxis en la entrada, muy serio",Pareja,5,anonimo,2019-04-11,2019-03-01,Cancun,Las Plazas Outlet Cancun,"MUY BUEN SHOPPING Es realmente un lugar que vale la pena ir , Muchos comercios, muy buenos precios , un  lugar muy agradable para ir a cenar o solo para pasar el rato. Muy bien detallado los planos con la ubicación de los comercios y muy amable la gente que atiende los mismos o que indica cualquier necesidad que el turista tenga. Muy bueno también el servicios de taxis en la entrada, muy serio"
RECOMENDADO ARGENTINOS,"La verdad muy barato! si bien no es regalado, la ropa esta al 50 o 60 % menos de lo que sale en nuestro pais!",Pareja,5,"Santa Fe, Argentina",2019-04-11,2019-03-01,Cancun,Las Plazas Outlet Cancun,"RECOMENDADO ARGENTINOS La verdad muy barato! si bien no es regalado, la ropa esta al 50 o 60 % menos de lo que sale en nuestro pais!"
Normal,"La verdad es una plaza que no tiene relevancia es pequeña y no tiene ni lugares de comida, aparte las tiendas no tienen precios de outlet.",Pareja,3,"Culiacán, México",2019-03-20,2019-02-01,Cancun,Las Plazas Outlet Cancun,"Normal La verdad es una plaza que no tiene relevancia es pequeña y no tiene ni lugares de comida, aparte las tiendas no tienen precios de outlet."
Mucha expectativa,Es lindo y al aire libre. Pequeño. Encontré que para ser una plaza de outlets los precios no son tan baratos y como que le faltan opciones. Pero es buen paseo.,Amigos,3,"Santo Domingo, República Dominicana",2019-03-17,2019-03-01,Cancun,Las Plazas Outlet Cancun,Mucha expectativa Es lindo y al aire libre. Pequeño. Encontré que para ser una plaza de outlets los precios no son tan baratos y como que le faltan opciones. Pero es buen paseo.
Visita a Las Plazas Outlet,"En mi opinion, los precios no parecian muy de Outlet, hay muy poca diferencia con respecto a un shopping normal",desconocido,3,jonathan a,2019-02-27,2019-02-01,Cancun,Las Plazas Outlet Cancun,"Visita a Las Plazas Outlet En mi opinion, los precios no parecian muy de Outlet, hay muy poca diferencia con respecto a un shopping normal"
