Titulo,Review,Calificacion,FechaEstadia,Ciudad,Atraccion,TituloReview,Sentimiento,SentimientoHF
10 de 10,Simplemente espectacular! No se lo pierdan el ballet folklórico. Tienen mucho talento esos chicos y chicas ………………!!!,5,2025-08-01,Cdmx,Palacio De Bellas Artes,10 de 10. Simplemente espectacular! No se lo pierdan el ballet folklórico. Tienen mucho talento esos chicos y chicas ………………!!!.,Positivo,Positivo
Mexican muralism at its finest!,"It was an outstanding example of Mexican muralism. A do not miss activity. From Rivera, Orozco, Tamayo and Siqueiros, absolutely stunning!",5,2025-08-01,Cdmx,Palacio De Bellas Artes,"Mexican muralism at its finest!. It was an outstanding example of Mexican muralism. A do not miss activity. From Rivera, Orozco, Tamayo and Siqueiros, absolutely stunning!.",Positivo,Positivo
Ballet Folklórico de México de Amalia Hernández,"excelente producción, que te llena los sentidos y te transporta hacia los lugares que están en el programa, excelente el duelo de arpas correspondiente a la fiesta de Tlacotalpan, así mismo el charro haciendo el floreo de reata , todo espectacular; El prietito en el arroz fue que en su programa no incluyeran un capitulo  sobre la música norteña, que se llenara el recinto con el sonido del acordeón, bajosesto y  tololoche, de ahí pal real vale la pena cada centavo que pagaste por la entrada",5,2025-08-01,Cdmx,Palacio De Bellas Artes,"Ballet Folklórico de México de Amalia Hernández. excelente producción, que te llena los sentidos y te transporta hacia los lugares que están en el programa, excelente el duelo de arpas correspondiente a la fiesta de Tlacotalpan, así mismo el charro haciendo el floreo de reata , todo espectacular; El prietito en el arroz fue que en su programa no incluyeran un capitulo  sobre la música norteña, que se llenara el recinto con el sonido del acordeón, bajosesto y  tololoche, de ahí pal real vale la pena cada centavo que pagaste por la entrada.",Positivo,Positivo
Siempre agradable,"En esta ocasión fui al museo, que albergaba la exposición “La Revolución Impresionista”, pero aproveché para conocer la de Jorge González Camarena “La utopía inacabada” y los murales de Siqueiros, Rivera, Orozco, Camarena y más. Visitar el Palacio es siempre un deleite visual.",5,2025-07-01,Cdmx,Palacio De Bellas Artes,"Siempre agradable. En esta ocasión fui al museo, que albergaba la exposición “La Revolución Impresionista”, pero aproveché para conocer la de Jorge González Camarena “La utopía inacabada” y los murales de Siqueiros, Rivera, Orozco, Camarena y más. Visitar el Palacio es siempre un deleite visual.",Positivo,Positivo
"Un edificio que data de unos 100 años aproximadamente si es lo que entendí quisa más, el lugar se siente como un viaje en el tiempo , quisa lo han remodelado claro pero mantiene esa esencia,grandes artistas han pasado por esas puertas , increíble exposiciones artistas mexicanos e internacionales una parada obligada si te encuentras en la ciudad de Mexico","Un edificio que data de unos 100 años aproximadamente si es lo que entendí quisa más, el lugar se siente como un viaje en el tiempo , quisa lo han remodelado claro pero mantiene esa esencia,grandes artistas han pasado por esas puertas , increíble exposiciones artistas mexicanos e internacionales una parada obligada si te encuentras en la ciudad de Mexico",5,2025-07-01,Cdmx,Palacio De Bellas Artes,"Un edificio que data de unos 100 años aproximadamente si es lo que entendí quisa más, el lugar se siente como un viaje en el tiempo , quisa lo han remodelado claro pero mantiene esa esencia,grandes artistas han pasado por esas puertas , increíble exposiciones artistas mexicanos e internacionales una parada obligada si te encuentras en la ciudad de Mexico. Un edificio que data de unos 100 años aproximadamente si es lo que entendí quisa más, el lugar se siente como un viaje en el tiempo , quisa lo han remodelado claro pero mantiene esa esencia,grandes artistas han pasado por esas puertas , increíble exposiciones artistas mexicanos e internacionales una parada obligada si te encuentras en la ciudad de Mexico.",Positivo,Positivo
"Unique Place, Exceeded My Expectations","This place truly exceeded my expectations. It's unique, thoughtfully designed, and offers a great atmosphere :)I would definitely return and recommend it to others.",5,2025-06-01,Cdmx,Palacio De Bellas Artes,"Unique Place, Exceeded My Expectations. This place truly exceeded my expectations. It's unique, thoughtfully designed, and offers a great atmosphere :)I would definitely return and recommend it to others.",Positivo,Positivo
Views and more,"Best exterior view of the Art Nouveau building is from the Sears building 8th floor café.Access is free to seniors60 and over with ID. Also, Sundays free admission. Interior of building us a fusion of Art Deco and Mexican art. Artists include Rivera, Siqueiros and Camarena.",5,2025-06-01,Cdmx,Palacio De Bellas Artes,"Views and more. Best exterior view of the Art Nouveau building is from the Sears building 8th floor café.Access is free to seniors60 and over with ID. Also, Sundays free admission. Interior of building us a fusion of Art Deco and Mexican art. Artists include Rivera, Siqueiros and Camarena.",Positivo,Positivo
Lo mejor en compañía de mi hija menor,"Sin duda alguna la sala de exposiciones y museo es una gran oportunidad de observar y apreciar los mejores murales como Siqueiros, Diego Rivera, Camarena, Orozco y para terminar escuchar la orquesta sinfónica nacional.",5,2025-06-01,Cdmx,Palacio De Bellas Artes,"Lo mejor en compañía de mi hija menor. Sin duda alguna la sala de exposiciones y museo es una gran oportunidad de observar y apreciar los mejores murales como Siqueiros, Diego Rivera, Camarena, Orozco y para terminar escuchar la orquesta sinfónica nacional.",Positivo,Positivo
Prepare to have your heart stolen by Baile Folklórico at Palacio de Bellas Artes,"Baile Folklórico at the Palacio de Bellas Artes is hands down one of the most beautiful and moving performances I’ve ever witnessed. From the very first drumbeat, I was completely captivated. The show is a vibrant celebration of Mexico’s diverse regions, with each dance telling a unique story through traditional footwork, colorful costumes, and dramatic choreography. You can truly feel the soul of Mexico come alive on stage.The venue itself, the Palacio de Bellas Artes, is breathtaking—its grand architecture makes the entire evening feel like a special occasion. I highly recommend dressing up a bit and making a night of it. If you're looking to experience authentic Mexican culture and artistry, this performance is unforgettable.",5,2024-06-01,Cdmx,Palacio De Bellas Artes,"Prepare to have your heart stolen by Baile Folklórico at Palacio de Bellas Artes. Baile Folklórico at the Palacio de Bellas Artes is hands down one of the most beautiful and moving performances I’ve ever witnessed. From the very first drumbeat, I was completely captivated. The show is a vibrant celebration of Mexico’s diverse regions, with each dance telling a unique story through traditional footwork, colorful costumes, and dramatic choreography. You can truly feel the soul of Mexico come alive on stage.The venue itself, the Palacio de Bellas Artes, is breathtaking—its grand architecture makes the entire evening feel like a special occasion. I highly recommend dressing up a bit and making a night of it. If you're looking to experience authentic Mexican culture and artistry, this performance is unforgettable.",Positivo,Positivo
Palacio de Bellas artes-Ballet Amalia Hernández,"Ballet de Amalia Hernández en domingo, concurrido. Llega con tiempo ya que es puntual la función. El metro bellas artes o metrobus son la opción en transporte.",5,2024-05-01,Cdmx,Palacio De Bellas Artes,"Palacio de Bellas artes-Ballet Amalia Hernández. Ballet de Amalia Hernández en domingo, concurrido. Llega con tiempo ya que es puntual la función. El metro bellas artes o metrobus son la opción en transporte.",Positivo,Positivo
Amazing ,"Amazing building,  great architecture,  we enjoy a classic music event inside so we look all the building inside and outside, so beautiful ",5,2025-03-01,Cdmx,Palacio De Bellas Artes,"Amazing. Amazing building,  great architecture,  we enjoy a classic music event inside so we look all the building inside and outside, so beautiful.",Positivo,Positivo
My favorite place Bellas Artes,"It is one of the most beautiful murals , the walls full of so many pictures of artistic paint by Diego Rivera and David Alfaro S.I highly recommend everyone to come and visit ",5,2025-02-01,Cdmx,Palacio De Bellas Artes,"My favorite place Bellas Artes. It is one of the most beautiful murals , the walls full of so many pictures of artistic paint by Diego Rivera and David Alfaro S.I highly recommend everyone to come and visit.",Positivo,Positivo
do not miss this gem,"spectacular building with murals, and art deco interior. we went when it was barricaded to prevent vandalism from demonstrators so it was hard to access but still open. this is a don’t miss place.",5,2025-03-01,Cdmx,Palacio De Bellas Artes,"do not miss this gem. spectacular building with murals, and art deco interior. we went when it was barricaded to prevent vandalism from demonstrators so it was hard to access but still open. this is a don’t miss place.",Positivo,Positivo
Beautiful inside and out,"The building is outstanding from the outside … located next to a park and with its own manicured gardens out front, it will make for lovely photos to remember your visit. The inside is art deco in design and is equally stunning. It appears to have spaces for exhibits, but there was a fee … there is a small FREE display just as you enter on the right … that was worth a look … It is not far from the main square and cathedral.",5,2025-02-01,Cdmx,Palacio De Bellas Artes,"Beautiful inside and out. The building is outstanding from the outside … located next to a park and with its own manicured gardens out front, it will make for lovely photos to remember your visit. The inside is art deco in design and is equally stunning. It appears to have spaces for exhibits, but there was a fee … there is a small FREE display just as you enter on the right … that was worth a look … It is not far from the main square and cathedral.",Positivo,Positivo
Must see,What a fabulous venue. There is so much to like about the venue. From the Tiffany ‘curtain’ to the dome and the good rake in the seating.,5,2025-02-01,Cdmx,Palacio De Bellas Artes,Must see. What a fabulous venue. There is so much to like about the venue. From the Tiffany ‘curtain’ to the dome and the good rake in the seating.,Positivo,Positivo
Amazing architecture.,"Gorgeous architecture with a beautiful nearby park! Also, plenty of street vendors in the area. A must see in central Mexico City.",5,2025-02-01,Cdmx,Palacio De Bellas Artes,"Amazing architecture. Gorgeous architecture with a beautiful nearby park! Also, plenty of street vendors in the area. A must see in central Mexico City.",Positivo,Positivo
Mind blowing!,"It’s a MUST stop for any art lover, when visiting Mexico City.Excellent collection of Riveira and Sikeiros. And all of that in a beautiful space.",5,2025-02-01,Cdmx,Palacio De Bellas Artes,"Mind blowing!. It’s a MUST stop for any art lover, when visiting Mexico City.Excellent collection of Riveira and Sikeiros. And all of that in a beautiful space.",Positivo,Positivo
Sensacional,"El hecho de que haya guías y te expliquen los murales, lo hace sorpréndete te ya que nos ayuda a entender o interpretarlas de una manera más fácil.",5,2025-02-01,Cdmx,Palacio De Bellas Artes,"Sensacional. El hecho de que haya guías y te expliquen los murales, lo hace sorpréndete te ya que nos ayuda a entender o interpretarlas de una manera más fácil.",Positivo,Positivo
Hermoso,"Se ve hermoso de noche, y ese parque es una fiesta en cada esquina, sonideros y al gente bailando, recomiendo no saltarse esa actividad",5,2025-02-01,Cdmx,Palacio De Bellas Artes,"Hermoso. Se ve hermoso de noche, y ese parque es una fiesta en cada esquina, sonideros y al gente bailando, recomiendo no saltarse esa actividad.",Positivo,Positivo
Sitio histórico,"Es un lugar lleno de historia, tanto en las afueras como en su interior. Los domingos la entrada es gratuita y hacen recorridos guiados muy interesantes donde hablan de la historia de los murales. También se presenta el ballet folklórico, un evento para conocer más de la música, danza y cultura mexicana.",4,2025-01-01,Cdmx,Palacio De Bellas Artes,"Sitio histórico. Es un lugar lleno de historia, tanto en las afueras como en su interior. Los domingos la entrada es gratuita y hacen recorridos guiados muy interesantes donde hablan de la historia de los murales. También se presenta el ballet folklórico, un evento para conocer más de la música, danza y cultura mexicana.",Positivo,Positivo
Incredibly beautiful facade,"Designed by Adamo Boari in 1904 and completed after a hiatus in 1932 by Mexican architect Federico Mariscal this is one of the most beautiful buildings in Mexico. Small but elegant gardens lead the eye, the foot, and the person inevitably to a hugely impressive facade. A building to be proud of.",4,2025-01-01,Cdmx,Palacio De Bellas Artes,"Incredibly beautiful facade. Designed by Adamo Boari in 1904 and completed after a hiatus in 1932 by Mexican architect Federico Mariscal this is one of the most beautiful buildings in Mexico. Small but elegant gardens lead the eye, the foot, and the person inevitably to a hugely impressive facade. A building to be proud of.",Positivo,Positivo
Muy bonito,"“Es una visita obligatoria si estás en la Ciudad de México, ya que destaca por su belleza en cada rincón. Cada detalle, desde su arquitectura hasta sus alrededores, ofrece una experiencia visual impresionante que no te puedes perder.”",4,2025-01-01,Cdmx,Palacio De Bellas Artes,"Muy bonito. “Es una visita obligatoria si estás en la Ciudad de México, ya que destaca por su belleza en cada rincón. Cada detalle, desde su arquitectura hasta sus alrededores, ofrece una experiencia visual impresionante que no te puedes perder.”.",Positivo,Positivo
Muy asequible. Lo recomiendo.,"Aunque no he viajado por Europa, África y Asia, sí he estado en algunos museos en mi juventud y tengo que decir que este es uno de los mejores. Para ser sincera, no pensé que fuera a ser tan maravilloso, tan accesible y tan acogedor.",5,2025-01-01,Cdmx,Palacio De Bellas Artes,"Muy asequible. Lo recomiendo. Aunque no he viajado por Europa, África y Asia, sí he estado en algunos museos en mi juventud y tengo que decir que este es uno de los mejores. Para ser sincera, no pensé que fuera a ser tan maravilloso, tan accesible y tan acogedor.",Positivo,Positivo
Enjoy the audio tour of the murals,"Great way to see the muralists, beautiful architecture and stunning art. Angela Gurria show was tremendous. Big tip- ask an English speaking guide for the QR code for an English guided audio recording that describes the murals. Free and totally enhances the viewing and appreciation of the murals. Another trip is to take a break mid visit and have a beer or coffee or snack in the lovely cafe.",5,2025-01-01,Cdmx,Palacio De Bellas Artes,"Enjoy the audio tour of the murals. Great way to see the muralists, beautiful architecture and stunning art. Angela Gurria show was tremendous. Big tip- ask an English speaking guide for the QR code for an English guided audio recording that describes the murals. Free and totally enhances the viewing and appreciation of the murals. Another trip is to take a break mid visit and have a beer or coffee or snack in the lovely cafe.",Positivo,Positivo
A waste of my time!,"I'm glad ( as a senior citizen.) l didn't have to pay to get into this absolutely boring ""so-called"" art museum!It had no significant works of art & other than the actual building being beautiful, that's about it!Do yourselves a favour & get an Uber to the FREE Museo Soumaya which has many works of art by well known artists like Renoir, Van Gogh, Pissarro & sculptures by Rodan.",1,2024-12-01,Cdmx,Palacio De Bellas Artes,"A waste of my time!. I'm glad ( as a senior citizen.) l didn't have to pay to get into this absolutely boring ""so-called"" art museum!It had no significant works of art & other than the actual building being beautiful, that's about it!Do yourselves a favour & get an Uber to the FREE Museo Soumaya which has many works of art by well known artists like Renoir, Van Gogh, Pissarro & sculptures by Rodan.",Negativo,Negativo
Beautiful building and murals,"I visited on a free Sunday otherwise I would not have been able to fit this into my trip. It was busy as expected so my advice is, avoid the free day if you can afford it. The art deco interior detail is wonderful, as usual the exterior and its features.The murals are huge and I loved taking them in at different levels.Saw some interesting art in the small exhibit rooms. Loved the 3D sectional model and technical drawings on top floor.Sadly unable to see the theatre room and my attempt to buy tickets to the ballet didn’t align date wise.Cafe and bookshop/souvenirs onsite.1.5hours happily spent here.Popped into Sears to get a view from across the street and to grab a bite at the 6th floor cafe but the queue was too long so I abandoned that idea.",5,2024-12-01,Cdmx,Palacio De Bellas Artes,"Beautiful building and murals. I visited on a free Sunday otherwise I would not have been able to fit this into my trip. It was busy as expected so my advice is, avoid the free day if you can afford it. The art deco interior detail is wonderful, as usual the exterior and its features.The murals are huge and I loved taking them in at different levels.Saw some interesting art in the small exhibit rooms. Loved the 3D sectional model and technical drawings on top floor.Sadly unable to see the theatre room and my attempt to buy tickets to the ballet didn’t align date wise.Cafe and bookshop/souvenirs onsite.1.5hours happily spent here.Popped into Sears to get a view from across the street and to grab a bite at the 6th floor cafe but the queue was too long so I abandoned that idea.",Positivo,Positivo
Murals,"A lot of Murals and art work by various Mexican artists including Diego Rivera displayed over 3 floors. Also temporary exhibitions of other artists of other forms of art (glass, etc). The famous mural by Diego Rivera ""Man at Crossroads"" is quite cool to view. The building itself is very     magnificent to see in itself. Museum is free to visit on Sundays, otherwise it is $95 Mexican Peso's.",5,2024-12-01,Cdmx,Palacio De Bellas Artes,"Murals. A lot of Murals and art work by various Mexican artists including Diego Rivera displayed over 3 floors. Also temporary exhibitions of other artists of other forms of art (glass, etc). The famous mural by Diego Rivera ""Man at Crossroads"" is quite cool to view. The building itself is very     magnificent to see in itself. Museum is free to visit on Sundays, otherwise it is $95 Mexican Peso's.",Positivo,Positivo
"I had anticipated seeing a lot of national art, but I was let down.","The structure is a marvel in and of itself. Although admission is free, there isn't much to see other than the second-floor murals;",4,2024-12-01,Cdmx,Palacio De Bellas Artes,"I had anticipated seeing a lot of national art, but I was let down. The structure is a marvel in and of itself. Although admission is free, there isn't much to see other than the second-floor murals;.",Positivo,Positivo
"Ballet folclórico de Amalia Hernandez vale la pena, a pesar del personal grosero","Fuimos a ver el ballet folclórico de Amalia Hernandez. Excelente espectáculo y el teatro muy bello en su arquitectura y diseño. Mucho desorden para el ingreso pues los ""ujieres"" no saben nada y te manda de allá para acá.  Llegamos tipo 5 y 10 con boletos electrónicos para no hacer filas y la entrada era a las 5:30 pm. No hay baños disponibles a menos que tengas un boleto y no te dejan pasar hasta pasadas las 5:30. Igual tuvimos que hacer fila para ingresar a la sala, de pie junto con personas mayores y sin sitio para sentarse. A pesar de haber revisado nuestros boletos nos mandaron al área equivocada. El personal de muy mal talante y malhumorado. Eso disminuye el disfrute de un espectáculo de primera. Vayan preparados y con paciencia si tienen que ir al baño. El tránsito para llegar simplemente imposible. Mejor llegar en metro.",4,2024-12-01,Cdmx,Palacio De Bellas Artes,"Ballet folclórico de Amalia Hernandez vale la pena, a pesar del personal grosero. Fuimos a ver el ballet folclórico de Amalia Hernandez. Excelente espectáculo y el teatro muy bello en su arquitectura y diseño. Mucho desorden para el ingreso pues los ""ujieres"" no saben nada y te manda de allá para acá.  Llegamos tipo 5 y 10 con boletos electrónicos para no hacer filas y la entrada era a las 5:30 pm. No hay baños disponibles a menos que tengas un boleto y no te dejan pasar hasta pasadas las 5:30. Igual tuvimos que hacer fila para ingresar a la sala, de pie junto con personas mayores y sin sitio para sentarse. A pesar de haber revisado nuestros boletos nos mandaron al área equivocada. El personal de muy mal talante y malhumorado. Eso disminuye el disfrute de un espectáculo de primera. Vayan preparados y con paciencia si tienen que ir al baño. El tránsito para llegar simplemente imposible. Mejor llegar en metro.",Positivo,Negativo
Visita obligada si vas a CDMX,"Un imperdible en la Ciudad de México. Desde la arquitectura, los detalles de la iluminación, los techos, columnas, todo el edificio en si mismo hasta los murales expuestos. Una maravilla!",5,2024-10-01,Cdmx,Palacio De Bellas Artes,"Visita obligada si vas a CDMX. Un imperdible en la Ciudad de México. Desde la arquitectura, los detalles de la iluminación, los techos, columnas, todo el edificio en si mismo hasta los murales expuestos. Una maravilla!.",Positivo,Positivo
"Palacio de Bellas Artes, Ciudad de México en octubre","Vea la cortina de mosaico de Tiffany haciendo el recorrido libre dentro del teatro. No sabíamos nada al respecto, solo entramos a echar un vistazo y vimos larga cola y preguntamos para qué servía. Afortunadamente esa era la cola de habla hispana y la servicial señora aconsejó que la inglesa empezaba pronto y era solo un puñado de personas. Creo que está dirigido por estudiantes, su inglés era bueno e hicieron un buen trabajo explicando la historia. Al final dieron una demostración de la enorme cortina que se levanta. Hay una cafetería y una tienda de regalos aquí.",5,2024-10-01,Cdmx,Palacio De Bellas Artes,"Palacio de Bellas Artes, Ciudad de México en octubre. Vea la cortina de mosaico de Tiffany haciendo el recorrido libre dentro del teatro. No sabíamos nada al respecto, solo entramos a echar un vistazo y vimos larga cola y preguntamos para qué servía. Afortunadamente esa era la cola de habla hispana y la servicial señora aconsejó que la inglesa empezaba pronto y era solo un puñado de personas. Creo que está dirigido por estudiantes, su inglés era bueno e hicieron un buen trabajo explicando la historia. Al final dieron una demostración de la enorme cortina que se levanta. Hay una cafetería y una tienda de regalos aquí.",Positivo,Negativo
De visita por CDMX,"Una arquitectura llamativa en especial de noche donde se aprecia cada línea, céntrica y un buen ambiente animador, excelente",5,2024-10-01,Cdmx,Palacio De Bellas Artes,"De visita por CDMX. Una arquitectura llamativa en especial de noche donde se aprecia cada línea, céntrica y un buen ambiente animador, excelente.",Positivo,Positivo
Hermoso art déco,"Claramente uno de los hitos de la Ciudad de México, destacada arquitectura del Art Déco con clara influencia del arte indígena.",5,2024-10-01,Cdmx,Palacio De Bellas Artes,"Hermoso art déco. Claramente uno de los hitos de la Ciudad de México, destacada arquitectura del Art Déco con clara influencia del arte indígena.",Positivo,Positivo
Bellas Artes son exageradas en el buen sentido,Vine por los murales de Diego Rivera y descubrí mucho más. La artesanía del edificio en sí es impresionante. Tuve la suerte de encontrarme con un Guía en inglés que me ayudó a apreciar el trabajo de Diego y otros. También hubo una exposición de escultura y Opinión del edificio sobre el 90 cumpleaños. Tuve una excelente sopa en el café. Gratis para mayores de 60 años.,5,2024-10-01,Cdmx,Palacio De Bellas Artes,Bellas Artes son exageradas en el buen sentido. Vine por los murales de Diego Rivera y descubrí mucho más. La artesanía del edificio en sí es impresionante. Tuve la suerte de encontrarme con un Guía en inglés que me ayudó a apreciar el trabajo de Diego y otros. También hubo una exposición de escultura y Opinión del edificio sobre el 90 cumpleaños. Tuve una excelente sopa en el café. Gratis para mayores de 60 años.,Positivo,Neutro
Me encantó,Recomiendo encarecidamente el palacio de bellas artes. es un hermoso museo con mucha obra de arte de los artistas famosos en mexico. debes ver,4,2024-09-01,Cdmx,Palacio De Bellas Artes,Me encantó. Recomiendo encarecidamente el palacio de bellas artes. es un hermoso museo con mucha obra de arte de los artistas famosos en mexico. debes ver.,Positivo,Positivo
Guaau precioso lugar,"Un imperdible si vas a la ciudad de mexico. El edificio es precioso y mas lindo en persona que en fotografías, lastima que es un lugar muy con urrido y es dificil fotografiarlo.",5,2024-08-01,Cdmx,Palacio De Bellas Artes,"Guaau precioso lugar. Un imperdible si vas a la ciudad de mexico. El edificio es precioso y mas lindo en persona que en fotografías, lastima que es un lugar muy con urrido y es dificil fotografiarlo.",Positivo,Positivo
