Titulo,Review,Calificacion,FechaEstadia,Ciudad,Atraccion,TituloReview,Sentimiento,SentimientoHF
Museo y yacimiento.,"Gran museo, dividido en dos edificios, y yacimiento arqueológico en constante excavación. El museo alberga una maqueta de Tenochtitlán y piezas del yacimiento. Destaca a su vez la gran piedra circular de Coyolxauhqui. Se puede pasear por el yacimiento, aunque no por todas las áreas. ",4,2023-10-01,Cdmx,Museo Del Templo Mayor,"Museo y yacimiento. Gran museo, dividido en dos edificios, y yacimiento arqueológico en constante excavación. El museo alberga una maqueta de Tenochtitlán y piezas del yacimiento. Destaca a su vez la gran piedra circular de Coyolxauhqui. Se puede pasear por el yacimiento, aunque no por todas las áreas.",Positivo,Positivo
Lots of History ,"The remains of the external walls can be viewed from the street, but it is the museum where you can see so many interesting historic pieces.",4,2023-11-01,Cdmx,Museo Del Templo Mayor,"Lots of History. The remains of the external walls can be viewed from the street, but it is the museum where you can see so many interesting historic pieces.",Positivo,Positivo
Fascinating and informative ,"A fascinating and wonderful sight, right in the centre of the city, the temple is always a good visit and the museum on the sight is very interesting explaining not just the temple but of pre Hispanic Mexico.",5,2023-10-01,Cdmx,Museo Del Templo Mayor,"Fascinating and informative. A fascinating and wonderful sight, right in the centre of the city, the temple is always a good visit and the museum on the sight is very interesting explaining not just the temple but of pre Hispanic Mexico.",Positivo,Positivo
AMAZING....missing this is like missing The Forum if you go to Rome!!!,"I can only say ""head bending.""  This is a must see top three in Mexico City. The excavation and preservation of the site is world class, particularly that the Spanish tore it down!  The relics that are on display in the museum structure at the back are not to be missed.  It's a 4 story structure, and you don't really get a good sense on the ground floor that it's worth going in, but don't miss it!  Every floor gets better, and you can spend an hour here and you will see critical findings that you don't see at the Anthropology Museum.  I was stunned by how affordable the museum is and how few people were there, as the entrance is obscure as it's underground at the back right corner of the cathedral, and not particularly well marked. However, the museum is NOT the little underground area where the tickets are sold, but the massive 4 story structure on the other side of the temple excavations. ",5,2023-09-01,Cdmx,Museo Del Templo Mayor,"AMAZING....missing this is like missing The Forum if you go to Rome!!!. I can only say ""head bending.""  This is a must see top three in Mexico City. The excavation and preservation of the site is world class, particularly that the Spanish tore it down!  The relics that are on display in the museum structure at the back are not to be missed.  It's a 4 story structure, and you don't really get a good sense on the ground floor that it's worth going in, but don't miss it!  Every floor gets better, and you can spend an hour here and you will see critical findings that you don't see at the Anthropology Museum.  I was stunned by how affordable the museum is and how few people were there, as the entrance is obscure as it's underground at the back right corner of the cathedral, and not particularly well marked. However, the museum is NOT the little underground area where the tickets are sold, but the massive 4 story structure on the other side of the temple excavations.",Positivo,Positivo
PRINCIPAL TEMPLO DE LA CULTURA MEXICA,Caminamos por el zócalo y llegamos a este Museo este sitio es lo que fuera el principal templo de la civilización mexica y exhibe más de 14000 objetos.Es fascinante adentrarnos a la historia y conocer más acerca de las civilizaciones. ,5,2023-08-01,Cdmx,Museo Del Templo Mayor,PRINCIPAL TEMPLO DE LA CULTURA MEXICA. Caminamos por el zócalo y llegamos a este Museo este sitio es lo que fuera el principal templo de la civilización mexica y exhibe más de 14000 objetos.Es fascinante adentrarnos a la historia y conocer más acerca de las civilizaciones.,Positivo,Positivo
Almost lost ruins,"The Templo Mayor is a must ruin was almost lost to history until it was rediscovered about 100 years ago. The location has ruins and a museum that takes a few hours. If you like history and ruins, you must see.",5,2023-07-01,Cdmx,Museo Del Templo Mayor,"Almost lost ruins. The Templo Mayor is a must ruin was almost lost to history until it was rediscovered about 100 years ago. The location has ruins and a museum that takes a few hours. If you like history and ruins, you must see.",Positivo,Positivo
No vayan a los restaurantes que están en la terraza!!!! FRAUDE TOTAL!!!,"Fuimos de visita a pasar un fin de semana en CDMX y pensamos en tomar un descanso en los restaurantes que están en las terrazas del zocalo para disfrutar la vista.Al principio todo bien. Atentos. Jarra de agua de cortesía. Sin embargo,  terminó siendo una pésima decisión.De una cuenta de $3350 (ya incluyendo la jarra de agua más cara de nuestras vidas), nos terminaron cobrando $5061:  jarra de agua en $499, un consumo (cover) de $533 y un importe que no supimos ni de qué fue.Pides explicaciones y no te entregan ticket, te presionan para que pagues.Íbamos con niños, así que no quisimos entrar en discusión,  pero por favor, tengan cuidado!(Adjunto ticket)",1,2025-08-01,Cdmx,Zocalo De La Ciudad De Mexico,"No vayan a los restaurantes que están en la terraza!!!! FRAUDE TOTAL!!!. Fuimos de visita a pasar un fin de semana en CDMX y pensamos en tomar un descanso en los restaurantes que están en las terrazas del zocalo para disfrutar la vista.Al principio todo bien. Atentos. Jarra de agua de cortesía. Sin embargo,  terminó siendo una pésima decisión.De una cuenta de $3350 (ya incluyendo la jarra de agua más cara de nuestras vidas), nos terminaron cobrando $5061:  jarra de agua en $499, un consumo (cover) de $533 y un importe que no supimos ni de qué fue.Pides explicaciones y no te entregan ticket, te presionan para que pagues.Íbamos con niños, así que no quisimos entrar en discusión,  pero por favor, tengan cuidado!(Adjunto ticket).",Negativo,Negativo
Zócalo de la Ciudad de México,El corazón de la CDMX: enorme plaza llena de historia y sede de grandes eventos. Rodeada de edificios emblemáticos y un ambiente lleno de vida.,5,2025-06-01,Cdmx,Zocalo De La Ciudad De Mexico,Zócalo de la Ciudad de México. El corazón de la CDMX: enorme plaza llena de historia y sede de grandes eventos. Rodeada de edificios emblemáticos y un ambiente lleno de vida.,Positivo,Positivo
no es bueno,"esto fue un desastre debido a miles de maestros que protestaban. había cientos de tiendas, caminar no era agradable",1,2025-05-01,Cdmx,Zocalo De La Ciudad De Mexico,"no es bueno. esto fue un desastre debido a miles de maestros que protestaban. había cientos de tiendas, caminar no era agradable.",Negativo,Negativo
Solas y esparcimiento ,"Es un espacio donde se observa creatividad , comercio, arte gastronomía, gente amable,espacio seguro,la organización de las actividades. Y distribución de chinamos y la accesibilidad de vendedores es digna de admirar.Me encanta México. ",5,2025-06-01,Cdmx,Zocalo De La Ciudad De Mexico,"Solas y esparcimiento. Es un espacio donde se observa creatividad , comercio, arte gastronomía, gente amable,espacio seguro,la organización de las actividades. Y distribución de chinamos y la accesibilidad de vendedores es digna de admirar.Me encanta México.",Positivo,Positivo
Plaza enorme,"Gran espacio abierto. Cuando asistimos no había nada en IT sin embargo había gente ofreciendo bendiciones tradicionales por una pequeña tarifa frente a la iglesia, que era genial. La zona en sí era agradable para pasear con un montón de arquitectura diferente.",5,2025-03-01,Cdmx,Zocalo De La Ciudad De Mexico,"Plaza enorme. Gran espacio abierto. Cuando asistimos no había nada en IT sin embargo había gente ofreciendo bendiciones tradicionales por una pequeña tarifa frente a la iglesia, que era genial. La zona en sí era agradable para pasear con un montón de arquitectura diferente.",Positivo,Positivo
¡No vayas allí!  IT ha convertido en un campamento gigante para personas sin hogar.,¡No vayas allí! Toda la plaza y las calles adyacentes han sido ocupadas por enormes campamentos de personas sin hogar. La zona está completamente cubierta de tiendas ITh y lonas con cuerdas que hacen imposible llegar. Estábamos atrapados tratando de salir de este lío y IT era una situación aterradora.,1,2025-05-01,Cdmx,Zocalo De La Ciudad De Mexico,¡No vayas allí!  IT ha convertido en un campamento gigante para personas sin hogar. ¡No vayas allí! Toda la plaza y las calles adyacentes han sido ocupadas por enormes campamentos de personas sin hogar. La zona está completamente cubierta de tiendas ITh y lonas con cuerdas que hacen imposible llegar. Estábamos atrapados tratando de salir de este lío y IT era una situación aterradora.,Negativo,Negativo
Bello,"Bellamente bello no hay belleza que se pueda embellecer bellamente ese lugar es simplemente bello,bello,bello (bello)",5,2024-06-01,Cdmx,Zocalo De La Ciudad De Mexico,"Bello. Bellamente bello no hay belleza que se pueda embellecer bellamente ese lugar es simplemente bello,bello,bello (bello).",Positivo,Positivo
"Un corazón poderoso y cultural de la Ciudad de México, lleno de energía e historia","El Zócalo (o Plaza de la Constitución) es algo más que una plaza principal: es el latido de la Ciudad de México. De pie aquí, rodeado de siglos de historia, sentí esta profunda conexión con el alma de la ciudad. Es donde el pasado y el presente chocan: la Catedral Metropolitana de la Ciudad de México a un lado, el Palacio Nacional al otro y los restos del antiguo Templo Mayor Azteca a pocos pasos. Ya sea que sea tu primera vez en la Ciudad de México o la quinta, el Zócalo siempre causa una impresión. La energía es palpable — escucharás músicos callejeros, verás bailarines, manifestantes, celebraciones... es un espacio de vida, de respiración. Fue uno de los primeros lugares que visité en mi viaje en solitario, y caminar por él solo me pareció empoderador. Hay algo fundamental en estar en un lugar tan poderoso por tu cuenta. Si lo visitas, tómate tu tiempo. Siéntate en un banco. Vigila a los lugareños. Siente el ritmo de la ciudad. Y definitivamente parar a comer algo cerca - los tacos siempre son una buena idea.",5,2024-06-01,Cdmx,Zocalo De La Ciudad De Mexico,"Un corazón poderoso y cultural de la Ciudad de México, lleno de energía e historia. El Zócalo (o Plaza de la Constitución) es algo más que una plaza principal: es el latido de la Ciudad de México. De pie aquí, rodeado de siglos de historia, sentí esta profunda conexión con el alma de la ciudad. Es donde el pasado y el presente chocan: la Catedral Metropolitana de la Ciudad de México a un lado, el Palacio Nacional al otro y los restos del antiguo Templo Mayor Azteca a pocos pasos. Ya sea que sea tu primera vez en la Ciudad de México o la quinta, el Zócalo siempre causa una impresión. La energía es palpable — escucharás músicos callejeros, verás bailarines, manifestantes, celebraciones... es un espacio de vida, de respiración. Fue uno de los primeros lugares que visité en mi viaje en solitario, y caminar por él solo me pareció empoderador. Hay algo fundamental en estar en un lugar tan poderoso por tu cuenta. Si lo visitas, tómate tu tiempo. Siéntate en un banco. Vigila a los lugareños. Siente el ritmo de la ciudad. Y definitivamente parar a comer algo cerca - los tacos siempre son una buena idea.",Positivo,Positivo
Excelente experiencia!!!,"Los servicios eran excelentes, buena ubicación, excelentes vistas; buena comida; La gerente general Fernanda Lozano hizo todo lo posible para asegurarse de que tuvimos una experiencia increíble, lo recomiendo totalmente.",5,2025-03-01,Cdmx,Zocalo De La Ciudad De Mexico,"Excelente experiencia!!!. Los servicios eran excelentes, buena ubicación, excelentes vistas; buena comida; La gerente general Fernanda Lozano hizo todo lo posible para asegurarse de que tuvimos una experiencia increíble, lo recomiendo totalmente.",Positivo,Positivo
El punto de partida central para visitar la Ciudad de México,Un lugar obligado para cualquier viaje a la Ciudad de México. Enorme plaza abierta con la bandera más grande que jamás verás. Siempre pasa algo aquí con un ambiente maravilloso.,5,2025-03-01,Cdmx,Zocalo De La Ciudad De Mexico,El punto de partida central para visitar la Ciudad de México. Un lugar obligado para cualquier viaje a la Ciudad de México. Enorme plaza abierta con la bandera más grande que jamás verás. Siempre pasa algo aquí con un ambiente maravilloso.,Positivo,Positivo
¡Un banquete visual! ¡Haz un punto para visitar y caminar por las calles!,"Una enorme bandera mexicana se encuentra en el centro de la gran plaza. A un lado está la gran catedral que es igualmente impresionante por dentro y por fuera. ¡Es la oportunidad fotográfica por excelencia! En el interior es muy ornamentado y el órgano doble vale la pena verlo. Era libre de entrar cuando fuimos. Se le pide que no tome fotos durante la misa, pero estuvo bien en otras ocasiones. En el exterior encontrarás artistas callejeros, vestidos con trajes tradicionales y bailando al ritmo de tambores tradicionales. Es muy evocador y es fácil imaginar cómo era este espacio cuando era Tenochtitlan. Caminamos hasta aquí, ya que hay MUCHOS edificios hermosos alrededor de la ubicación general, junto con otros artistas y puestos bordean los caminos a lo largo de la calle principal y el parque circundante.",5,2025-02-01,Cdmx,Zocalo De La Ciudad De Mexico,"¡Un banquete visual! ¡Haz un punto para visitar y caminar por las calles!. Una enorme bandera mexicana se encuentra en el centro de la gran plaza. A un lado está la gran catedral que es igualmente impresionante por dentro y por fuera. ¡Es la oportunidad fotográfica por excelencia! En el interior es muy ornamentado y el órgano doble vale la pena verlo. Era libre de entrar cuando fuimos. Se le pide que no tome fotos durante la misa, pero estuvo bien en otras ocasiones. En el exterior encontrarás artistas callejeros, vestidos con trajes tradicionales y bailando al ritmo de tambores tradicionales. Es muy evocador y es fácil imaginar cómo era este espacio cuando era Tenochtitlan. Caminamos hasta aquí, ya que hay MUCHOS edificios hermosos alrededor de la ubicación general, junto con otros artistas y puestos bordean los caminos a lo largo de la calle principal y el parque circundante.",Positivo,Positivo
Zócalo capitalino,"Actualmente ya es peatonal, se disfruta al máximo la experiencia de ver todos los monumentos. Ven a disfrutar de México",5,2025-02-01,Cdmx,Zocalo De La Ciudad De Mexico,"Zócalo capitalino. Actualmente ya es peatonal, se disfruta al máximo la experiencia de ver todos los monumentos. Ven a disfrutar de México.",Positivo,Positivo
¡Una visita obligada!,¡El zócalo es una visita obligada! Simplemente entré a la plaza y es una enorme área llena de vendedores y otros que solo respetan la cultura de México. Gran lugar para fotos y para interactuar con grandes restaurantes / vendedores / locales.,5,2025-02-01,Cdmx,Zocalo De La Ciudad De Mexico,¡Una visita obligada!. ¡El zócalo es una visita obligada! Simplemente entré a la plaza y es una enorme área llena de vendedores y otros que solo respetan la cultura de México. Gran lugar para fotos y para interactuar con grandes restaurantes / vendedores / locales.,Positivo,Positivo
Asombrosamente hermoso centro de la ciudad,"Al planear nuestro viaje a la Ciudad de México, quería reservar un hotel con fácil acceso al Zócalo en el corazón del casco histórico de la ciudad. Tuvimos suerte, aterrizando 2. A 5 cuadras de la Plaza de la Constitución - a solo cinco minutos a pie. Este peatón - única porción de bienes raíces es el latido del corazón de toda la ciudad. Nos amontonamos en la plaza nuestro primer día, precisamente cuando las campanas del mediodía comenzaron a sonar en las torres de la Catedral Metropolitana. La belleza era tan abrumadora que nos quedamos atónitos... y llorosos de ojos. Durante nuestra estancia, volvimos aquí cada día para encontrar nuevas sorpresas. Una tarde, nos encontramos con actuaciones de danza azteca. Todos los días se instalaban mercados ambulantes en la plaza, con vendedores que vendían comida local y todo tipo de baratijas (con excepción de recuerdos, una carencia bastante significativa). Vimos músicos locales tocando para propinas justo al lado de la plaza. Un joven tocando una bachata perfecta en su saxofón fue otra lágrima - jerker, al igual que un violonchelista brillante que se instaló y tocó el domingo por la noche. Sentí como si estuviera en Europa. Otro día nos topamos con Templo Mayor en el extremo norte de la plaza, que alguna vez fue la gran pirámide de Tenochtitlán. Este es el sitio de ruinas aztecas del asentamiento original aquí, que data de hace setecientos años. Puede ver las ruinas desde una plataforma sobre la plaza, o puede ir bajo tierra y pagar por recorrerlas. Las multitudes eran masivas, pero todos tenían buenos modales, posiblemente debido a una notable presencia policial. Como dos mujeres viajando juntas, mi hija y yo nos sentimos muy seguros en toda esta sección de la ciudad. Hay tanto que ver solo en este pequeño segmento del distrito histórico que podría pasar días aquí mismo. Explora cada rincón.",5,2025-01-01,Cdmx,Zocalo De La Ciudad De Mexico,"Asombrosamente hermoso centro de la ciudad. Al planear nuestro viaje a la Ciudad de México, quería reservar un hotel con fácil acceso al Zócalo en el corazón del casco histórico de la ciudad. Tuvimos suerte, aterrizando 2. A 5 cuadras de la Plaza de la Constitución - a solo cinco minutos a pie. Este peatón - única porción de bienes raíces es el latido del corazón de toda la ciudad. Nos amontonamos en la plaza nuestro primer día, precisamente cuando las campanas del mediodía comenzaron a sonar en las torres de la Catedral Metropolitana. La belleza era tan abrumadora que nos quedamos atónitos... y llorosos de ojos. Durante nuestra estancia, volvimos aquí cada día para encontrar nuevas sorpresas. Una tarde, nos encontramos con actuaciones de danza azteca. Todos los días se instalaban mercados ambulantes en la plaza, con vendedores que vendían comida local y todo tipo de baratijas (con excepción de recuerdos, una carencia bastante significativa). Vimos músicos locales tocando para propinas justo al lado de la plaza. Un joven tocando una bachata perfecta en su saxofón fue otra lágrima - jerker, al igual que un violonchelista brillante que se instaló y tocó el domingo por la noche. Sentí como si estuviera en Europa. Otro día nos topamos con Templo Mayor en el extremo norte de la plaza, que alguna vez fue la gran pirámide de Tenochtitlán. Este es el sitio de ruinas aztecas del asentamiento original aquí, que data de hace setecientos años. Puede ver las ruinas desde una plataforma sobre la plaza, o puede ir bajo tierra y pagar por recorrerlas. Las multitudes eran masivas, pero todos tenían buenos modales, posiblemente debido a una notable presencia policial. Como dos mujeres viajando juntas, mi hija y yo nos sentimos muy seguros en toda esta sección de la ciudad. Hay tanto que ver solo en este pequeño segmento del distrito histórico que podría pasar días aquí mismo. Explora cada rincón.",Positivo,Positivo
Debo ver,Enorme y masiva plaza rodeada de hermosa arquitectura. Esta es una visita obligada cuando en el centro histórico de la Ciudad de México.,5,2025-02-01,Cdmx,Zocalo De La Ciudad De Mexico,Debo ver. Enorme y masiva plaza rodeada de hermosa arquitectura. Esta es una visita obligada cuando en el centro histórico de la Ciudad de México.,Positivo,Positivo
Espacio impresionante,"Qué corazón maravilloso para una ciudad. El Zócalo (o Plaza de la Constitución) es una vasta plaza abierta rodeada de edificios religiosos y municipales significativamente grandes. Un escenario cubierto moderno estaba allí cuando visitamos, así que obviamente también alberga grandes eventos. También vimos el derribo de la ceremonia de la bandera cuando se acercaba el anochecer. Todo glorioso y encantador.",5,2025-01-01,Cdmx,Zocalo De La Ciudad De Mexico,"Espacio impresionante. Qué corazón maravilloso para una ciudad. El Zócalo (o Plaza de la Constitución) es una vasta plaza abierta rodeada de edificios religiosos y municipales significativamente grandes. Un escenario cubierto moderno estaba allí cuando visitamos, así que obviamente también alberga grandes eventos. También vimos el derribo de la ceremonia de la bandera cuando se acercaba el anochecer. Todo glorioso y encantador.",Positivo,Positivo
Gran Plaza y calle peatonal de tiendas/restaurantes,La plaza y la calle peatonal en el distrito histórico es una parada obligada. Por casualidad vimos un concierto gratis por la noche lleno de gente. La calle a pie siempre está llena de gente,4,2025-01-01,Cdmx,Zocalo De La Ciudad De Mexico,Gran Plaza y calle peatonal de tiendas/restaurantes. La plaza y la calle peatonal en el distrito histórico es una parada obligada. Por casualidad vimos un concierto gratis por la noche lleno de gente. La calle a pie siempre está llena de gente.,Positivo,Positivo
Ideal para una parada rápida - espera multitudes,"Este es el centro histórico en CDMX. No pasé mucho tiempo allí y me pareció genial. Está lleno de gente, así que camine y vea los sitios arqueológicos y la iglesia y eso fue lo suficientemente bueno para mí. Vale la pena ir a ver, pero no pasaría más de 1 hora. Tienen conciertos y eventos por la noche, eso puede ser divertido, pero yo no lo hice.",4,2025-01-01,Cdmx,Zocalo De La Ciudad De Mexico,"Ideal para una parada rápida - espera multitudes. Este es el centro histórico en CDMX. No pasé mucho tiempo allí y me pareció genial. Está lleno de gente, así que camine y vea los sitios arqueológicos y la iglesia y eso fue lo suficientemente bueno para mí. Vale la pena ir a ver, pero no pasaría más de 1 hora. Tienen conciertos y eventos por la noche, eso puede ser divertido, pero yo no lo hice.",Positivo,Positivo
Visita obligatoria,"“El Zócalo es un lugar icónico de la Ciudad de México, bien mantenido y con un ambiente que combina historia y modernidad. Alrededor encontrarás excelentes restaurantes para todos los gustos, convirtiéndolo en un punto imperdible para cualquier visitante.”",4,2025-01-01,Cdmx,Zocalo De La Ciudad De Mexico,"Visita obligatoria. “El Zócalo es un lugar icónico de la Ciudad de México, bien mantenido y con un ambiente que combina historia y modernidad. Alrededor encontrarás excelentes restaurantes para todos los gustos, convirtiéndolo en un punto imperdible para cualquier visitante.”.",Positivo,Positivo
Centro histórico de la ciudad,Plaza histórica en el centro de la Ciudad de México. Catedral Metropolitana y ruinas del Templo Mayor son solo algunas de las cosas que ver aquí.,5,2024-10-01,Cdmx,Zocalo De La Ciudad De Mexico,Centro histórico de la ciudad. Plaza histórica en el centro de la Ciudad de México. Catedral Metropolitana y ruinas del Templo Mayor son solo algunas de las cosas que ver aquí.,Positivo,Positivo
"Zócalo, Ciudad de México en octubre","Había una feria de libros y papelería aquí durante nuestro tiempo en la ciudad. No podía ver mucho de la plaza debido a todas las tiendas. Pero de todos modos es solo una plaza central de la ciudad que se encuentra en muchas ciudades de todo el mundo, un buen lugar para conocer, y luego salir corriendo por una de las calles para ver cosas más interesantes.",3,2024-10-01,Cdmx,Zocalo De La Ciudad De Mexico,"Zócalo, Ciudad de México en octubre. Había una feria de libros y papelería aquí durante nuestro tiempo en la ciudad. No podía ver mucho de la plaza debido a todas las tiendas. Pero de todos modos es solo una plaza central de la ciudad que se encuentra en muchas ciudades de todo el mundo, un buen lugar para conocer, y luego salir corriendo por una de las calles para ver cosas más interesantes.",Neutro,Positivo
En el corazòn de CDMX,"Impresionante! Espacio enorme, rodeado de imponentes edificaciones, con variadas opciones gastronòmicas y comerciales en los alrededores, desde el boulevard de acceso.",4,2024-08-01,Cdmx,Zocalo De La Ciudad De Mexico,"En el corazòn de CDMX. Impresionante! Espacio enorme, rodeado de imponentes edificaciones, con variadas opciones gastronòmicas y comerciales en los alrededores, desde el boulevard de acceso.",Positivo,Positivo
Impresionante arquitectura más fantástico Templo Mayor,"La plaza en sí fue cerrada para prepararse para el día de la independencia, pero se podía caminar alrededor del perímetro y ver la Catedral, Templo Mayor, Palacio Nacional y los otros edificios circundantes. Me gustó mucho, particularmente Templo Mayor - pasé una hora allí.",4,2024-09-01,Cdmx,Zocalo De La Ciudad De Mexico,"Impresionante arquitectura más fantástico Templo Mayor. La plaza en sí fue cerrada para prepararse para el día de la independencia, pero se podía caminar alrededor del perímetro y ver la Catedral, Templo Mayor, Palacio Nacional y los otros edificios circundantes. Me gustó mucho, particularmente Templo Mayor - pasé una hora allí.",Positivo,Positivo
