Titulo,Review,Calificacion,FechaEstadia,Ciudad,Atraccion,TituloReview,Sentimiento,SentimientoHF
Increíble la exposición de Rodin y hermoso museo!,"He visitado dos veces este museo cuya estructura y apariencia es impresionante, me encanta, en esta ocasión había una exposición temporal de Rodin que me fascinó!",5,2025-03-01,Cdmx,Museo Soumaya,"Increíble la exposición de Rodin y hermoso museo!. He visitado dos veces este museo cuya estructura y apariencia es impresionante, me encanta, en esta ocasión había una exposición temporal de Rodin que me fascinó!.",Positivo,Positivo
Unique Building and an Interesting Mix of Art & History,"We visited Museo Soumaya while in Mexico City, and it was definitely worth the stop. The building itself is really eye-catching—super modern and unlike anything else around. It’s right next to Museo Jumex, so you can easily see both in one trip.As soon as you walk in, the space feels huge and open. Everything inside is painted white, which gives it a really calming atmosphere. The museum has five floors, so there’s quite a bit of walking involved, but there’s a lot to see.The collection is quite varied. You start with Italian sculptures on the lower floor, then move through different exhibits with paintings, historical pieces, and even things like old telephones and communication displays. It’s kind of a mix of art and history, which made it quite fun to explore.If you’re into museums or just want to check out an interesting building and spend a few hours indoors, it’s a solid choice—and it’s free, which is always a bonus.",5,2025-04-01,Cdmx,Museo Soumaya,"Unique Building and an Interesting Mix of Art & History. We visited Museo Soumaya while in Mexico City, and it was definitely worth the stop. The building itself is really eye-catching—super modern and unlike anything else around. It’s right next to Museo Jumex, so you can easily see both in one trip.As soon as you walk in, the space feels huge and open. Everything inside is painted white, which gives it a really calming atmosphere. The museum has five floors, so there’s quite a bit of walking involved, but there’s a lot to see.The collection is quite varied. You start with Italian sculptures on the lower floor, then move through different exhibits with paintings, historical pieces, and even things like old telephones and communication displays. It’s kind of a mix of art and history, which made it quite fun to explore.If you’re into museums or just want to check out an interesting building and spend a few hours indoors, it’s a solid choice—and it’s free, which is always a bonus.",Positivo,Positivo
"Lo recomiendo , hermoso lugar !",Hermoso y su entrada es completamente gratis ! Se requieren al menos  unas 3 h para recorrerlo . Impresionante colección de obras de arte internacional y de artistas mexicanos !,5,2025-04-01,Cdmx,Museo Soumaya,"Lo recomiendo , hermoso lugar !. Hermoso y su entrada es completamente gratis ! Se requieren al menos  unas 3 h para recorrerlo . Impresionante colección de obras de arte internacional y de artistas mexicanos !.",Positivo,Positivo
Vale la pena,"Todo muy bonito, el museo es precioso por dentro y se nota mucho el cuidado que tiene, no tiene costo de entrada por lo que está lleno todo el día, pero vale totalmente la pena.",5,2025-03-01,Cdmx,Museo Soumaya,"Vale la pena. Todo muy bonito, el museo es precioso por dentro y se nota mucho el cuidado que tiene, no tiene costo de entrada por lo que está lleno todo el día, pero vale totalmente la pena.",Positivo,Positivo
gran colección,"gran colección una de las mejores colecciones no solo de México si no del mundo encontraras obras de arte de los grandes maestros de todos los tiempo de varios países, la conservación del acervo es muy buena, el tamaño de la colección es muy grande por lo que llevar zapatos cómodos y tiempo es lo básico, no recomiendo ir con niños es muy cansado para ellos por lo largo del recorrido",5,2025-03-01,Cdmx,Museo Soumaya,"gran colección. gran colección una de las mejores colecciones no solo de México si no del mundo encontraras obras de arte de los grandes maestros de todos los tiempo de varios países, la conservación del acervo es muy buena, el tamaño de la colección es muy grande por lo que llevar zapatos cómodos y tiempo es lo básico, no recomiendo ir con niños es muy cansado para ellos por lo largo del recorrido.",Positivo,Positivo
Línea va rápido,Espera a estar al sol. La línea va muy rápido. Hermoso museo. 5o piso no abierto y tan decepcionante. ¡Abre el lunes! ¡Libre!,4,2025-03-01,Cdmx,Museo Soumaya,Línea va rápido. Espera a estar al sol. La línea va muy rápido. Hermoso museo. 5o piso no abierto y tan decepcionante. ¡Abre el lunes! ¡Libre!.,Positivo,Positivo
Marginal,El edificio es interesante desde el exterior pero no tanto desde el interior. Una dispersión de buenas piezas en medio de una gran cantidad de arte de segunda y tercera clase.,3,2025-03-01,Cdmx,Museo Soumaya,Marginal. El edificio es interesante desde el exterior pero no tanto desde el interior. Una dispersión de buenas piezas en medio de una gran cantidad de arte de segunda y tercera clase.,Neutro,Neutro
Entrada libre y arte fantástico para ver,"Este museo tiene 6 niveles que tiene arte, bronce / mármol obra de numerosos artistas famosos como van Gogh, Rubens, Rivera, Turner, Dali, Picasso, Monet, Rodin, Renoir, Cezanne por nombrar algunos. Este es uno de los pocos museos en México que es de entrada libre. Los nombres del artista y cómo se llama la pieza se muestran junto a la obra en español e inglés.",5,2025-02-01,Cdmx,Museo Soumaya,"Entrada libre y arte fantástico para ver. Este museo tiene 6 niveles que tiene arte, bronce / mármol obra de numerosos artistas famosos como van Gogh, Rubens, Rivera, Turner, Dali, Picasso, Monet, Rodin, Renoir, Cezanne por nombrar algunos. Este es uno de los pocos museos en México que es de entrada libre. Los nombres del artista y cómo se llama la pieza se muestran junto a la obra en español e inglés.",Positivo,Positivo
Debo ver,Qué museo tan increíble. Es increíble desde el exterior y fantásticamente curado en el interior en muchas plantas. Para hacer justicia a la visita necesitas varias horas. Fue una pena que no hubiera cafetería.,5,2025-02-01,Cdmx,Museo Soumaya,Debo ver. Qué museo tan increíble. Es increíble desde el exterior y fantásticamente curado en el interior en muchas plantas. Para hacer justicia a la visita necesitas varias horas. Fue una pena que no hubiera cafetería.,Positivo,Positivo
Tienes que ir con tiempo,"Es un museo enorme, con varios pisos con gran cantidad de obras, por lo que puede resultar muy agotador, lo ideal es aprovechar los asientos que hay en cada piso para poder disfrutar lo que el museo tiene por ofrecer. Hay servicio de baños y son limpios. Tienen obras excepcionales, vale la pena la visita. Al no poder ingresar ni comida ni bebida, hay que hacer una fila después de pasar seguridad para que guarden tus objetos.",4,2025-02-01,Cdmx,Museo Soumaya,"Tienes que ir con tiempo. Es un museo enorme, con varios pisos con gran cantidad de obras, por lo que puede resultar muy agotador, lo ideal es aprovechar los asientos que hay en cada piso para poder disfrutar lo que el museo tiene por ofrecer. Hay servicio de baños y son limpios. Tienen obras excepcionales, vale la pena la visita. Al no poder ingresar ni comida ni bebida, hay que hacer una fila después de pasar seguridad para que guarden tus objetos.",Positivo,Positivo
Diseño muy bonito,"“Es un museo realmente hermoso, que no solo destaca por su arquitectura, sino también por su cuidada colección. Cada exposición ofrece una experiencia enriquecedora, llena de piezas interesantes que capturan la atención de los visitantes.”",4,2025-01-01,Cdmx,Museo Soumaya,"Diseño muy bonito. “Es un museo realmente hermoso, que no solo destaca por su arquitectura, sino también por su cuidada colección. Cada exposición ofrece una experiencia enriquecedora, llena de piezas interesantes que capturan la atención de los visitantes.”.",Positivo,Positivo
Uno de los mejores del mundo,"Desde el momento en que vea el exterior de este moderno edificio hasta entrar en el espacioso interior de flujo blanco con una réplica de tamaño natural de David en el vestíbulo, ¡se sorprenderá con los 6 pisos de arte de artistas y escultores famosos del mundo! ¡En realidad pone a TODOS los museos de arte en CDMX a la sombra! ¡Sólo ve allí, por favor!",5,2024-12-01,Cdmx,Museo Soumaya,"Uno de los mejores del mundo. Desde el momento en que vea el exterior de este moderno edificio hasta entrar en el espacioso interior de flujo blanco con una réplica de tamaño natural de David en el vestíbulo, ¡se sorprenderá con los 6 pisos de arte de artistas y escultores famosos del mundo! ¡En realidad pone a TODOS los museos de arte en CDMX a la sombra! ¡Sólo ve allí, por favor!.",Positivo,Positivo
"¡Si vas a este museo, haz este tour!","Excelente tour. Me sorprendió el conocimiento de la guía. Si de alguna manera te interesa el arte o la historia, te recomendaría este tour. El guía era servicial y servicial en muchos aspectos. Muy bien en general. Además, como el museo no tiene audioguía, realmente es una necesidad si quieres aprender sobre las increíbles obras de Rodan, van gough y maestros mexicanos.",5,2024-12-01,Cdmx,Museo Soumaya,"¡Si vas a este museo, haz este tour!. Excelente tour. Me sorprendió el conocimiento de la guía. Si de alguna manera te interesa el arte o la historia, te recomendaría este tour. El guía era servicial y servicial en muchos aspectos. Muy bien en general. Además, como el museo no tiene audioguía, realmente es una necesidad si quieres aprender sobre las increíbles obras de Rodan, van gough y maestros mexicanos.",Positivo,Positivo
Magnífico museo,"Me gusta mucho llevar a visitantes y amigos a este museo en donde es gratuita la entrada. Subes el elevador y vas recorriendo el museo cuidadosamente, observando, respirando y viviendo arte de varias épocas. La colección de billetes y monedas y bonita, pero lo que más puede sorprender son las amplitudes de los salones y saber lo bien que tiene todo el acomodo. No me canso de regresar.",5,2024-12-01,Cdmx,Museo Soumaya,"Magnífico museo. Me gusta mucho llevar a visitantes y amigos a este museo en donde es gratuita la entrada. Subes el elevador y vas recorriendo el museo cuidadosamente, observando, respirando y viviendo arte de varias épocas. La colección de billetes y monedas y bonita, pero lo que más puede sorprender son las amplitudes de los salones y saber lo bien que tiene todo el acomodo. No me canso de regresar.",Positivo,Positivo
"Muy bien museo, hermoso edificio","Esta muy bonito y es gratis. Los guardias de la entrada son algo rudos al solicitar que uno se forme y entren de 2 en 2. Podrían pedir las cosas amablemente y sería una mejor manera de empezar el recorrido. También adentro te regañan por cualquier cosa, soy una adulto e iba sola, no estaba haciendo nada incorrecto asi que me imagino si va uno con niños.Fuera de eso, el museo es muy bonito y tienen una muy buena colección de arte",4,2024-11-01,Cdmx,Museo Soumaya,"Muy bien museo, hermoso edificio. Esta muy bonito y es gratis. Los guardias de la entrada son algo rudos al solicitar que uno se forme y entren de 2 en 2. Podrían pedir las cosas amablemente y sería una mejor manera de empezar el recorrido. También adentro te regañan por cualquier cosa, soy una adulto e iba sola, no estaba haciendo nada incorrecto asi que me imagino si va uno con niños.Fuera de eso, el museo es muy bonito y tienen una muy buena colección de arte.",Positivo,Positivo
Buena colección de arte Europeo y mexicano,"Hermoso edificio, buena colección de arte Yo recomendaría irse en elevador hasta el último piso, asi solo hay que subir uno y verlo de arriba a abajo. Yo los camine todo de abajo a arriba y si es cansado. Me gustó mucho la sección de impresionistas y los muralistas mexicanos",5,2024-11-01,Cdmx,Museo Soumaya,"Buena colección de arte Europeo y mexicano. Hermoso edificio, buena colección de arte Yo recomendaría irse en elevador hasta el último piso, asi solo hay que subir uno y verlo de arriba a abajo. Yo los camine todo de abajo a arriba y si es cansado. Me gustó mucho la sección de impresionistas y los muralistas mexicanos.",Positivo,Positivo
El mundo en una obra de arte.,"El museo  cuenta con diseño en su edificio increíble, en su interior tiene una bellísima colección de obras de arte. Visitar el Soumaya es una experiencia que no se puede perder.",5,2024-05-01,Cdmx,Museo Soumaya,"El mundo en una obra de arte. El museo  cuenta con diseño en su edificio increíble, en su interior tiene una bellísima colección de obras de arte. Visitar el Soumaya es una experiencia que no se puede perder.",Positivo,Positivo
Hermoso edificio,"Esto es justo al lado del Jumex. Tome el ascensor a 5 y suba. Allí encontrarás más esculturas de Rodin que en casi cualquier otro lugar. Luego baja, examina los pisos que desees. Felizmente, la entrada es gratuita. Fuimos en Uber pero creo que Metro está cerca.",5,2024-11-01,Cdmx,Museo Soumaya,"Hermoso edificio. Esto es justo al lado del Jumex. Tome el ascensor a 5 y suba. Allí encontrarás más esculturas de Rodin que en casi cualquier otro lugar. Luego baja, examina los pisos que desees. Felizmente, la entrada es gratuita. Fuimos en Uber pero creo que Metro está cerca.",Positivo,Positivo
Increíble en todos los sentidos.............,"He estado en la mayoría de los museos importantes de Europa y los EE.UU. Esta es mi primera visita a la Ciudad de México, inmediatamente corrí a Soumaya. Increíble. El diseño de arquitectura exterior superlativo es igual al diseño interior blanco y nítido; ambos hacen un compañero estelar de la colección. No voy a entrar en detalles sobre arquitectura y arte - lo mejor es dejar que google hable allí. Al entrar por primera vez en el espacio, se le quita el aliento literalmente. No hay otras palabras que explicar. Prepárate para una buena caminata por las rampas a través de la colección. ¡Es un edificio bastante grande!",5,2024-11-01,Cdmx,Museo Soumaya,"Increíble en todos los sentidos............. He estado en la mayoría de los museos importantes de Europa y los EE.UU. Esta es mi primera visita a la Ciudad de México, inmediatamente corrí a Soumaya. Increíble. El diseño de arquitectura exterior superlativo es igual al diseño interior blanco y nítido; ambos hacen un compañero estelar de la colección. No voy a entrar en detalles sobre arquitectura y arte - lo mejor es dejar que google hable allí. Al entrar por primera vez en el espacio, se le quita el aliento literalmente. No hay otras palabras que explicar. Prepárate para una buena caminata por las rampas a través de la colección. ¡Es un edificio bastante grande!.",Positivo,Positivo
Verdaderamente especial,"Terminé aquí por capricho y realmente no podía creer la calidad de este museo, especialmente como museo gratuito. Las colecciones son fascinantes y la curaduría es refrescante. En lugar de agotarse después de 30 minutos atrapados en el mismo período, siempre hay algo nuevo a la vuelta de la esquina, desde esculturas a relojes de bolsillo, monedas a obras maestras y obras religiosas. Esto es una necesidad - ver!",5,2024-11-01,Cdmx,Museo Soumaya,"Verdaderamente especial. Terminé aquí por capricho y realmente no podía creer la calidad de este museo, especialmente como museo gratuito. Las colecciones son fascinantes y la curaduría es refrescante. En lugar de agotarse después de 30 minutos atrapados en el mismo período, siempre hay algo nuevo a la vuelta de la esquina, desde esculturas a relojes de bolsillo, monedas a obras maestras y obras religiosas. Esto es una necesidad - ver!.",Positivo,Positivo
Revisión mixta,"Este edificio es increíblemente impresionante. No hay nada igual. Alberga la colección privada de Carlos Slim. Tenía muchas ganas de visitarlo ya que me encanta ir a. museos donde quiera que viaje. Aunque el edificio es impresionante, la colección me pareció demasiado vasta y algo decepcionante. ¿Por qué? Seis pisos de arte es mucho que ver. En segundo lugar, las descripciones de cada pieza estaban en español solamente y no había nada disponible para la traducción, por ejemplo, visitas guiadas autodirigidas - usted selecciona el idioma. Esto significa que parte de la información de fondo se pierde a menos que pueda leer español con fluidez. En tercer lugar, no se disponía de un folleto que indicara lo que podía encontrarse en cada planta. Lo que sí me gustó fueron los artistas mexicanos destacados y algunas colecciones inusuales: teléfonos a través de los tiempos, incluyendo máquinas de código Morse y ropa formal de noche de las mujeres. Por último, la mayoría de los museos destacados crean un catálogo de las colecciones a la venta. Ediciones en rústica que son un gran recuerdo. Este museo solo ofrecía un libro de mesa de centro de tapa dura que superaría los máximos de equipaje de mano y facturado. Me decepciona. Vale la pena visitar? Sí, para el edificio en sí. Consejo de visitante: Tome el ascensor a la planta superior y trabajar su camino hacia abajo.",3,2024-11-01,Cdmx,Museo Soumaya,"Revisión mixta. Este edificio es increíblemente impresionante. No hay nada igual. Alberga la colección privada de Carlos Slim. Tenía muchas ganas de visitarlo ya que me encanta ir a. museos donde quiera que viaje. Aunque el edificio es impresionante, la colección me pareció demasiado vasta y algo decepcionante. ¿Por qué? Seis pisos de arte es mucho que ver. En segundo lugar, las descripciones de cada pieza estaban en español solamente y no había nada disponible para la traducción, por ejemplo, visitas guiadas autodirigidas - usted selecciona el idioma. Esto significa que parte de la información de fondo se pierde a menos que pueda leer español con fluidez. En tercer lugar, no se disponía de un folleto que indicara lo que podía encontrarse en cada planta. Lo que sí me gustó fueron los artistas mexicanos destacados y algunas colecciones inusuales: teléfonos a través de los tiempos, incluyendo máquinas de código Morse y ropa formal de noche de las mujeres. Por último, la mayoría de los museos destacados crean un catálogo de las colecciones a la venta. Ediciones en rústica que son un gran recuerdo. Este museo solo ofrecía un libro de mesa de centro de tapa dura que superaría los máximos de equipaje de mano y facturado. Me decepciona. Vale la pena visitar? Sí, para el edificio en sí. Consejo de visitante: Tome el ascensor a la planta superior y trabajar su camino hacia abajo.",Neutro,Neutro
"Museo Soumaya, Ciudad de México en octubre","Muchos tipos diferentes de piezas para ver aquí, obras de artistas famosos (Monet, Picasso, Dalí, los Vinci, Van Gogh, Matisse, Renoir). Comienza en la planta superior y desciende en espiral por el edificio bien distribuido (también hay un ascensor). Es de entrada libre, hay una cafetería en la planta baja, tienda de regalos era un poco aburrido. Si traes una mochila / mochila tendrás que ponerla en guardarropa. Al lado hay Museo Jumex y un Centro Comercial Compras, también otro moderno Centro Comercial Compras cruzando la calle con algunas opciones de comida.",5,2024-10-01,Cdmx,Museo Soumaya,"Museo Soumaya, Ciudad de México en octubre. Muchos tipos diferentes de piezas para ver aquí, obras de artistas famosos (Monet, Picasso, Dalí, los Vinci, Van Gogh, Matisse, Renoir). Comienza en la planta superior y desciende en espiral por el edificio bien distribuido (también hay un ascensor). Es de entrada libre, hay una cafetería en la planta baja, tienda de regalos era un poco aburrido. Si traes una mochila / mochila tendrás que ponerla en guardarropa. Al lado hay Museo Jumex y un Centro Comercial Compras, también otro moderno Centro Comercial Compras cruzando la calle con algunas opciones de comida.",Positivo,Positivo
"Entrada gratuita, enorme colección, de cerca y personal.","Notable colección de arte a través de los siglos y que abarca tanto México como Europa. No recuerdo un museo en el que puedas acercarte tanto al arte. Tenga en cuenta, sin embargo, que este museo es GRATIS. Los boletos vendidos a través de TripAdvisor son para una compañía turística.",5,2024-10-01,Cdmx,Museo Soumaya,"Entrada gratuita, enorme colección, de cerca y personal. Notable colección de arte a través de los siglos y que abarca tanto México como Europa. No recuerdo un museo en el que puedas acercarte tanto al arte. Tenga en cuenta, sin embargo, que este museo es GRATIS. Los boletos vendidos a través de TripAdvisor son para una compañía turística.",Positivo,Positivo
"Usted recibe lo que paga, supongo","La entrada es gratuita, así que no esperes ningún servicio al cliente. El encargado del equipaje literalmente nos dio actitud solo porque hicimos una pregunta. No estábamos desafiando o quejándonos del protocolo, simplemente teníamos curiosidad de por qué era protocolo en primer lugar. Si la curiosidad alguna vez mató al gato, fue por el resplandor que salía de los ojos del encargado de la maleta.",3,2024-09-01,Cdmx,Museo Soumaya,"Usted recibe lo que paga, supongo. La entrada es gratuita, así que no esperes ningún servicio al cliente. El encargado del equipaje literalmente nos dio actitud solo porque hicimos una pregunta. No estábamos desafiando o quejándonos del protocolo, simplemente teníamos curiosidad de por qué era protocolo en primer lugar. Si la curiosidad alguna vez mató al gato, fue por el resplandor que salía de los ojos del encargado de la maleta.",Neutro,Negativo
Día especial en Museo Soumaya,"El Museo Soumaya es un increíble regalo que Carlos Slim ha dado a la Ciudad de México con su brillante colección de arte, junto con una fantástica arquitectura moderna. Señor Slim no solo lo comparte con el público, sino que la entrada es gratuita y el museo está abierto casi todos los días. Formé parte de un grupo de seis personas guiadas por José Vicente Figueroa, quien tiene una buena educación y conocimiento en el mundo del arte y la historia del arte. Después de haber viajado por todo el mundo donde he hecho muchos tours, José es uno Lo mejor de lo mejor guías que tendrás. Habla inglés y español perfectamente, y exhibió esa habilidad durante la gira ya que yo era el único estadounidense. Resérvalo si tienes oportunidad. El Soumaya es seis pisos de arte increíble. El vestíbulo de mármol blanco causa una primera Impresión con réplicas a tamaño natural de la escultura Puertas del Infierno de Rodin y el David de Miguel Ángel. También hay una brillante pieza de mosaico del famoso artista mexicano Diego Rivera. Luego fue a la planta seis, que cuenta con muchas esculturas y pinturas de Rodin, incluyendo El pensador y El beso. A medida que bajas rampas, otros pisos están dedicados a artistas mexicanos y europeos como Van Gogh y Joan Miro y Salvador Dalí, junto con un piso de temas religiosos y pinturas como las lágrimas de la calle. Peter. También hay huevos Faberge y Selecciones de artefactos del siglo XX. El gran arte, junto con la guía de José, hizo que fuera un día especial.",5,2024-09-01,Cdmx,Museo Soumaya,"Día especial en Museo Soumaya. El Museo Soumaya es un increíble regalo que Carlos Slim ha dado a la Ciudad de México con su brillante colección de arte, junto con una fantástica arquitectura moderna. Señor Slim no solo lo comparte con el público, sino que la entrada es gratuita y el museo está abierto casi todos los días. Formé parte de un grupo de seis personas guiadas por José Vicente Figueroa, quien tiene una buena educación y conocimiento en el mundo del arte y la historia del arte. Después de haber viajado por todo el mundo donde he hecho muchos tours, José es uno Lo mejor de lo mejor guías que tendrás. Habla inglés y español perfectamente, y exhibió esa habilidad durante la gira ya que yo era el único estadounidense. Resérvalo si tienes oportunidad. El Soumaya es seis pisos de arte increíble. El vestíbulo de mármol blanco causa una primera Impresión con réplicas a tamaño natural de la escultura Puertas del Infierno de Rodin y el David de Miguel Ángel. También hay una brillante pieza de mosaico del famoso artista mexicano Diego Rivera. Luego fue a la planta seis, que cuenta con muchas esculturas y pinturas de Rodin, incluyendo El pensador y El beso. A medida que bajas rampas, otros pisos están dedicados a artistas mexicanos y europeos como Van Gogh y Joan Miro y Salvador Dalí, junto con un piso de temas religiosos y pinturas como las lágrimas de la calle. Peter. También hay huevos Faberge y Selecciones de artefactos del siglo XX. El gran arte, junto con la guía de José, hizo que fuera un día especial.",Positivo,Positivo
