Titulo,Review,Calificacion,FechaEstadia,Ciudad,Atraccion,TituloReview,Sentimiento,SentimientoHF
Outstanding,"This museum is as great as you would expect it to be. It's divided by region (Oaxaca, Mayan/Yucatan, Gulf, Norte, etc.). Be sure to wander outside; the museum does a great job of blending indoor and outdoor artefacts. Less than half the signs have English translations.There was an emphasis on human remains, and it was tastefully presented. Also, the section of the museum explaining archaeological excavation was straightforward and well done. Everything was beautifully lit and the museum scientists designed the flow extremely well.The second floor was completely closed.",5,2024-09-01,Cdmx,Museo Nacional De Antropologia,"Outstanding. This museum is as great as you would expect it to be. It's divided by region (Oaxaca, Mayan/Yucatan, Gulf, Norte, etc.). Be sure to wander outside; the museum does a great job of blending indoor and outdoor artefacts. Less than half the signs have English translations.There was an emphasis on human remains, and it was tastefully presented. Also, the section of the museum explaining archaeological excavation was straightforward and well done. Everything was beautifully lit and the museum scientists designed the flow extremely well.The second floor was completely closed.",Positivo,Positivo
no vayas con prisa....tomatelo con calma porque necesitas recorrerlo todo,"conozco muchos museos de fuera del pais, y ninguno se compara con el museo de antropologia! ademas ahora esta muuuy bonito, ordenado y los guardias son super amables! necesitas un dia completo para recorrerlo todo",5,2024-09-01,Cdmx,Museo Nacional De Antropologia,"no vayas con prisa....tomatelo con calma porque necesitas recorrerlo todo. conozco muchos museos de fuera del pais, y ninguno se compara con el museo de antropologia! ademas ahora esta muuuy bonito, ordenado y los guardias son super amables! necesitas un dia completo para recorrerlo todo.",Positivo,Positivo
No insulated water bottles allowed here.,I’m giving this museum 4 stars based on others reviews because unfortunately my daughter and I didn’t make it inside. I just wanted to let everyone know that if you go here with an insulated water bottle (ie metal) you will have to throw it away if you want to enter the museum. You must go through a metal detector and they search your bag. If they see food or a water bottle they direct you to an area to dispose of it. I hope this saves others time and money.,4,2024-09-01,Cdmx,Museo Nacional De Antropologia,No insulated water bottles allowed here. I’m giving this museum 4 stars based on others reviews because unfortunately my daughter and I didn’t make it inside. I just wanted to let everyone know that if you go here with an insulated water bottle (ie metal) you will have to throw it away if you want to enter the museum. You must go through a metal detector and they search your bag. If they see food or a water bottle they direct you to an area to dispose of it. I hope this saves others time and money.,Positivo,Positivo
A Must,Very historical museum.This is a must for history lovers.Youur visit to mexico is incomplete without visiting the museo nacional.,4,2024-09-01,Cdmx,Museo Nacional De Antropologia,A Must. Very historical museum.This is a must for history lovers.Youur visit to mexico is incomplete without visiting the museo nacional.,Positivo,Positivo
Must See,"One of the best archeological museums in the Western Hemisphere.  It is impossible to spend less than 3-4 hours here.  The Museum includes exhibits and reproductions inside its halls but also architectural models/buildings outside each pavilion as well.   Upstairs is an entire ethnographic section on the states in Mexico although much of this was closed on this visit.  There is a restaurant that serves breakfast and a coffee shop that had sandwiches.  Note the architectural design of the museum with its giant fountain/roof in the center of the complex.  It features prominently in many architecture books.  Since this museum sits in the Chaputapec park area, if you visit, plan on seeing other park attractions as well.",5,2024-09-01,Cdmx,Museo Nacional De Antropologia,"Must See. One of the best archeological museums in the Western Hemisphere.  It is impossible to spend less than 3-4 hours here.  The Museum includes exhibits and reproductions inside its halls but also architectural models/buildings outside each pavilion as well.   Upstairs is an entire ethnographic section on the states in Mexico although much of this was closed on this visit.  There is a restaurant that serves breakfast and a coffee shop that had sandwiches.  Note the architectural design of the museum with its giant fountain/roof in the center of the complex.  It features prominently in many architecture books.  Since this museum sits in the Chaputapec park area, if you visit, plan on seeing other park attractions as well.",Positivo,Positivo
Museum impresses,"The size of the museum impresses people. It is a very old and historically important place and it is very difficult to understand it without a guide. The stories told by the guide are so impressive, I feel like if I come again, everything will come alive in my mind.",4,2024-09-01,Cdmx,Museo Nacional De Antropologia,"Museum impresses. The size of the museum impresses people. It is a very old and historically important place and it is very difficult to understand it without a guide. The stories told by the guide are so impressive, I feel like if I come again, everything will come alive in my mind.",Positivo,Positivo
Las joyas de Pakal,"Visite muchas veces este museos y literalmente lo amo! Aquí están la joyas del rey maya más importante, Pakal!!! Recomiendo absolutamente de visitarlo.",5,2023-11-01,Cdmx,Museo Nacional De Antropologia,"Las joyas de Pakal. Visite muchas veces este museos y literalmente lo amo! Aquí están la joyas del rey maya más importante, Pakal!!! Recomiendo absolutamente de visitarlo.",Positivo,Positivo
Museo nacional,"Great museum! After visiting numerous Aztec, Mayan, and Olmec sites, it was very interesting to see and read the information. This place is huge, a two day museum if you read all the info.",5,2024-08-01,Cdmx,Museo Nacional De Antropologia,"Museo nacional. Great museum! After visiting numerous Aztec, Mayan, and Olmec sites, it was very interesting to see and read the information. This place is huge, a two day museum if you read all the info.",Positivo,Positivo
Wonderful experience for first timers to learn about the history of early civilization of Mexico City.,What a beautiful and massive museum. We had a private guide and still only say a fraction of the displays. Such depth of history and huge displays of very early Mexican civilization. We spent 4 hours on our first visit and look forward to returning. With a private tour we were able to better understand the stories and the displays. We are primarily English speakers so the value in a private tour were great for us as an older couple!,5,2024-08-01,Cdmx,Museo Nacional De Antropologia,Wonderful experience for first timers to learn about the history of early civilization of Mexico City. What a beautiful and massive museum. We had a private guide and still only say a fraction of the displays. Such depth of history and huge displays of very early Mexican civilization. We spent 4 hours on our first visit and look forward to returning. With a private tour we were able to better understand the stories and the displays. We are primarily English speakers so the value in a private tour were great for us as an older couple!.,Positivo,Positivo
Must visit in Mexico City,"The National Museum of Anthropology in Mexico City is an absolute treasure and a must-visit for anyone interested in history, culture, or anthropology. The museum is vast and houses an incredible collection that spans the rich and diverse history of Mexico, from pre-Hispanic civilizations to modern indigenous cultures.Each exhibit is beautifully curated, with detailed information (in both Spanish and English) that brings the artifacts to life. The museum’s centerpiece, the Aztec Sun Stone, is breathtaking, and the Maya Hall is equally impressive. The outdoor courtyards, with their iconic umbrella fountain, provide a tranquil break between exhibits.Plan to spend at least a few hours here—there’s so much to see that rushing through would be a disservice to the experience. Even if you’re not typically a museum person, the sheer scale and quality of the exhibits will captivate you. The museum is also very accessible, with clear signage, ramps, and elevators.Whether you're a history buff or just curious about Mexico’s past, this museum offers an unforgettable journey through time. Highly recommended!",5,2024-08-01,Cdmx,Museo Nacional De Antropologia,"Must visit in Mexico City. The National Museum of Anthropology in Mexico City is an absolute treasure and a must-visit for anyone interested in history, culture, or anthropology. The museum is vast and houses an incredible collection that spans the rich and diverse history of Mexico, from pre-Hispanic civilizations to modern indigenous cultures.Each exhibit is beautifully curated, with detailed information (in both Spanish and English) that brings the artifacts to life. The museum’s centerpiece, the Aztec Sun Stone, is breathtaking, and the Maya Hall is equally impressive. The outdoor courtyards, with their iconic umbrella fountain, provide a tranquil break between exhibits.Plan to spend at least a few hours here—there’s so much to see that rushing through would be a disservice to the experience. Even if you’re not typically a museum person, the sheer scale and quality of the exhibits will captivate you. The museum is also very accessible, with clear signage, ramps, and elevators.Whether you're a history buff or just curious about Mexico’s past, this museum offers an unforgettable journey through time. Highly recommended!.",Positivo,Positivo
Estupendo,Visitamos este estupendo museo centrándonos en las exposiciones de las culturas azteca y maya. Es un imprescindible de la ciudad de México.,5,2024-08-01,Cdmx,Museo Nacional De Antropologia,Estupendo. Visitamos este estupendo museo centrándonos en las exposiciones de las culturas azteca y maya. Es un imprescindible de la ciudad de México.,Positivo,Positivo
This museum is great for anthropology and historical lovers. A myriad of collections from around the world,This is a great museum for anthropology enthusiasts and history buffs. If you do not read Spanish you will need an audio guide or language appropriate guide to fully appreciate the museum,5,2024-08-01,Cdmx,Museo Nacional De Antropologia,This museum is great for anthropology and historical lovers. A myriad of collections from around the world. This is a great museum for anthropology enthusiasts and history buffs. If you do not read Spanish you will need an audio guide or language appropriate guide to fully appreciate the museum.,Positivo,Positivo
The best museum in Mexico. Go even if you don't like museums.,"Incredible place. Do not miss it even if you aren't a museum person. This is a spectacular building designed with the observer in mind. The Stone of the Sun is here (used to be known as the Aztec calendar) and so many more amazing things. They have recreated scenes from many of the sites where the objects were found, which I think makes the artifacts more meaningful.",5,2024-07-01,Cdmx,Museo Nacional De Antropologia,"The best museum in Mexico. Go even if you don't like museums. Incredible place. Do not miss it even if you aren't a museum person. This is a spectacular building designed with the observer in mind. The Stone of the Sun is here (used to be known as the Aztec calendar) and so many more amazing things. They have recreated scenes from many of the sites where the objects were found, which I think makes the artifacts more meaningful.",Positivo,Positivo
Un lugar importante y hermoso,"Espectacular exposición de las culturas ancestrales de este bello país; ya había  visitado hace muchos  años y quede impresionada también. No pude recorrerlo todo en esta ocasión porque demoramos mucho en llegar  desde el castillo Chapultepec y la dificultad para encontrar el lugar por la falta de señales, no hay una guía completa de los museos en este bosque muy hermoso, ni un mapa explicativo. Una pena no poder disfrutar este lugar, el castillo en una loma es bastante difícil para llegar, aunque después encontramos  que hay ascensor, pero no hay ningún aviso. Demasiados vendedores y música ruidosa, tal vez porque fuimos el domingo. Hay facilidad para conseguir silla de ruedas. Y las exhibiciones muy bien realizadas. Recomendado ir con tiempo suficiente.",4,2024-07-01,Cdmx,Museo Nacional De Antropologia,"Un lugar importante y hermoso. Espectacular exposición de las culturas ancestrales de este bello país; ya había  visitado hace muchos  años y quede impresionada también. No pude recorrerlo todo en esta ocasión porque demoramos mucho en llegar  desde el castillo Chapultepec y la dificultad para encontrar el lugar por la falta de señales, no hay una guía completa de los museos en este bosque muy hermoso, ni un mapa explicativo. Una pena no poder disfrutar este lugar, el castillo en una loma es bastante difícil para llegar, aunque después encontramos  que hay ascensor, pero no hay ningún aviso. Demasiados vendedores y música ruidosa, tal vez porque fuimos el domingo. Hay facilidad para conseguir silla de ruedas. Y las exhibiciones muy bien realizadas. Recomendado ir con tiempo suficiente.",Positivo,Positivo
Impresionante museo,Un museo que debes recorrer en varios días para aprovecharlo completo. Sumamente interesante y fascinante sobre la historia de nuestro país.,5,2024-07-01,Cdmx,Museo Nacional De Antropologia,Impresionante museo. Un museo que debes recorrer en varios días para aprovecharlo completo. Sumamente interesante y fascinante sobre la historia de nuestro país.,Positivo,Positivo
Gran museo,"Me encanta que puedes conocer grandes cosas sobre la historia de las civilizaciones, y es que aquí se pueden aprender grandes cosas sobre la historia mexicana.",5,2023-09-01,Cdmx,Museo Nacional De Antropologia,"Gran museo. Me encanta que puedes conocer grandes cosas sobre la historia de las civilizaciones, y es que aquí se pueden aprender grandes cosas sobre la historia mexicana.",Positivo,Positivo
Museo interesante,"Un lugar obligado para visitar por mexicanos y extranjeros que quieran conocer más de la cultura de los antepasados, hay esculturas y basamentos a escala.",5,2023-12-01,Cdmx,Museo Nacional De Antropologia,"Museo interesante. Un lugar obligado para visitar por mexicanos y extranjeros que quieran conocer más de la cultura de los antepasados, hay esculturas y basamentos a escala.",Positivo,Positivo
"Excelente museo, totalmente recomendado","totalmente recomendado, se requiere muchas horas para recorrerlo todo, por lo que la mejor hora para ir es en la mañana, es un museo muy hermoso con piezas impresionantes de la historia.",5,2024-02-01,Cdmx,Museo Nacional De Antropologia,"Excelente museo, totalmente recomendado. totalmente recomendado, se requiere muchas horas para recorrerlo todo, por lo que la mejor hora para ir es en la mañana, es un museo muy hermoso con piezas impresionantes de la historia.",Positivo,Positivo
Una gran experiencia con familia.,"Es muy buena la experiencia, el acuario es limpio, nos tocó un día tranquilo y a pesar de que hay gente está muy fluido. La pecera de las medusas son increíbles y muy bonitas",5,2025-09-01,Cdmx,Acuario Michin Ciudad De Mexico,"Una gran experiencia con familia. Es muy buena la experiencia, el acuario es limpio, nos tocó un día tranquilo y a pesar de que hay gente está muy fluido. La pecera de las medusas son increíbles y muy bonitas.",Positivo,Positivo
Un día diferente!,Todo muy bien Un poco caro las actividades con costo extraEn Arcade deben dar tickets para intercambiar por dulces o premios.,4,2025-09-01,Cdmx,Acuario Michin Ciudad De Mexico,Un día diferente!. Todo muy bien Un poco caro las actividades con costo extraEn Arcade deben dar tickets para intercambiar por dulces o premios.,Positivo,Positivo
Maravilloso,"En mi opinión nos facino pasar por el túnel donde estaban los tiburones y a mi niña de 6 años le encantó todos los juegos, es un lugar muy bonito y excelente servicio, áreas muy limpias.",5,2025-09-01,Cdmx,Acuario Michin Ciudad De Mexico,"Maravilloso. En mi opinión nos facino pasar por el túnel donde estaban los tiburones y a mi niña de 6 años le encantó todos los juegos, es un lugar muy bonito y excelente servicio, áreas muy limpias.",Positivo,Positivo
Diversión,"En mi opinión las instalaciones son de muy buen agrado ya que vine con familia y amigos ,la verdad se divirtieron demaciado es un excelente lugar para pasar un buen rato y para pasar una buena diversión.",5,2025-09-01,Cdmx,Acuario Michin Ciudad De Mexico,"Diversión. En mi opinión las instalaciones son de muy buen agrado ya que vine con familia y amigos ,la verdad se divirtieron demaciado es un excelente lugar para pasar un buen rato y para pasar una buena diversión.",Positivo,Positivo
UN DÍA INOLVIDABLE,Vine con mi familia y la experiencia es increíble en todos los sentidos y tienen una variedad de cosas para chicos y grandes lo que más me gustó pues las diferentes especies que maneja el acuario,5,2025-09-01,Cdmx,Acuario Michin Ciudad De Mexico,UN DÍA INOLVIDABLE. Vine con mi familia y la experiencia es increíble en todos los sentidos y tienen una variedad de cosas para chicos y grandes lo que más me gustó pues las diferentes especies que maneja el acuario.,Positivo,Positivo
La mejor experiencia para tu peque,Es un lugar muy seguro y increíble excelente servicio muy bonito todo el lugar y el personal excelente .Recomendado al 💯,5,2025-09-01,Cdmx,Acuario Michin Ciudad De Mexico,La mejor experiencia para tu peque. Es un lugar muy seguro y increíble excelente servicio muy bonito todo el lugar y el personal excelente .Recomendado al 💯.,Positivo,Positivo
Mi experiencia en el acuario,"Nos gusto ver todo los animales Compartir está experiencia con mi hija fue de lo mejor,le encantó ver a los pingüinos 😁💚💚💚💚💚💚💚💚💚💚💚💚",4,2025-08-01,Cdmx,Acuario Michin Ciudad De Mexico,"Mi experiencia en el acuario. Nos gusto ver todo los animales Compartir está experiencia con mi hija fue de lo mejor,le encantó ver a los pingüinos 😁💚💚💚💚💚💚💚💚💚💚💚💚.",Positivo,Positivo
Acuario Michin con mi novia,"Vine con mi novia y estuvo increíble.Exhibiciones  muy bonitasLugar limpio(Mejorar área de pingüinos, huele a culo) Lugar organizado",4,2025-08-01,Cdmx,Acuario Michin Ciudad De Mexico,"Acuario Michin con mi novia. Vine con mi novia y estuvo increíble.Exhibiciones  muy bonitasLugar limpio(Mejorar área de pingüinos, huele a culo) Lugar organizado.",Positivo,Positivo
Visita agradable,"Mejorar el servicio Guías SeñalamientosOrden Todas las atracciones tienen costos adicionales, con horarios específicos",3,2025-08-01,Cdmx,Acuario Michin Ciudad De Mexico,"Visita agradable. Mejorar el servicio Guías SeñalamientosOrden Todas las atracciones tienen costos adicionales, con horarios específicos.",Neutro,Positivo
Experiencia personal.,"Un lugar muy completo, con muchas áreas de interacción para los niños; el cuidado de las especies es muy bueno y el tiempo se pasa súper rápido.",5,2025-08-01,Cdmx,Acuario Michin Ciudad De Mexico,"Experiencia personal. Un lugar muy completo, con muchas áreas de interacción para los niños; el cuidado de las especies es muy bueno y el tiempo se pasa súper rápido.",Positivo,Positivo
Si recomiendo asistir pero tomando en cuenta los tiempos los,No hay suficientes áreas para que los pequeños puedan jugar. No cuentan con suficientes sillas de ruedas. La comida es muy lenta.Las interacciones si están fuera del presupuesto para todos.,3,2025-08-01,Cdmx,Acuario Michin Ciudad De Mexico,Si recomiendo asistir pero tomando en cuenta los tiempos los. No hay suficientes áreas para que los pequeños puedan jugar. No cuentan con suficientes sillas de ruedas. La comida es muy lenta.Las interacciones si están fuera del presupuesto para todos.,Neutro,Neutro
Tiempo,"Es un poco tardado para entrar , los de la entrada muy groseros no te solucionan y tardan mucho en los juegos tardan más a la gente y eso desespera",4,2025-08-01,Cdmx,Acuario Michin Ciudad De Mexico,"Tiempo. Es un poco tardado para entrar , los de la entrada muy groseros no te solucionan y tardan mucho en los juegos tardan más a la gente y eso desespera.",Positivo,Negativo
Mi dia en Acuario Michin,"No me gusta que te cobren todas la sinteracciones adentro , terminas pagando el doble de lo quevpagas a la entrada . Lo ideal sería que te armaran paquetes desde la entrada para saber desde un inicio el verdadero valor . Hace falta más personal , hay muchisima gente, no encuentras quien te pueda resolver una pregunta hasta de donde esta el baño, el lugar es muy grande . En el área de brincolines sacan a los niños que ya entraron y bo los dejan ponerse sus zapatos adentro , los niños tienen que sentarse en el suelo sucio para ponerse sus zapatos . Muy caro",3,2025-08-01,Cdmx,Acuario Michin Ciudad De Mexico,"Mi dia en Acuario Michin. No me gusta que te cobren todas la sinteracciones adentro , terminas pagando el doble de lo quevpagas a la entrada . Lo ideal sería que te armaran paquetes desde la entrada para saber desde un inicio el verdadero valor . Hace falta más personal , hay muchisima gente, no encuentras quien te pueda resolver una pregunta hasta de donde esta el baño, el lugar es muy grande . En el área de brincolines sacan a los niños que ya entraron y bo los dejan ponerse sus zapatos adentro , los niños tienen que sentarse en el suelo sucio para ponerse sus zapatos . Muy caro.",Neutro,Negativo
Excelente experiencia,"La experiencia de darles de comer a los pajaros es muy bonita, y el mar abierto igual está impresionante, las ranas muy exoticas",4,2025-08-01,Cdmx,Acuario Michin Ciudad De Mexico,"Excelente experiencia. La experiencia de darles de comer a los pajaros es muy bonita, y el mar abierto igual está impresionante, las ranas muy exoticas.",Positivo,Positivo
Gran lugar pero hay que ir preparados.,"El lugar tiene muchos atractivos y puedes estar horas sin aburrirte. Complicado la entrada y la cantidad de personas que no deja ver bien los animales. Las opciones de comidas limitadas. Por lo demás, perfecto.",3,2025-08-01,Cdmx,Acuario Michin Ciudad De Mexico,"Gran lugar pero hay que ir preparados. El lugar tiene muchos atractivos y puedes estar horas sin aburrirte. Complicado la entrada y la cantidad de personas que no deja ver bien los animales. Las opciones de comidas limitadas. Por lo demás, perfecto.",Neutro,Neutro
Mi Visita,"Lo que no me gustó fue la falta de aire acondicionado en el lugar, se siente mucho calor, el personal para ingresar nada amigable y lo que si me gustó fueron las capibaras, tarántulas y los juegos",3,2025-08-01,Cdmx,Acuario Michin Ciudad De Mexico,"Mi Visita. Lo que no me gustó fue la falta de aire acondicionado en el lugar, se siente mucho calor, el personal para ingresar nada amigable y lo que si me gustó fueron las capibaras, tarántulas y los juegos.",Neutro,Negativo
Linda experiencia,"Las especies en buenas condiciones, las interacciones y los animales marino excelentes, buenas instalaciones y todo limpio",4,2025-08-01,Cdmx,Acuario Michin Ciudad De Mexico,"Linda experiencia. Las especies en buenas condiciones, las interacciones y los animales marino excelentes, buenas instalaciones y todo limpio.",Positivo,Positivo
En general bien,Solamente ser un poco más amables en donde venden comida ya que no me quisieron dar una coca y vengo en un evento corporativo,4,2025-08-01,Cdmx,Acuario Michin Ciudad De Mexico,En general bien. Solamente ser un poco más amables en donde venden comida ya que no me quisieron dar una coca y vengo en un evento corporativo.,Positivo,Neutro
Día en el acuario,"Es una exhibición muy completa y agradable, lleno mis expectativas, sin embargo se me hizo de alto costo las atracciones pagadas, sugiero un costo más elevado dentro de un estándar pero teniendo acceso a estos o incluir más interacción.",3,2025-08-01,Cdmx,Acuario Michin Ciudad De Mexico,"Día en el acuario. Es una exhibición muy completa y agradable, lleno mis expectativas, sin embargo se me hizo de alto costo las atracciones pagadas, sugiero un costo más elevado dentro de un estándar pero teniendo acceso a estos o incluir más interacción.",Neutro,Positivo
Bien,"Estuvo bien pero elarea de comida falta personal, esta muy grande el lugar super padre, el boliche lo amo, además los animales están muy bien cuidados",3,2025-08-01,Cdmx,Acuario Michin Ciudad De Mexico,"Bien. Estuvo bien pero elarea de comida falta personal, esta muy grande el lugar super padre, el boliche lo amo, además los animales están muy bien cuidados.",Neutro,Neutro
Regular,"No respetan promociones, demasiada gente y poca supervisión de los grupos, las actividades están muy saturadas y no puedes disfrutar el lugar",3,2025-08-01,Cdmx,Acuario Michin Ciudad De Mexico,"Regular. No respetan promociones, demasiada gente y poca supervisión de los grupos, las actividades están muy saturadas y no puedes disfrutar el lugar.",Neutro,Negativo
Algunos inconvenientes,"Llegamos temprano y no alcanzamos la promoción de entrada, pagamos normal y además cobran muy caro por dar de comer a los animales",3,2025-08-01,Cdmx,Acuario Michin Ciudad De Mexico,"Algunos inconvenientes. Llegamos temprano y no alcanzamos la promoción de entrada, pagamos normal y además cobran muy caro por dar de comer a los animales.",Neutro,Neutro
