Titulo,Review,TipoViaje,Calificacion,OrigenAutor,FechaOpinion,FechaEstadia
Historia mesoamericana a minutos de su resort.,"Increíble creer que la entrada cuesta sólo 12 $US. Hay mucho que leer y aprender. Tanta historia mesoamericana rezuma de las paredes y exhibiciones. Tuvimos la suerte de estar allí cuando tuvieron la exhibición de arte Humo Sagrado. Era una obra de arte conmovedora con piezas que invitaban a la reflexión.Empaca tu repelente de mosquitos porque lo necesitarás para tu caminata por los senderos arqueológicos. Las pirámides y estructuras pueden ser pequeñas en comparación con lo que verás en Tulum o Chichén Itzá, pero son igual de poderosas en forma de maravilla creada por el hombre.",Pareja,5,"Toronto, Canadá",26 de octubre de 2023,oct de 2023
Museo descuidado,"Muy abandonado el museo, los elevadores no funcionan, muy poca seguridad, pocos letreros para indicar por dónde comenzar la visita, es una lástima porque las piezas en exhibición son admirables, una de las culturas más sobresalientes de México, ojalá le den más atención a este museo",Familia,4,"Muy abandonado el museo, los elevadores no funcionan, muy poca seguridad, pocos letreros para indicar por dónde comenzar la visita, es una lástima porque las piezas en exhibición son admirables, una de las culturas más sobresalientes de México, ojalá le den más atención a este museo",5 de octubre de 2023,sept de 2023
Maldito lugar para visitar,"Lugar malvado para ver y aprender sobre la cultura local, una visita obligada si estás en la zona de visita o de vacaciones. Personal amable y servicial disponible para moverse y si necesita ayuda.",Pareja,5,"Londres, UK",5 de septiembre de 2023,sept de 2023
Muy interesante,Recorrerlo admirar las piezas expuestas y sobre todo pasear por la zona arqueologica una belleza y muy bien explicado cada rincon por visitar lo recomiendo vale la pena,,4,"Buenos Aires, Argentina",24 de agosto de 2023,ago de 2023
"Ok, si necesitas algo que hacer.","Queríamos aprender más sobre la historia maya, por lo que este lugar fue nuestra primera parada. Estuvo bien. Podría ser genial si ponen un poco de trabajo en él.",Familia,3,BDJV,17 de agosto de 2023,ago de 2023
Gran lugar fácil para ver artefactos mayas.,"Me encanta la historia maya, así que fue una experiencia especial ver artefactos por primera vez. Chitzen Itza vino al día siguiente. Me encantan las multitudes bajas, solo una pizca de gente. Vale la pena el tiempo, especialmente si las temperaturas están por debajo del nivel abrasador como yo soporté.",Solitario,4,"Walt Disney World, FL",12 de agosto de 2023,jun de 2023
"Ok, pero pasa a menos que estés buscando algo que hacer.","No hay muchas exhibiciones aquí. Pero la parte exterior es como estar en la selva tropical en el buen sentido, pero muy húmedo.",Familia,3,"Austin, TX",26 de julio de 2023,jul de 2023
Lección de historia local,"Lugar realmente interesante. Muchas cosas para ver, explorar y aprender sobre la cultura azteca.No se anuncia lo suficiente y es mejor que un día largo y caluroso para quitinar a Henson si tiene problemas de movilidad. Buen precio también",Pareja,5,"Grantham, UK",24 de julio de 2023,jul de 2023
¡Trae tu repelente de insectos!,"Hacía calor con muchos mosquitos. Ojalá tuvieran más letreros en inglés dentro del museo. La caminata afuera fue calurosa y con errores, pero la pirámide valió la pena, al igual que los numerosos avistamientos de iguanas. Me gustó mucho. Si te gusta la historia maya, vale la pena. si no lo eres, probablemente no lo disfrutarías.",Familia,4,"Hobart, IN",24 de junio de 2023,jun de 2023
"No vale la pena ir, nada que ver.","No hay mucho que ver, no hay nadie. No estoy seguro de lo que estábamos viendo, aunque solo cuesta 90 pesos la entrada. No hace demasiado calor adentro, hay muchos árboles. Sin personal, sin explicación. Solo algunas piedras viejas y árboles grandes.",Familia,3,travelmom,18 de junio de 2023,jun de 2023
Me encanta los.parques los museos el caminar por.la zona hotelera,Excelente vistas para las fotografias nos tomamos.muchimas fotos los paseo el parque de xel-ha lo mejor,,5,Hector S,19 de mayo de 2023,may de 2023
¡Hermoso pequeño museo lleno de datos e información interesantes sobre la cultura y la historia maya!,"Hermoso museo local lleno de datos interesantes/información histórica relacionada con la cultura/historia maya original. Solo de tamaño pequeño con exhibiciones tanto en el interior como en el exterior: arquitectura histórica, edificios/asentamientos de piedra, piezas de arcilla/cerámica, artículos de joyería con cuentas y esqueletos de dientes de sable. Realmente disfrutamos nuestra visita, todo el museo solo toma unas pocas horas (1 a 3 horas en total) para exhibiciones internas y externas. Cuesta 90 pesos por persona y vale la pena el costo. Ojalá más de los elementos / exhibiciones internas tuvieran la información tanto en inglés como en español; sin embargo, la mayoría o la información de exhibición externa y la historia histórica más grande están traducidas al inglés. Puede usar el traductor de Google para recopilar más información individual, sin embargo, siendo honesto mientras exploraba las exhibiciones exteriores, tanto a mí como a mi compañero nos picaron muchos mosquitos / insectos y, por lo tanto, ¡estuvimos bastante impacientes cuando exploramos las exhibiciones internas debido a la incomodidad! Definitivamente recomendaría a los compañeros de viaje que se aseguren de tener repelente de mosquitos / insectos cuando visiten a pesar de que sea temprano en la mañana alrededor de las 9:30 a.m. También hay muchos asientos/bancos en las exhibiciones exteriores si las personas necesitan tomar descansos regulares debido a la falta de movilidad, así como a la gran cantidad de vida silvestre que reside aquí. Logramos ver muchas iguanas, lagartijas, pájaros y algunas serpientes; que disfrutamos mucho!",Pareja,4,"Wolverhampton, UK",17 de mayo de 2023,may de 2023
Una lástima.,"Un museo totalmente abandonado. Lo único que le da valor son las piezas históricas y las ruinas, SI es que uno mismo le quiere dar el valor e investigar, puesto que no hay guías, casi no se ve que haya personal, lo mínimo de guardias en las zonas arqueológicas (donde pudimos ver muchos turistas extranjeros saltarse los caminos y subir a las ruinas para sacarse fotos, todo sin que nadie se percatara puesto que la seguridad es prácticamente nula).No hay sitios para llenar tus botellas con agua sabiendo el calor que hay en esta zona, la mitad del museo está cerrado, los baños inmundos incluso muchos sin funcionamiento, los lockers TODOS fuera de servicio, no hay nadie revisando que quien entra no se lleve nada. Una vergüenza la falta de respeto con su propia cultura.Una decepción que demuestra como las administraciones se llenan la boca hablando de la cultura maya, colocándole nombres en lengua maya a hoteles, parques, restaurantes, resorts y demás pero en la práctica no hay interés. Me voy con un muy mal sabor de boca de mi viaje a México.",Pareja,1,Angy,26 de abril de 2023,abr de 2023
Regular,"Pasamos por ahí con muchas expectativas, si bien es bastante interactivo teniendo en cuenta la fecha en que se abrió nos decepcionó un poco que sea privado, tiene dos partes, la parte de exposición moderna no nos gustó para nada",,3,Irina Marturet,23 de abril de 2023,abr de 2023
Altamente recomendable para aprender de la cultura Maya,Tiene cosas muy interesantes. Sin lugar a duda sirve para tener una visión de la cultura Maya y su importancia en la civilización. Me encantó.,Familia,5,"Cancún, México",9 de abril de 2023,abr de 2023
¡Aléjate de la playa y la fiesta de la zona hotelera de Cancún y aprende sobre la historia y cultura maya!,"No se debe perder el caminar por la parte exterior del museo hasta la impresionante pirámide. El sitio ahora se llama San Miguelito, y una vez fue parte del sitio justo al final de la calle, ahora llamado El Rey. El desarrollo dividió/destruyó el sitio, pero vale la pena visitar ambas partes. Las exhibiciones interiores del museo son hermosas y fascinantes, con algo de información en inglés. ¡Nos hubiera encantado aún más explicación y etiquetado tanto en español como en inglés, e incluso una tienda del museo! Ninguna tienda fue bastante sorprendente. Parece que el museo y el sitio de El Rey están subutilizados y apreciados por las personas que visitan Cancún, así como por los que viven en la zona.",,4,"Ithaca, Estado de Nueva York",2 de abril de 2023,mar de 2023
Toda una joya maya ubicada en el centro de la zona turística. Vaya antes de visitar Tulum o Chicen Itz. es esclarecedor..,"Esta es una joya llena de historia y cultura que lo aleja del mundo turístico fuera de sus muros. A medida que sube por la rampa en espiral hacia el área de exhibición, comenzará a adentrarse en la fauna que alguna vez estuvo por todo Cancún. Escuchará pájaros nativos del área y verá hermosos árboles y plantas. Dentro del museo caminarás por la historia maya. No te pierdas el video sobre la evolución cultural de las ciudades y cómo Tulum y Chichén Nitza se entrelazan con la historia de Yucatán. Esta es una pequeña joya en el centro de una zona turística muy concurrida. En el museo, verá muchos ejemplos de la cultura y la historia maya. Afuera, experimentará un paseo por el yacimiento arqueológico.Sitio en el que no serás consciente del mundo moderno que se encuentra afuera si son paredes de manglares y almendros. Las reliquias arqueológicas alinean los casos. Algunos están en inglés y español. Se puede comprar un folleto de guía en la biblioteca por una pequeña tarifa. tasa. Después de las exhibiciones del museo, salga por el sitio arqueológico San Miguelito y dé un paseo por la fauna. Se pueden ver muchas aves y plantas nativas, así como varias iguanas. El sendero para caminar bien usado lo guía a uno a través de un sitio maya clásico 1100-1250.",Amigos,5,"San Pedro, Belice",27 de marzo de 2023,mar de 2023
hermosa historia,"Mi familia reservó un viaje de pesca durante nuestro viaje a Cancún y la pesca no es lo mío. Así que estaba buscando algo que hacer durante el día. Me topé con el Museo Maya de Cancún y me alegré de haberlo hecho. Ubicado un poco en el lado norte de la Zona Hotelera, pude caminar desde el Marriott Cancún unos 25 minutos. Una vez que llegué, comencé a notar que esto definitivamente estaba dirigido a los lugareños más que a los turistas, lo cual fue genial. Tenían tal vez el 25 % de la señalización en inglés y el 100 % de la señalización estaba en español. Afortunadamente, el traductor de Google es muy fácil de usar. jajaja. Me encantó la cerámica y la historia de todas las exhibiciones. Es sorprendente cómo las cosas de 2000 años pueden seguir siendo tan absolutamente hermosas. Caminar afuera alrededor de las ruinas también fue genial. Puedes sentir la historia a tu alrededor. Pasé aproximadamente una hora y media en el museo pero por $ 5 usd no puedes superar la experiencia si te encanta la historia.",,4,"Allen, TX",10 de marzo de 2023,mar de 2023
visita divertida,Esta fue una excursión divertida y económica. No estaba lleno. Recomendamos encarecidamente comprobarlo. Los artefactos eran increíbles. Fue agradable aprender sobre la historia local.,Familia,5,Virginia,10 de marzo de 2023,mar de 2023
Esperaba mas,"El lugar es agradable, tiene una muestra pequeña pero valiosa de la cultura maya, pero  no ofrecen servicio de guianza, no hay personas que te ayuden con esto, no hay tienda de souvenirs, no hay cafetería y los baños, el día que estuvimos estaban sucios.",Pareja,3,Rionegro,26 de febrero de 2023,feb de 2023
Museo maya y zona arqueológica,"Es un museo sobre la cultura maya en general y sobre los mayas en la zona de Quintana Roo, también ofrece una exhibición sobre otras culturas indígenas de México. Tiene una zona arqueológica de la zona. Es un poco pequeño pero es bastante interesante.",Familia,4,"Es un museo sobre la cultura maya en general y sobre los mayas en la zona de Quintana Roo, también ofrece una exhibición sobre otras culturas indígenas de México. Tiene una zona arqueológica de la zona. Es un poco pequeño pero es bastante interesante.",2 de febrero de 2023,ene de 2023
Vale la pena,"Esta fue una buena relación calidad-precio. Pasamos alrededor de una hora entre el museo y el sitio arqueológico, después de visitar El Rey. Hay una buena variedad de artefactos y una buena explicación de su significado. La zona arqueológica estaba serena y pacífica. Incluso si no tienes demasiado interés en las ruinas, valdría la pena solo por la caminata. Se sentía como un oasis en el caos de la zona hotelera. Hay algo de vida silvestre (una iguana me sorprendió en el camino), que les gustó a mis hijos. Sentí que aprendí algo sobre la cultura mexicana prehispánica.Este lugar es fácil de identificar: está en el lado este de la calle y hay un gran letrero, por lo que puede decirle al conductor del autobús que se detenga.",,5,charles o,28 de enero de 2023,ene de 2023
Artefactos y ruinas geniales,"¡Este museo está cerrado los lunes! Descubrimos esto de la manera más difícil - jajaja. ¡No estoy seguro de cómo nos perdimos eso! Me alegro de haber vuelto otro día ya que hay muchas piezas interesantes para ver de muchas áreas. Cuesta 70 pesos por persona la entrada. Hay algunas descripciones en inglés, pero no muchas. Estábamos familiarizados con algunas áreas y la historia para poder reconstruir lo que estaba escrito. Esta es una instalación grande ya que incluye ruinas en el exterior que también puedes ver. No pudimos encontrar una guía para hacer un recorrido por nosotros, pero nos las arreglamos por nuestra cuenta. Llevaría buenos zapatos, agua, repelente de insectos y un sombrero para mayor comodidad cuando esté de gira al aire libre. Recomiendo encarecidamente este sitio para visitar - permita 2 1 / 2 - 3 horas . Pequeña tienda de regalos en el sitio",Pareja,5,"Grande Prairie, Canadá",9 de enero de 2023,ene de 2023
lección de historia muy interesante,Un museo pequeño pero muy informativo: dio una gran comprensión del área. ¡El sitio de San Miguelito en los terrenos fue una agradable sorpresa!,Pareja,5,"South Amboy, Nueva Jersey",6 de enero de 2023,ene de 2023
Vale la pena una visita,"Este museo ofrece una visión del arte y la vida de las diferentes culturas que vivieron en México, incluida la maya. El museo es fácil de recorrer y exhibe algunos artefactos impresionantes que no debe perderse. Además, el precio es muy razonable y se puede llegar fácilmente al museo desde cualquier lugar desde la zona hotelera tomando un autobús. La tienda de regalos también tiene algunos recuerdos únicos por una fracción del precio que obtendrías en cualquier lugar de la zona hotelera.El sitio arqueológico de la calle Migelito ubicado al lado del museo (incluido en la tarifa de entrada) es una visita obligada. El bosque, las ruinas y la atmósfera pacífica que rodea el sitio te hacen sentir como si hubieras hecho un viaje en el tiempo.",,4,"Dublín, Irlanda",5 de enero de 2023,dic de 2022
Gran museo maya,"Este es un muy buen plan para conocer más acerca de la cultura maya y su historia, es un poco chiquito pero es muy bueno",,4,"Santo Domingo, República Dominicana",21 de noviembre de 2022,nov de 2022
