Titulo,Review,TipoViaje,Calificacion,OrigenAutor,FechaOpinion,FechaEstadia
Promiedo la verdad no para volver,"El museo la verdad  no está tan lindo y les falta mejorar muchas cosas… para empezar deberían mejorar el aire acondicionado se siente muy sofocado adentro de las salas .. ( la única zona donde había aire acondicionado era la tienda de souvenirs) y aparte muy pocas piezas en exhibición.. y solo hay 2 salas y todo lo demás es zona arqueológica… se ve que el gobierno y INAH no le meten tanto presupuesto, aunque también lo bueno es que tiene bonita fachada .. la verdad no volvería a menos de que lo mejoraran.",,3,1 aporte,9 de agosto de 2025,ago de 2025
"Identidad, Cultura y Patrimonio","El Museo Maya en verdad que nos muestra como fue parte del desarrollo de la civilización Maya y sus alrededores, ademas de conservarse en el tiempo. Así mismo la zona arqueologica esta realmente conservada y cuidada. Es una aventura para quienes gozan y disfrutan de la historia, la cultura y la naturaleza.",Amigos,5,Sami.Frank,11 de julio de 2025,jul de 2025
Decepcionada del lugar que debería ser un referente de Cancún,"Es un lugar abandonado por el gobierno, no funciona el aire acondicionado, no funciona el elevador, estructura deteriorada, no hay guías turísticos, no tiene ningún evento planeado, ni exposiciones temporales, le falta inversión y restauración , al ser una zona tan importante y turística no cumple las expectativas, lo bueno es que tiene rampas para movilizarse en silla de ruedas",Familia,1,Angie S,3 de julio de 2025,jul de 2025
¡Recomiendo!,"Realmente encantador museo muy barato y un montón de ruinas para ver fuera con un montón de hermosos paisajes. Si te gustan las iguanas están a la vuelta de cada esquina! Definitivamente traigo algún tipo de spray para insectos ya que tengo más de 20 picaduras por todo mí. La única cosa mala que tengo que decir sobre este lugar es que la pasarela a las ruinas tienen piedras que sobresalen del suelo, que también me tropecé y me corté el dedo del pie, así que tendría cuidado con eso. Y las habitaciones no tienen aire acondicionado, así que hace mucho calor allí.",Familia,4,"Aberdeen, UK",18 de junio de 2025,jun de 2025
¡Ciudad Iguana!,"¡El museo fue un descanso muy necesario de la escena festiva del hotel resort de Cancún! Disfruté de los artefactos y la información, y la caminata por la jungla/ruinas, sin embargo me perturbaron mucho las iguanas en el camino y de hecho trepé una barrera para evitar una, ¡si no te importan los lagartos salvajes, estarás bien! Se lo recomendaría a cualquiera, ya que el museo y el paseo cuestan solo 100 pesos; creo que los turistas pagarían más para mantenerlo en funcionamiento. Hay una linda tienda y si necesitas una bebida fría, el 7/11 al otro lado de la calle tiene muchas y tiene aire acondicionado.",Amigos,4,"Nottingham, UK",9 de junio de 2025,jun de 2025
Cancún-Museo de Maya y San Miguelito,"El relativamente nuevo Museo de Maya y las ruinas de San Miguelito están a poca distancia - a poco menos de una milla - de la Fiesta Americana Condesa. O uno podría tomar el autobús. Lo caminamos, y tomamos un Uber de vuelta ya que se había puesto bastante caliente. El museo es bastante modesto, pero ofrece información interesante sobre la historia y la cultura maya. Desde allí contiguas -e incluidas en el precio de la entrada- se encuentran las ruinas de San Miguelito. Muchas exploraciones a pie se pueden hacer a través del bosque allí. ¡Muchas iguanas!",Pareja,4,"Fairfield, CA",31 de mayo de 2025,may de 2025
Vale la pena una visita,"Un museo muy educativo, pequeño con ruinas mayas adyacentes. Una gran manera de pasar un par de horas. Recomiendo encarecidamente una visita",Pareja,5,"Cambridge, UK",19 de mayo de 2025,may de 2025
Musuem maya,"Increíble museo para aprender cultura maya ambiente limpio, fácil acceso. Las placas están en español, así que toma tu teléfono para la traducción.",Solitario,5,1 aporte,16 de abril de 2025,feb de 2025
Gran actividad barata y fácil de hacer después del almuerzo cuando está súper caliente y brillante,"Vinimos aquí una tarde para tomar un descanso del calor del mediodía y el sol. Fue una visita agradable y fácil. Esto es en la zona hotelera. Nuestro niño de 7 años disfrutó caminando por la parte exterior a través de la selva (en busca de iguanas). Era agradable y sombrío y pacífico. La parte interior estaba bien. Esta es una gran actividad barata y fácil de hacer después del almuerzo cuando hace mucho calor y luz, para mantenerse alejado del sol! Podríamos haber tomado un autobús por 12 pesos o $ 1 USD de nuestro hotel, pero no nos dimos cuenta.",Familia,5,"Chicago, IL",1 de abril de 2025,mar de 2025
Gran museo y zona arqueológica increíble,"Pasamos por una visita por la tarde y realmente disfrutamos del museo, pero nos sorprendió el arqueológico por lo que se puede caminar por todos los restos de un pueblo que existía hace mucho tiempo. Las señales en todo el sitio están en inglés y español. Está bastante sombreado en la mayoría de los caminos y, sin embargo, hay manchas solares para que las iguanas tomen el sol. Un gran lugar para visitar. Hacía bastante frío a la sombra con la brisa de hoy.",Pareja,5,"Ponte Vedra Beach, FL",28 de marzo de 2025,mar de 2025
Artefactos interesantes - Vale la pena visitar,"Tuve una mañana libre en la Zona Hotelera así que tomé un Uber a este museo y ruinas. El lugar parecía bastante deteriorado, pero después de caminar 8 rampas hasta el nivel del museo, la habitación con los artefactos valió la pena el esfuerzo. Las placas de cada artefacto están en español, así que usé la cámara de mi iPhone con Google Translate para entender lo que estaba mirando. Fui alrededor de las 9: 30 am un miércoles y no había cola y muy poca gente allí. Puedes tomar fotos. Después de pasear por el museo bajé y caminé por el camino de las ruinas. Los restos del templo y la casa eran un agradable paseo por los árboles. Bonita sombra pero muy húmeda, por supuesto. Cuando terminé caminé una milla hasta Playa Delphines y disfruté de algún tiempo allí antes de tomar un Uber de regreso a mi hotel.",Solitario,4,"Berthoud, CO",13 de marzo de 2025,mar de 2025
Tan triste su deterioro.,He estado aquí tres veces desde su apertura en 2013. El museo en sí no ha sido mantenido. Caliente. No hay aire. 81 grados. Ambos ascensores fuera de servicio. Tengo que subir 8 rampas. Pintura pelada en el exterior. Pasamanos oxidados. Corte de iluminación para ahorrar dinero. No otra vez.,Familia,2,Richard Schnur,11 de marzo de 2025,feb de 2025
Una visita obligada!! No te arrepentirás!!,"¡Es una visita obligada! ¡Era un museo bastante genial! Mi marido y yo nos tomamos una hora para caminar por la exposición interior y exterior. ¡Había muchos artefactos y ruinas geniales! El precio era genial, apenas había nadie allí, y tantas piezas geniales! Utilizamos Google Lente para ayudar con la traducción y resumir los tableros. También tenían algunos tableros en inglés. Recomendaría alejarse de las típicas atracciones turísticas y ver este museo!",Pareja,5,Bailey L,5 de marzo de 2025,mar de 2025
Museo Maya de Cancún,"El **Museo Maya de Cancún** es una institución cultural moderna dedicada a mostrar la rica historia y el legado de la antigua civilización maya. Ubicado en la zona hotelera de Cancún, el museo cuenta con una vasta colección de artefactos, incluyendo cerámica, esculturas, joyas y herramientas, muchas de las cuales fueron desenterradas de sitios arqueológicos cercanos. Diseñado con arquitectura contemporánea, el museo ofrece exposiciones tanto interiores como exteriores, incluido un exuberante jardín y el cercano **sitio arqueológico de San Miguelito**, que los visitantes pueden explorar. A través de sus atractivas exhibiciones y contenido educativo, el Museo Maya ofrece un viaje de inmersión en la cultura, la ciencia y el arte de los mayas, lo que lo convierte en un destino de visita obligada para los amantes de la historia y los viajeros curiosos por igual.",Amigos,4,"Estambul, Turquía",4 de enero de 2025,sept de 2024
Joya oculta una visita obligada,"Esta joya no se anuncia en los hoteles locales, aunque debería ser. Una increíble colección de artefactos mayas con carteles descriptivos en inglés y español (en la mayoría del museo). Las ruinas adyacentes no están reconstruidas, pero dan al visitante la sensación de lo que el propio Museo tiene amplia información. Un edificio precioso y accesible a la movilidad - visitantes discapacitados a través de un ascensor. Una excelente manera para que los turistas comiencen a informarse sobre una rica y profunda cultura local.",Familia,5,Vancouver,20 de diciembre de 2024,dic de 2024
Real joya que no te puedes perder,"Excelente experiencia cultural justo en la zona hotelera que no debe perderse. Es barato, bien diseñado con letreros principales detallados en español e inglés que explican la historia del pueblo maya. Algunos letreros de exhibición están solo en español, pero se traducen fácilmente con una aplicación de traducción en un teléfono inteligente. También hubo una exposición itinerante sobre conchas, incluido su uso en artefactos antiguos. Otro aspecto destacado son las ruinas arqueológicas del sitio rodeadas de selva con senderos y señales claramente marcadas. Esta es una verdadera joya y un excelente escape de la ruidosa oleada de tráfico en Cancún. El edificio y el sitio es fresco, agradable y con personal servicial, sin pretensiones.",Pareja,5,Sarah S,6 de diciembre de 2024,dic de 2024
Un bonito descanso del complejo,"Mi esposa y yo pasamos unos 45 minutos explorando los terrenos y otros 45 minutos experimentando las exhibiciones interiores. Habríamos pasado más tiempo afuera mirando las ruinas mayas reales, pero los recientes aguaceros dejaron algunos senderos inundados limitando donde podríamos caminar sin mojarnos los pies realmente. Las etiquetas y letreros están en español e inglés. El museo en sí está elevado con rampas para subir y bajar - - el ascensor estaba fuera de servicio - durante nuestra visita. El museo es fácil de llegar desde cualquier parte de la Zona Hotelera utilizando el autobús público que solo cuesta 12 pesos (menos de $ 1 USD) por persona y viaje. Los autobuses llegan cada 5 minutos aproximadamente durante el día. Lo recomiendo - - es un buen descanso cultural del complejo.",Pareja,4,"Ypsilanti, MI",27 de noviembre de 2024,nov de 2024
Recomendado,Fue un recorrido rápido por que la lluvia pero sobre todo los mosquitos no nos dejaron disfrutarloEs un museo céntrico que no debes dejar de visitar aunque se ve la falta de mantenimiento.Agradecemos al personal que fueron muy honestos al ingresar de que había muchos mosquitos y así fue,Familia,5,"Cabo San Lucas, México",24 de noviembre de 2024,jun de 2024
Info en inglés claro,"Precio de oferta 95 Peso, solo Peso aceptado a la llegada. No hay necesidad de reservar con antelación a menos que sea temporada alta. Toma alrededor de 2 horas para dar la vuelta a las exposiciones y hacer las ruinas al aire libre. Tendrá que dejar su vientre y mochila con seguridad o conseguir un casillero. Estaba lloviendo cuando te visité, pero los árboles te mantienen seco. No hay mucha información en inglés, pero se puede traducir en su teléfono. Se pueden tomar fotos, pero el uso de flash está prohibido, solo rebotaría en el vidrio de todos modos. Observé que las exhibiciones podrían haber estado mucho mejor iluminadas. En general, una gran manera de pasar unas horas en un día de mal tiempo. Pídele al conductor del autobús que te deje afuera, pero es mucho mejor que le muestres en tu teléfono a dónde quieres ir primero, no todos los conductores están informados - sobre los lugares de interés más pequeños.",Solitario,5,"Manchester, UK",24 de septiembre de 2024,sept de 2024
Visita de verano al Museo del Templo Maya (junio de 2023),"Fue genial ver muchos artefactos en el museo, leer sobre diferentes templos alrededor de México y usar el sendero para caminar para ver las ruinas afuera. Es un gran lugar para visitar y aprender sobre la historia y cómo las comunidades estaban en la cultura maya. Pasamos un par de horas aquí disfrutando de las muchas cosas para leer y ver. Ir temprano en la mañana para vencer el calor, y llevar una botella de agua para mantenerse hidratado. Dos cosas que recomendar antes. 1 - El museo solo toma pesos mexicanos. No se aceptan divisas ni tarjetas de crédito de EE. UU. — 2 - Use spray para insectos. Fuimos en junio, y los insectos estaban picando.",Familia,5,"Roosevelt, UT",25 de agosto de 2024,ago de 2024
Tour rápido con muchos artefactos,"Este era un buen museo para un descanso rápido del sol. Tardó una hora en pasar. Muchos artefactos, pero si eres de los que le gusta leer una descripción de todo, ten en cuenta que todas las descripciones están en español. Sin embargo, hay historias generales en inglés en todas las áreas. Las ruinas de San Miguelito detrás del museo es un bonito paseo por un bosque tropical. No esperes grandes ruinas, es más que nada la construcción de los cimientos. Asegúrate de usar spray para insectos. ¡Los mosquitos son feroces allá atrás!",Familia,4,"Gibsonburg, OH",25 de junio de 2024,jun de 2024
Superó las expectativas muy económico.,"El lugar era simple pero no pagas casi nada, por lo que este lugar definitivamente superó las expectativas. La única queja fue que hubiera sido bueno tener un poco más de inglés, pero no arruinó la experiencia.",Solitario,4,Janet and Shawn M,10 de junio de 2024,jun de 2024
Gran experiencia,"El museo muestra el arte y la vida de diferentes culturas mexicanas, incluida la maya. Es fácil moverse y muestra artefactos impresionantes. La entrada es asequible y se puede acceder cómodamente desde la zona hotelera en autobús. La tienda de regalos ofrece souvenirs únicos a precios más bajos que en la zona hotelera. Junto al museo, la calle. Vale la pena visitar el sitio arqueológico de Migelito, que brinda una atmósfera tranquila en medio de ruinas y bosques.",Amigos,5,"San Diego, CA",29 de mayo de 2024,may de 2024
Pequeño museo y ruinas,"Un pequeño museo con algunos artefactos mayas interesantes algunos con traducciones al inglés. El museo está arriba, en la planta baja hay algunas esculturas modernas y caminos a un pequeño asentamiento maya y ruinas.",Pareja,4,"Pagosa Springs, CO",27 de mayo de 2024,may de 2024
Exposiciones interesantes,"Las exposiciones fueron muy interesantes. Realmente genial ver lo bien conservadas que están algunas cosas. Las descripciones estaban en español así que cepíllate. El museo en sí toma tal vez treinta minutos. También tienen algunas ruinas afuera. ¡Muchas iguanas! El camino también está bastante bien sombreado. Si quieres ver más ruinas, El Rey está a un corto trayecto en autobús por la zona hotelera.",Pareja,5,Abigale L,24 de mayo de 2024,may de 2024
¡Valió la pena!,"Este es un gran museo con algunos artefactos impresionantes. Vale la pena una visita, especialmente antes de salir a visitar otros sitios de importancia. Los jardines con las ruinas eran un punto alto y vi un montón de iguana. La única desventaja como mencionan algunos otros visitantes es no tener exhibiciones en más de un idioma o la capacidad de hacer una gira de audio. Fácil y barato de llegar. Vale una o dos horas.",Solitario,4,"Nelson, Nueva Zelanda",5 de mayo de 2024,may de 2024
Joyas ocultas: ¡obtén algo de cultura mientras estás de vacaciones!,Gran museo con maravillosas exposiciones y explicaciones de la historia de la cultura maya. Precioso paseo exterior a través de algunas ruinas también. Tómese un descanso de la playa y el sol y llegar a esta pequeña joya!,Familia,5,Delaware,3 de mayo de 2024,ene de 2024
Tómese un tiempo fuera de la playa para la cultura maya,"Pequeño y valioso museo maya en un edificio modernista diseñado por el arquitecto Alberto García Lascurain. Alberga algunos de los artefactos más importantes de Yucatán. El ascensor estaba fuera de servicio, lo que nos obligó a caminar por el largo Guggenheim - como escalera circular. El ambiente es húmedo, haciendo el paseo extenuante. Los artefactos valen la pena, sin embargo, al igual que el video que explica Tulum y el extenso comercio comercial del sur de México prehispánico. ¡Traiga repelente de insectos!",Amigos,4,"Pequeño y valioso museo maya en un edificio modernista diseñado por el arquitecto Alberto García Lascurain. Alberga algunos de los artefactos más importantes de Yucatán. El ascensor estaba fuera de servicio, lo que nos obligó a caminar por el largo Guggenheim - como escalera circular. El ambiente es húmedo, haciendo el paseo extenuante. Los artefactos valen la pena, sin embargo, al igual que el video que explica Tulum y el extenso comercio comercial del sur de México prehispánico. ¡Traiga repelente de insectos!",30 de abril de 2024,abr de 2024
Agradable diversión en el museo,"El museo está bastante subestimado y no es publicitado por los complejos turísticos, y fue una variación bienvenida de las actividades en la playa. Por la mañana, es un agradable paseo bordeado de árboles alrededor de las ruinas mayas (parte del museo). ¡También hay muchas iguanas para ver!Las exhibiciones eran relativamente pequeñas y tenían algunos ejemplos decentes de arte maya: cerámica, estelas, joyas de jade, etc. y las descripciones del museo ofrecían una buena descripción general de las cronologías históricas y políticas del área, que eran interesantes. Volvería y traería a mi hijo de 14 años.Hice una parada rápida de 15 minutos en el cercano El Rey, que era un pueblo campesino para los trabajadores de la sal del cercano sitio arqueológico de Cobá.",Solitario,4,"McLean, VA",18 de marzo de 2024,mar de 2024
Apoya este hito cultural si puedes.,"Este es un pequeño museo en el extremo sur de la Zona Hotelera de Cancún, construido junto a las ruinas de un antiguo pueblo pesquero maya con un pequeño templo piramidal. Es un agradable oasis en la jungla en medio del concreto, el césped y los setos de hibisco de las propiedades del hotel. La sala contiene cerámica y artefactos mayas originales y una exhibición de arte; desafortunadamente, todas las placas están en español, pero eso no es un obstáculo para los teléfonos modernos. Pueden traducir texto fotografiado.El costo de la entrada es de 90 pesos para visitantes mayores de 12 años. o.Una vez que salgas del salón, podrás caminar por los senderos entre las ruinas bajo los ficus, asustando a las iguanas, grandes y pequeñas, algunas son del tamaño de pequeños dragones y verás al menos una docena en el camino.De todas las cosas turísticas para hacer en Cancún, quería apoyar esta más, así que fuimos allí varias veces, ya que estaba ubicado frente al hotel, y realmente fue el único lugar que visité en este viaje que no No intentes cobrarle más a un turista extranjero; )",Familia,5,"Anchorage, AK",16 de marzo de 2024,mar de 2024
¡Vaya después de un viaje a El Rey o simplemente vea las ruinas allí!,"Encontramos un guía turístico local que llevó a mi familia a las ruinas de El Rey antes de dirigirnos al museo. No tenía idea de que habría más ruinas en el terreno. Hay un camino muy claro, ligeramente elevado y sombreado, y se vuelven más impresionantes con cada curva. En el interior encontramos algunos artefactos de El Rey de los que nuestro guía nos había hablado mientras estuvimos allí. Combinar los dos e ir con alguien con conocimientos marcó la diferencia y mis gemelos de 8 años aprendieron mucho.Lo encontramos a través de su Instagram: adriancaveguide",Familia,5,Companion448792,27 de febrero de 2024,feb de 2024
Un fantástico pequeño viaje de un día.,"Este es un museo pequeño pero que vale la pena. Tiene una maravillosa colección de artefactos mayas con paneles explicativos que le brindan una idea de la asombrosa historia y cultura de esta que alguna vez fue una gran civilización. Después del museo, debes realizar la caminata hasta las ruinas de San Miguelito. No es muy largo, pero es muy interesante.El costo para ingresar al museo y a las ruinas es bajo y el personal de servicio en la pequeña tienda de regalos es muy amable. Es fácil tomar transporte público desde la ciudad o la Zona Hotelera hasta el museo y ¡el costo es de sólo 10 pesos! ¡Un pequeño viaje de un día interesante e informativo!",Pareja,4,"Hamilton, Canadá",18 de febrero de 2024,feb de 2024
Vale la pena ir si estás en la zona.,"Si estás de vacaciones en un resort familiar en Cancún y no tienes tiempo para viajar a ninguno de los principales sitios o museos mayas en otras partes de México, entonces este lugar es una pequeña joya agradable para pasar una hora. Un museo muy pequeño y algunas ruinas afuera.",Familia,4,"Si estás de vacaciones en un resort familiar en Cancún y no tienes tiempo para viajar a ninguno de los principales sitios o museos mayas en otras partes de México, entonces este lugar es una pequeña joya agradable para pasar una hora. Un museo muy pequeño y algunas ruinas afuera.",11 de febrero de 2024,feb de 2024
Debes verlo,"Hermoso museo, muchas exhibiciones y sitio de exploración de ruinas. Ideal para familias, accesible en autobús, no se necesita transporte y a un precio razonable.",Familia,5,Lindsey S,30 de enero de 2024,ene de 2024
Vale la pena pagar una lección de historia y caminar entre ruinas.,"¡Un pequeño gran museo! En el interior hay muchos artefactos de toda la región: vasijas de barro, joyas de jade ornamentadas, incienso/artículos funerarios, bloques grandes con tallas, estatuas, etc. - los letreros debajo de cada artefacto están en español, pero las placas de señalización principales en cada área están en ambos Inglés y español para que puedas entender la historia/descripciones de artefactos en cada sección. La historia de las líneas de tiempo y los mapas de las civilizaciones fue fascinante. $5 usd entrada gratis vale la pena. Tomamos el autobús desde N Cancún, es muy fácil de navegar y el museo estaba a pasos de la parada de autobús. El autobús cuesta 12 pesos.Era agradable caminar por los terrenos exteriores, hay un sendero a través del bosque tropical que serpentea a través de las ruinas descubiertas en esa área, un paseo serpenteante muy agradable entre un hermoso follaje. Hay enormes ceibas por todas partes y los terrenos están meticulosamente cuidados. La forma en que rastrillan eficientemente las hojas alrededor de los caminos nos recordó un jardín zen japonés.",Pareja,4,"Baltimore, MD",18 de enero de 2024,ene de 2024
Museo Maya de Cancún - No te pierdas esta joya.,"Museo muy bien curado en medio del distrito hotelero. Bastante sorprendido de lo grande que era la propiedad, dada la comercialización circundante de toda la ciudad. Buenos ejemplos de artefactos a lo largo del tiempo. Increíble ver el crecimiento cultural de la civilización.Las ruinas exteriores eran fantásticas, no te saltes. El camino fue bastante fácil de navegar. Sólo ten cuidado con las iguanas que toman el sol donde quieran. Algunas eran bastante grandes.Pequeña tienda de regalos. No hay mucho de interés.Planifique una visita de entre 2 y 3 horas, más si está realmente interesado en la cultura maya.Fácil acceso desde dentro de la zona hotelera. Puedes utilizar el autobús R 1 o R 2 que pasa cada 5 minutos. Barato a 12 pesos mxn/por persona por viaje.",Pareja,5,"Pasadena, MD",9 de enero de 2024,ene de 2024
¡Joya escondida de un museo en la zona hotelera de Cancún! Traiga repelente de insectos,"Este museo está ubicado justo en la Zona Hotelera de Cancún, entre los resorts, ¡y vale la pena el viaje! Es un lugar sencillo y no un museo grande, pero la entrada solo cuesta 90 pesos por persona (~$ 5 americanos) y vale mucho más. Se necesitan aproximadamente 1 . 5 horas para recorrer e incluye increíbles estatuas coloridas de criaturas míticas y un sendero al aire libre donde puedes ver ruinas mayas históricas.Hay una pirámide y varios cimientos. A diferencia de Chichén Itzá y Tulum (que también visitamos y nos encantaron), este museo presenta las casas de ciudadanos mayas ""normales"", que no había visto antes. Podrás ver y acercarte mucho a sus escalones y zonas de cocina, entre otras cosas, ¡y ver cómo vivía la otra mitad!Sólo una advertencia: dado que el sendero transcurre básicamente a través de una selva tropical, lleve repelente de insectos, ya que los mosquitos eran muy malos. Sin embargo, ¡no afectó nuestro disfrute! Visite también la tienda de regalos, que está llena de obsequios verdaderamente únicos que no son los ""souvenirs"" estándar que puede conseguir en el mercadillo.",Pareja,5,"San Francisco, CA",19 de diciembre de 2023,dic de 2023
Bonita experiencia maya,"Muy buen museo para aprender sobre la cultura maya de la región, todo el edificio está muy bien mantenido y definitivamente lo visitaría nuevamente ya que no tuve tiempo de escuchar las audioguías. . . Lo único que no me gustó fue que los baños están muy alejados de las atracciones, lo que obliga a esperar hasta terminar el recorrido con ganas de ir al baño.",Amigos,4,Hassan I,8 de diciembre de 2023,dic de 2023
