Titulo,Review,TipoViaje,Calificacion,OrigenAutor,FechaOpinion,FechaEstadia
Muy buena para pasar el rato🤽‍♂️😁,"En general los juegos acuáticos son muy buenos, nos la pasamos muy bien😋 y las modalidades también son variadas. Lo único que no nos pareció mucho fueron los precios , un poco elevados para lo que nos ofrecían. Cabe destacar que algunos juegos no se nos permitió el acceso por el límite de edad.",,5,,,ago de 2024
Inigualable,"La atención era buena,disfrutamos mucho en familia de los juegos acuáticos sin duda se repetirá  la visita nuevamente.",,5,,,jun de 2024
Ventura Park for kids,"This was more of a family and friends activity. I felt like the food court had long lines and not many options to choose from. The drinks were good, but there could have been more variety.",,3,"Playa del Carmen, México",,abr de 2024
Día de diversiones con primos,"Fui en octubre del año pasado, y debo mencionar que fue una experiencia buena para mis primos pequeños. He ido a otros parques y me hubiera encantado que en este tuviera un poco más de mantenimiento, la comida mejoró, ya igual fue en el 2023. El personal amable.",,4,"Cancún, México",,oct de 2024
Mal servicio al cliente.,"En el mes de enero ibamos a visitar el parque y un día antes nos cancelaron por medio de correo, mi esposo había comprado las entradas con anticipación.Y estas son horas que un mes después no le han hecho la devolución del dinero.Se entiende que haya situaciones donde se deba cerrar ese día y no recibir visitantes.Pero es el colmo que así que le dijeron que se duraban un mes, ahora le digan que se pueden tardar hasta 60 días.Cómo se va a durar tanto en devolver un dinero del que no se hizo uso de parte de nosotros, porque ni la entrada pisamos.",,1,,,ene de 2025
"Not much for adults, better for kids","I purchased tickets in advance on the website using a promo code. There weren’t many people inside, as we visited on the 25th of December. The water was cool, and only a few attractions were available. Overall, it might still be interesting for young children, but without kids, in my opinion, there’s not much to do here.",,3,"Kiev, Ucrania",,dic de 2024
Bueno pero no excelente ,"La experiencia no es mala sin embargo es frustrante que algunas atracciones las abren solo por cierto tiempo. Las olas son por 8 minutos a partir de la 1 pm. La comida no es nada espectacular, si necesita mantenimiento el parque.  Si agradezco que se preocupan por dar un buen servicio. La experiencia con delfines fue buena pero pensaba que era diferente. ",,3,"San José, Costa Rica",,dic de 2024
Todo bien,Jose nos ayudo y entrego un objeto perdido lo cual agradecemos muchísimo junto con luis mendez  Y excelente servicio :)),,5,,,dic de 2024
No vayan esta horrible lean reviews 🚫😡,"🚫🚫🚨🚨NO VAYAN 🚨🚨🚫🚫Les dare un breve review tardan 40min en acceder al parque y como 20min por atracciones, en lo go-karts la atención del personal NEFASTA, abrieron a la hora que quieren y con una actitud pesima el 80% del personal NO SABE NI INGLES. LOS HORARIOS DE ATRACCION ELLOS MISMOS NO RESPETAN Y ADEMAS ES MUY DIFÍCIL YA QUE SON HORARIOS CORTOS DE APERTURA, el bufet con comida insípida, FRIA , sin variedad NO VAYAN NO VALE LA PENA COME FRIO.El 80% de las actividades CERRADAS , con una excusa de el clima malo Sin embargo estuvo soleado. Y otras atracciones estuvieron en mantenimiento sin contar que esta super decaido el establecimiento parece no a ver staff gerencial que vea tantos detalles pesimos y absurdos. Leí muchos reviews MALOS ANTES DE IR Y ME LLEVE UNA SORPRESA QUE SON REALES 🚫🚫🚨🚨🚨corran la voz no vale la pena ir o pagar sumas grande equivalente a un Xcaret en general que dan mas atención desde personalAqui te atienden de malas 😡",,1,,,nov de 2024
Ya no vamos a volver,"Recuerdo que amaba ir a este sitio, y fue un decepción total mi última visita, fui con un amigo, incluso pagamos la interacción con delfines. Y sentimos que fue un error total, la comida no recuerdo que fuera tan mala, pero esta vez mucho que desear! En cuanto bebidas la oferta era limitada y además solo podías pedir dos, y el bar estaba bastante lejos y siempre con una fila enorme, perdimos medio día haciendo fila, pues en la misma fila nos acabábamos los dos vasos que nos daban 🙄 los toboganes bien! Pero en el más genial, ni siquiera nos dejaron subir por qué forzosamente teníamos que ser 3 🙄 esperamos media hora arriba esperando que algún solitario se apiadara de nosotros y totalmente en vano! En fin una experiencia bastante deplorable, aunque cabe mencionar que en cuanto atención siempre nos trataron bien. Es cuestión de logística! Que pueda fluir un poco más",,3,"Playa del Carmen, México",,jun de 2024
"Increíble, Santiago muy amable y muy divertida la actividad Watermania, fue muy divertido para los niños disparar, disfr","Increíble, Santiago muy amable y muy divertida la actividad Watermania, fue muy divertido para los niños disparar, disfrutamos mucho",,5,,,oct de 2024
Excelente lugar para los pekes,Excelente atención de Sarai en área de carrusel. Mi hija quedó encantada en los juegos y Sarai siempre estuvo al pendiente de ella.,,5,,,oct de 2024
Esta muy bueno la verdad,"Super lindooo , muy hamable la señorita  sarai linda persona muy atenta , los juegos para los niños son super se disfruta al maximo",,5,,,oct de 2024
Área de niños estuvo super,"Sarahí es muy amable en atención, fue paciente en atención, súper sonriente y carismática en la atención que nos brindó",,5,"Cancún, México",,oct de 2024
Ventura Park la más,"GoKartsUnderWorldAngelica Buena atención, me gustó la experiencia. Muy amable, Angélica muy atenta y amable. Los invito a todos a venir a este increíble parque",,5,,,oct de 2024
Mi experiencia enGo karts,"Espectacular los chicos muy atentos y en especial la chica Angélica de granprix muy amable y paciente,gracias a todos, mi mama quedo encantada fue feliz ese dia ya que rea su cumpleaños",,5,,,oct de 2024
Área de realidad virtual,"El area de realidad virtual está super padre, la explicación y atención de Karla excelente, sin duda volveremos a venir",,5,,,oct de 2024
Diversión,Muy bonito el lugar El joven Javier muy amable mi hijo se divirtió demasiado subiendo al caballito excelente lugar 100% recomendable,,5,,,oct de 2024
Estafa!,"Definitivamente el peor parque, está abierto desde las 10:00 pero a partir de las 12:30 activaron las olas en wet and wild, el resto de los atractivos estaban fuera de servicio o en mantenimiento. Es una pérdida de plata y tiempo, no habían bebidas ilimitadas como indicaba su oferta, solamente helados.",,1,,,oct de 2024
Estafa!,"Definitivamente el peor parque, no pierdan su tiempo ni dinero. El parque abre a las 10:00 y aproximadamente al medio día empezó a funcionar wet and wild, el resto no dejaron ingresar por mal estado “en mantenimiento” La comida horrible y tampoco había bebidas ilimitadas como indica su oferta, solamente helados. El lugar deteriorado. Lo único que vale la pena es nadar con los delfines en Dolohinaris lo cual no es necesario adquirir el boleto mediante Ventura Park.",,1,,,oct de 2024
Carruzel,"Excelente, muy bien la chava sarahy muy divertido agradable la gente sin filas  muy bonita la temática de hallowen recomendado el parque",,5,,,oct de 2024
Terrible experiencia,"Lo único rescatable del personal fueron el mesero Enrique y la señorita que esta en la realidad virtual, de ahí en fuera fue de las peores experiencias que he tenido.Cada lugar al que íbamos nos decían que estaba fuera de servicio o que ya estaba cerrado y nunca nos informaron sobre dichos horarios.La peor de todas fue una señorita que estaba a cargo de las tirolesas, responde de forma muy grosera y además pareciera que no tiene ganas de trabajar.",,1,,,oct de 2024
Grandprix,Exelente servicio  por parte de Santiago y Elizabeth en el grandprix una bonita experiencia  estuvo súper y toda la familia se divirtió.,,5,,,oct de 2024
Buen día.,"Absolutamente brillante día libre, todos los paseos fueron muy divertidos. Nuestros niños de 12 , 9 y 6 tenían muchas Cosas que hacer, río perezoso es un lugar encantador para relajarse después de los toboganes. Disfrutamos de las tirolinas y todo el personal era fantástico y bien entrenado. Realmente lo recomendaría todo, fuimos VIP que incluía comidas y bebidas, así que era una buena relación calidad-precio, la comida estaba claramente atendiendo a los lugareños, pero tenía hamburguesas, etc para los turistas. Ambos eran muy sabrosos, los baños y el parque estaban muy limpios, aunque no demasiado ocupado, así que no estoy seguro de cómo sería en temporada alta. Hubiera dado una Puntuación 5 estrellas pero por dos cosas, pagar un precio adulto por un niño de 12 años y luego decir que tenía que tener 13 para usar la experiencia Lazer fue ridículo. Con nuestro paquete VIP tuvimos la experiencia de los delfines y esto fue fantástico, tristemente el día estuvo un poco manchado por el costo extorsivo de las fotos de los delfines. $275 por fotos e incluso después de regatear lo mejor que pudimos obtener fue $200 por 6 fotos! Nos gustaría ir de nuevo, pero solo tenga en cuenta que incluso los huéspedes VIP tienen que pagar extra por taquillas y anillos perezosos.",,4,"Mainland, UK",,oct de 2024
Muy buena,La señorita sarai muy amable en los gokarts Excelente servicio 10/10. Buenos juegos muy divertido con la flaca excelente comida,,5,,,oct de 2024
Excelente,Muy bonito exceiente la operadora saray muy amable al momento de atendernos y dar las instrucciones en todo que siga asi,,5,,,oct de 2024
Natación con delfines,Increíble día nadando con Delfines gracias a Daphne! Mi novio hizo realidad su sueño de la infancia hoy y Daphne era genial con los animales y la gente!,,5,,,oct de 2024
Go kars,Me encanto la actividad de los go kars estuvo divertida mi familia se divertido y mi hijo es su primera vez entonces me encantó todo mucha diversión y gracias oor el trato Javier se los recomiendo,,5,,,oct de 2024
Ventura Park 🔝🔝🔝🔝,"Increíble experiencia, muy divertida para venir con amigos, rompimos récords en the mission y entramos a realidad virtual, experiencia 10/10",,5,,,oct de 2024
Excelente,"Buen lugar , atracciones muy divertidas , buenas actividades fuera del agua , la empleada vanessa muy atenta y amable  , excelente atencion",,5,,,oct de 2024
Buena atenta la mejor atenta la mejor actividad la recomiendo para venir,Muy bien la actividad de lo juegos la chica Vanesa muy atenta nos explicó muy sin duda regresaría de nuevo buena actividad,,5,,,oct de 2024
Excelente,Increíble atención (Sarahi)... fue una experiencia y espero regresar para seguir disfrutando este parque increíble.,,5,,,oct de 2024
Me gustaría más juegos para niños y adultos,Me gustarían más juegos para disfrutar en familia Angélica muy bien  muy amable  es atenta y me encantó realidad virtual gracias,,5,,,oct de 2024
Muy bu,"Santiago,Vannesa y Eli fueron muy atentos en todo momento en los got Cars muy buen servicio, bonito para pasar el rato en familia y amigos...",,5,,,sept de 2024
grandprix,"todo estuvo muy bonito .. Santiago, Vanesa y Eli personas muy atentas y amables ... la vista es muy hermosa 😊 una experiencia maravillosa",,5,,,sept de 2024
Aventura park,Nos encantó los go card estuvo genial y las personas que nos atendieron nos trataron muy súper increíble genial por Santiago Vanessa y Eli gracias por esta súper experiencia,,5,,,sept de 2024
No devolución de reserva,"Soy de Peru y en el 2020 pague una ""aventura fun + fantastic experience"" para 4 personas para el día 23/12/2020 a las 10 am su numero de confirmación fue 2vp-200311-0267579 , la pandemia nos obligo a no poder viajar desde Perú , así que solicitamos la devolución del dinero al sr RAFAEL GARCIA a su correo contactus@aventurapark.com después de muchos correos diciendo que me devolverían,NO me devolvieron el dinero tengo todos los correos de reclamos y las reservas , ahora que paso la pandemia voy a estar en Cancún con mi familia del 20/12/2024 al 25/12/2024 así que quiero que lo reconozcan .. pero nadie contesta … les he escrito por correo y por WhatsApp … solo hay silencio no se a quien recurrir es como ya olvidaré ya nos tiramos tú plata no tienes a quien reclamar …. Cuidado con esta empresa … con Xcaret , Latam no tuve problema me devolvieron todo .. menos Ventura Park … no hay forma de tener respuesta",,1,"Lima, Perú",,sept de 2024
Pésimo  servicio,Tienen que mejorar el bufet estuvo horrible no tienen suficiente personal los juegos estuvimos esperando más de 30 minutos y nos los abrieron para niños pequeños pésima actitud de los trabajadores,,1,,,sept de 2024
Es un lugar agradable y divertido para la familia,Muy divertido las actividades Muy linda atención de parte sarahiTodas las atracciones muy linda y limpiasLa seguridad 10/10,,5,,,sept de 2024
"Fue agradable,muy limpio, carritos buenos, superfuper,increíble,fantástico genial fantabuloso,impresionante,genial","Muy buena actividad, muy buen,muy grandiosa,muy eficiente, atención de vanessa y Santiago muy buena,eficiente,cordial,agradable,perfecta",,5,,,sept de 2024
Fuerte Accidente en Tirolesa,"El pasado Viernes 13 de Sept 2024 fui al Parque Ventura Park de Cancun el cual después de haber estado unos dias antes en Xcaret y Xplor era deprimente pero decidimos ir por el precio del boleto, decidimos subirnos a la tirolesa donde por descuido del empleado del parque, al estar abriendo la puerta de seguridad con la pierna y sin revisar si la puerta abria completamente, al levantarme y darme vuelo para llegar al otro lado de la tirolesa sin problema, no me di cuenta que la puerta no habia sido abierta por completo, lo cual me provocó un fuerte golpe en pierta y pie, los cuales después de una semama me duelen todavia bastante.",,1,,,sept de 2024
Excelente,Todo excelente me encantó la actividad las vueltas estuvieron super h me encantó el trato de oírte de Javier y vanessa se los recomiendo en los go kars,,5,,,sept de 2024
"Excelente, muy divertido  recomendable  para disfrutar con toda la familia","Excelente, muy atentos  los muchachos (vanesa, Javier y ely) todo muy con la indicaciones nos aclararon todas las dudas y espero volver y recibir el servicio  con los mismos jóvenes",,5,,,sept de 2024
Sarahí,Sarahí de el área de juego muy amable y servicial con mi hijo pequeño de 4 años fue muy cuidadosa con el todo muy bonito recomendado,,5,"Cancún, México",,sept de 2024
Súper día,"La atención de Santiago muy bien en el área de juegos de feria, muy atento y amable con los niños, carrusel, mundakkar y los carros de construcción",,5,,,sept de 2024
Ventura park,El parque es agradable el personal amable.  Estuvimos en los juegos de carros go cars con el chico Javier la visita estuvo excelente sin duda regresaría!,,5,,,sept de 2024
Grand prix,"Excelente atención, nos encantó muy divertido para pasar con la familia. Nos atendió Santiago y Vanesa. Muy atentos y amables",,5,,,sept de 2024
Gran prix,"Muy bien divertido , aunque pocas vueltas ... pero esta bien, amables el joven Santiago y Vanesa  .... apenas fue nuestra primer vuelta",,5,,,sept de 2024
"Diversion al 100, ambiente familiar","Comida deliciosa, area de juegos excelente, medidas de seguridad  interaccion con delfines muy linda al 100 con la trabajadora Vanessa",,5,"Ciudad Colon, Costa Rica",,sept de 2024
Buena experiencia,"Muy buena experiencia, me gustó divierte a los niños y la atención de vanesa muy buena los pepes se distraen mucho y permite que como papá nos relajemos",,5,,,sept de 2024
