Titulo,Review,TipoViaje,Calificacion,OrigenAutor,FechaOpinion,FechaEstadia
Visita a la Isla,"Me encantó visitar La Isla Cancún, excelente servicio y atención! Se los recomiendo la alimentación, hospedaje, limpieza, atención excelente.",Negocios,5,1 aporte,4 de diciembre de 2023,nov de 2023
Muy mala,Tuve un accidente ahí no hubo atención médica por parte de la plaza solo seguridad fue a preguntar lo ocurrido. Pésima atención en esoTuve que buscar durante dos horas ima Clínica particular. Soy turista me voy decepcipnsda de esa plaza y del servicio medico de Cancún,Familia,1,1 aporte,20 de noviembre de 2023,nov de 2023
Rueda del cielo,¡Gran paseo en la rueda del cielo! ! ! Fuimos por la tarde. Hermosas luces sobre la laguna. Esta fue una experiencia agradable.,Pareja,5,"Albemarle, Carolina del Norte",13 de noviembre de 2023,nov de 2023
La isla Cancún,Buen lugar para pasar el ratoVarias cosas por hacer Museo de ceraRippley Y la.rueda son una de esas cosas Me quedo a deber rippley siento que le faltan más cosa pero bueno En realidad en general es una plaza como cualquier otra pero al.aire libre y con paisajes muy bonitos,Pareja,5,"Cancún, México",6 de noviembre de 2023,nov de 2023
Valor muy alto en relacion a mi pais y eso que estaban con descuento,"El doble de caro a comparación con Chile y eso que los productos estaban con descuento, no compre nada.",Familia,2,"Santiago, Chile",5 de noviembre de 2023,nov de 2023
Centro comercial limpio,"Centro comercial muy limpio y tranquilo, no demasiado concurrido pero caro. Buen lugar para visitar si quieres un lugar para salir de tu hotel. Tienen Starbucks y McDonalds. El acuario es una visita obligada con los delfines.",Pareja,3,"Grace Bay, Providenciales",6 de octubre de 2023,oct de 2023
Para entretener un rato en un centro comercial,"Como cualquier centro comercial, solo q estás en Cancún, tiendas y demás restaurantes, típicos de un recinto semejante",Familia,4,"Ciudad de México, México",9 de septiembre de 2023,may de 2023
Hermosa experiencia,Hermoso lugar para recorrer visitar tomar helado y admirar todos los locales imperdibleEl acuario digno de visitar la vista a la laguna y los lugares para comer hay muchas opciones para elegir,,5,"Buenos Aires, Argentina",24 de agosto de 2023,ago de 2023
A matar el tiempo,Buen lugar para matar el tiempo si no vas en plan de compras y con mucho dinero para hacerlo. Algo sumamente incómodo solo los cientos de vendedores de tours qué no te dejan ni caminar y se quieren pasar de graciosos.,Pareja,4,"San Salvador, El Salvador",1 de agosto de 2023,ago de 2023
Buen Paseo para el final del dia,"Ente CC tiene de todo y para todos los gustos! Buenas tienes, el área nueva es muy buena.Solo dos detalles. Ante el gran calor que hay no existen áreas comunes cerradas ( Solo Tiendas ). Adicional el servicio de taxis el precio es una Locura, de hecho no solo allí, en todos lados es carisimo.",Familia,4,"Caracas, Venezuela",22 de julio de 2023,jul de 2023
Hay mejores opciones de shopping,"Me gustó su estructura con puentes y agua, pero los locales muy alejados, muchos vacíos. Se pierde mucho tiempo caminando de un lado al otro al ser tan extenso.",,3,Argentina,27 de junio de 2023,jun de 2023
buen centro comercial,"una plaza con mucha variedad, pero sobre todo extrovertida, le hace falta un poco más de limpieza en el lugar y cuidado en algunas zonas que se ven antiguas.",,4,Daniel W,7 de junio de 2023,jun de 2023
"Ve al acuario si estás aburrido. De lo contrario, ahorre su dinero de taxi.","No estoy seguro de quiénes son estas personas que dicen que el centro comercial es increíble. Mano a Dios, es solo meh. Honestamente deseé haber ahorrado el dinero del taxi y haberme quedado en el resort.Un par de tiendas decentes, pero 1/3 de los espacios parecen vacíos. Fui alrededor de las 11 am con mi esposa y dos niños pequeños. El acuario estaba bien. Después del acuario, solo nos quedamos unos 15 o 20 minutos más porque no había mucho que ver.",Familia,3,"Prosper, TX",7 de junio de 2023,abr de 2023
Mala experiencia,No me gustan los vendedores agresivos. También estaba tratando de mirar los restaurantes y diferentes empleados de diferentes restaurantes salían y arrojaban menús en nuestra mano y peleaban por nuestro negocio. Muy intimidante para mi prometido que nunca había experimentado algo así cuando solo estábamos tratando de tener una buena comida en vacaciones.,,1,Adam,6 de junio de 2023,jun de 2023
Hermoso,"Me encantó este shopping! Es super lindo. Fui varias veces, y si vuelvo a Cancun, volvería a ir nuevamente.",Pareja,5,"Santiago, Chile",13 de mayo de 2023,may de 2023
Compras,Visitar con mucho tiempo es grande y muy confuso su recorrido ya que es fácil perderse por tantos pasajes y puentes para cruzar.Esta buena y variada las marcas,Pareja,4,"Buenos Aires, Argentina",8 de marzo de 2023,mar de 2023
